id,text,,speaker,file,tagged,res_allit,res_both,res_both_updated,res_both_last_version,letters,label,Comments
10606,"Frau Präsidentin! Frau Bundesministerin! Meine sehr geehrten Damen und Herren ! Wir kommen jetzt zu einer Reihe von Unterstützungsmaßnahmen, wiederum für die Bevölkerung in Österreich, mit denen wir die Folgewirkungen dieser Coronapandemie bekämpfen und die Menschen auch bestmöglich unterstützen wollen: Die Sonderbetreuungszeit, auf die werde ich noch näher eingehen, und die Aufstockung um 1 Milliarde Euro bei der Investitionsprämie, die von unseren Unternehmerinnen und Unternehmern sehr gut angenommen wird. Das ist wirklich eine tolle Maßnahme, die sich vor allem auch im Bereich der Arbeitsplätze niederschlagen wird, auch in den Regionen. Es ist, denke ich, sinnvoll, wenn da investiert wird, um dementsprechend auch die Arbeitsplatzsituation zu verbessern. Weiters werden in den nächsten Punkten jetzt noch die Aufstockung beim Familienhärtefonds mit 40 Millionen Euro oder der Bildungsbonus behandelt.",46598,Abgeordneter August Wöginger,NRSITZ_00051_PARSED,"Frau	N.Reg.Nom.Sg.Fem Präsidentin	N.Reg.Nom.Sg.Fem !	SYM.Pun.Sent  Frau	N.Reg.Nom.Sg.Fem Bundesministerin	N.Reg.Nom.Sg.Fem !	SYM.Pun.Sent  Meine	PRO.Poss.Attr.-.Nom.Pl.Masc sehr	ADV geehrten	ADJA.Pos.Nom.Pl.Fem Damen	N.Reg.Nom.Pl.Fem und	CONJ.Coord.- Herren	N.Reg.Nom.Pl.Masc !	SYM.Pun.Sent  Wir	PRO.Pers.Subst.1.Nom.Pl.* kommen	VFIN.Full.1.Pl.Pres.Ind jetzt	ADV zu	APPR.Dat einer	ART.Indef.Dat.Sg.Fem Reihe	N.Reg.Dat.Sg.Fem von	APPR.Dat Unterstützungsmaßnahmen	N.Reg.Dat.Pl.Fem ,	SYM.Pun.Comma wiederum	ADV für	APPR.Acc die	ART.Def.Acc.Sg.Fem Bevölkerung	N.Reg.Acc.Sg.Fem in	APPR.In Österreich	N.Name.Dat.Sg.Neut ,	SYM.Pun.Comma mit	APPR.Dat denen	PRO.Rel.Subst.-.Dat.Pl.Fem wir	PRO.Pers.Subst.1.Nom.Pl.* die	ART.Def.Acc.Pl.Fem Folgewirkungen	N.Reg.Acc.Pl.Fem dieser	PRO.Dem.Attr.-.Gen.Sg.Fem Coronapandemie	N.Reg.Gen.Sg.Fem bekämpfen	VINF.Full.- und	CONJ.Coord.- die	ART.Def.Acc.Pl.Masc Menschen	N.Reg.Acc.Pl.Masc auch	ADV bestmöglich	ADJD.Pos unterstützen	VINF.Full.- wollen	VFIN.Mod.3.Pl.Pres.Ind :	SYM.Pun.Colon Die	ART.Def.Nom.Sg.Fem Sonderbetreuungszeit	N.Reg.Nom.Sg.Fem ,	SYM.Pun.Comma auf	APPR.Auf die	PRO.Rel.Subst.-.Acc.Sg.Fem werde	VFIN.Aux.1.Sg.Pres.Ind ich	PRO.Pers.Subst.1.Nom.Sg.* noch	ADV näher	ADJD.Comp eingehen	VINF.Full.- ,	SYM.Pun.Comma und	CONJ.Coord.- die	ART.Def.Nom.Sg.Fem Aufstockung	N.Reg.Nom.Sg.Fem um	APPR.Acc 1	CARD Milliarde	N.Reg.Acc.Sg.Fem Euro	N.Reg.Nom.Sg.Masc bei	APPR.Dat der	ART.Def.Dat.Sg.Fem Investitionsprämie	N.Reg.Dat.Sg.Fem ,	SYM.Pun.Comma die	PRO.Rel.Subst.-.Nom.Sg.Fem von	APPR.Dat unseren	PRO.Poss.Attr.-.Dat.Pl.Fem Unternehmerinnen	N.Reg.Dat.Pl.Fem und	CONJ.Coord.- Unternehmern	N.Reg.Dat.Pl.Masc sehr	ADV gut	ADJD.Pos angenommen	VPP.Full.Psp wird	VFIN.Aux.3.Sg.Pres.Ind .	SYM.Pun.Sent  Das	PRO.Dem.Subst.-.Nom.Sg.Neut ist	VFIN.Sein.3.Sg.Pres.Ind wirklich	ADJD.Pos eine	ART.Indef.Nom.Sg.Fem tolle	ADJA.Pos.Nom.Sg.Fem Maßnahme	N.Reg.Nom.Sg.Fem ,	SYM.Pun.Comma die	PRO.Rel.Subst.-.Nom.Sg.Fem sich	PRO.Refl.Subst.3.Acc.Sg.* vor	APPR.Vor allem	PRO.Indef.Subst.-.Dat.Sg.Neut auch	ADV im	APPRART.Dat.Sg.Masc Bereich	N.Reg.Dat.Sg.Masc der	ART.Def.Gen.Pl.Masc Arbeitsplätze	N.Reg.Gen.Pl.Masc niederschlagen	VINF.Full.- wird	VFIN.Aux.3.Sg.Pres.Ind ,	SYM.Pun.Comma auch	ADV in	APPR.In den	ART.Def.Dat.Pl.Fem Regionen	N.Reg.Dat.Pl.Fem .	SYM.Pun.Sent  Es	PRO.Pers.Subst.3.Nom.Sg.Neut ist	VFIN.Sein.3.Sg.Pres.Ind ,	SYM.Pun.Comma denke	VFIN.Full.1.Sg.Pres.Ind ich	PRO.Pers.Subst.1.Nom.Sg.* ,	SYM.Pun.Comma sinnvoll	ADJD.Pos ,	SYM.Pun.Comma wenn	CONJ.SubFin.- da	ADV investiert	VPP.Full.Psp wird	VFIN.Aux.3.Sg.Pres.Ind ,	SYM.Pun.Comma um	CONJ.SubInf.- dementsprechend	ADJD.Pos auch	ADV die	ART.Def.Acc.Sg.Fem Arbeitsplatzsituation	N.Reg.Acc.Sg.Fem zu	PART.Zu verbessern	VINF.Full.- .	SYM.Pun.Sent  Weiters	N.Reg.Gen.Sg.Masc werden	VFIN.Aux.3.Pl.Pres.Ind in	APPR.In den	ART.Def.Dat.Pl.Masc nächsten	ADJA.Sup.Dat.Pl.Masc Punkten	N.Reg.Dat.Pl.Masc jetzt	ADV noch	ADV die	ART.Def.Acc.Sg.Fem Aufstockung	N.Reg.Acc.Sg.Fem beim	APPRART.Dat.Sg.Masc Familienhärtefonds	N.Reg.Dat.Sg.Masc mit	APPR.Dat 40	CARD Millionen	N.Reg.Dat.Pl.Fem Euro	N.Name.*.*.* oder	CONJ.Coord.- der	ART.Def.Nom.Sg.Masc Bildungsbonus	N.Reg.Nom.Sg.Masc behandelt	VPP.Full.Psp .	SYM.Pun.Sent  ",True,Both,Standard,Standard,['u'],Alliteration,
10607,"Meine Damen und Herren! Mit diesem Bundesministeriengesetz, das wir heute beschließen werden, setzen wir die Schwerpunkte, die wir in dieser Regierungsperiode vorhaben, auch in der Gestaltung der Ministerien um. Es ist mir daher ganz wichtig, zu betonen, dass das neue Ministerium für Klimaschutz, Umwelt, Energie, Mobilität, Innovation und Technologie, das wir schaffen, eine Leuchtturmfunktion für ganz Europa haben wird. Da wird etwas zusammengeführt, was wir in Zukunft nicht mehr inhaltlich auseinanderdividieren lassen dürfen, denn unsere Aufgabe ist es, nachhaltig mit der Schöpfung und unserer Umwelt umzugehen.",18245,Abgeordneter Mag. Wolfgang Gerstl,NRSITZ_00008_PARSED,"Meine	PRO.Poss.Attr.-.Nom.Sg.Fem Damen	N.Reg.Nom.Pl.Fem und	CONJ.Coord.- Herren	N.Reg.Nom.Pl.Masc !	SYM.Pun.Sent  Mit	APPR.Dat diesem	PRO.Dem.Attr.-.Dat.Sg.Neut Bundesministeriengesetz	N.Reg.Dat.Sg.Neut ,	SYM.Pun.Comma das	PRO.Rel.Subst.-.Acc.Sg.Neut wir	PRO.Pers.Subst.1.Nom.Pl.* heute	ADV beschließen	VINF.Full.- werden	VFIN.Aux.1.Pl.Pres.Ind ,	SYM.Pun.Comma setzen	VFIN.Full.1.Pl.Pres.Ind wir	PRO.Pers.Subst.1.Nom.Pl.* die	ART.Def.Acc.Pl.Masc Schwerpunkte	N.Reg.Acc.Pl.Masc ,	SYM.Pun.Comma die	PRO.Rel.Subst.-.Acc.Pl.Masc wir	PRO.Pers.Subst.1.Nom.Pl.* in	APPR.In dieser	PRO.Dem.Attr.-.Dat.Sg.Fem Regierungsperiode	N.Reg.Dat.Sg.Fem vorhaben	VINF.Full.- ,	SYM.Pun.Comma auch	ADV in	APPR.In der	ART.Def.Dat.Sg.Fem Gestaltung	N.Reg.Dat.Sg.Fem der	ART.Def.Gen.Pl.Neut Ministerien	N.Reg.Gen.Pl.Neut um	PART.Verb .	SYM.Pun.Sent  Es	PRO.Pers.Subst.3.Nom.Sg.Neut ist	VFIN.Sein.3.Sg.Pres.Ind mir	PRO.Pers.Subst.1.Dat.Sg.* daher	PROADV.Dem ganz	ADV wichtig	ADJD.Pos ,	SYM.Pun.Comma zu	PART.Zu betonen	VINF.Full.- ,	SYM.Pun.Comma dass	CONJ.SubFin.- das	ART.Def.Nom.Sg.Neut neue	ADJA.Pos.Nom.Sg.Neut Ministerium	N.Reg.Nom.Sg.Neut für	APPR.Acc Klimaschutz	N.Reg.Acc.Sg.Masc ,	SYM.Pun.Comma Umwelt	N.Reg.Acc.Sg.Fem ,	SYM.Pun.Comma Energie	N.Reg.Acc.Sg.Fem ,	SYM.Pun.Comma Mobilität	N.Reg.Acc.Sg.Fem ,	SYM.Pun.Comma Innovation	N.Reg.Acc.Sg.Fem und	CONJ.Coord.- Technologie	N.Reg.Acc.Sg.Fem ,	SYM.Pun.Comma das	PRO.Rel.Subst.-.Acc.Sg.Neut wir	PRO.Pers.Subst.1.Nom.Pl.* schaffen	VFIN.Full.1.Pl.Pres.Ind ,	SYM.Pun.Comma eine	ART.Indef.Nom.Sg.Fem Leuchtturmfunktion	N.Reg.Nom.Sg.Fem für	APPR.Acc ganz	ADV Europa	N.Name.Acc.Sg.Neut haben	VINF.Haben.- wird	VFIN.Aux.3.Sg.Pres.Ind .	SYM.Pun.Sent  Da	ADV wird	VFIN.Aux.3.Sg.Pres.Ind etwas	PRO.Indef.Subst.-.*.*.Neut zusammengeführt	VPP.Full.Psp ,	SYM.Pun.Comma was	PRO.Rel.Subst.-.Acc.Sg.Neut wir	PRO.Pers.Subst.1.Nom.Pl.* in	APPR.In Zukunft	N.Reg.Acc.Sg.Fem nicht	PART.Neg mehr	ADV inhaltlich	ADJD.Pos auseinanderdividieren	VINF.Full.- lassen	VINF.Full.- dürfen	VINF.Mod.- ,	SYM.Pun.Comma denn	CONJ.Coord.Denn unsere	PRO.Poss.Attr.-.Nom.Sg.Fem Aufgabe	N.Reg.Nom.Sg.Fem ist	VFIN.Sein.3.Sg.Pres.Ind es	PRO.Pers.Subst.3.Nom.Sg.Neut ,	SYM.Pun.Comma nachhaltig	ADJD.Pos mit	APPR.Dat der	ART.Def.Dat.Sg.Fem Schöpfung	N.Reg.Dat.Sg.Fem und	CONJ.Coord.- unserer	PRO.Poss.Attr.-.Dat.Sg.Fem Umwelt	N.Reg.Dat.Sg.Fem umzugehen	VINF.Full.zu .	SYM.Pun.Sent  ",True,Both,Standard,Standard,['u'],Alliteration,
10608,"Geschätzter Herr Bundespräsident! Sehr geehrter Herr Präsident! Liebe Kolleginnen und Kollegen! Geschätzte Österreicherinnen und Österreicher! Heute ist ein sehr großer Tag für uns alle, die angelobt wurden. Jeder von uns trägt als Abgeordneter eine sehr, sehr große Verantwortung, und ich darf allen hier herinnen sehr herzlich gratulieren: allen, die es neu ins Parlament geschafft haben es gab ja noch nie so viele Junge und vor allem auch so viele Frauen in diesem Hohen Haus , vor allem aber auch allen, die es wieder geschafft haben, in das Parlament gewählt zu werden.",2546,Abgeordnete Elisabeth Köstinger,NRSITZ_00001_PARSED,"Geschätzter	ADJA.Pos.Nom.Sg.Masc Herr	N.Reg.Nom.Sg.Masc Bundespräsident	N.Reg.Nom.Sg.Masc !	SYM.Pun.Sent  Sehr	ADV geehrter	ADJA.Pos.Nom.Sg.Masc Herr	N.Reg.Nom.Sg.Masc Präsident	N.Reg.Nom.Sg.Masc !	SYM.Pun.Sent  Liebe	ADJA.Pos.Nom.Pl.* Kolleginnen	N.Reg.Nom.Pl.Fem und	CONJ.Coord.- Kollegen	N.Reg.Nom.Pl.Masc !	SYM.Pun.Sent  Geschätzte	ADJA.Pos.Nom.Pl.Fem Österreicherinnen	N.Reg.Nom.Pl.Fem und	CONJ.Coord.- Österreicher	N.Reg.Nom.Pl.Masc !	SYM.Pun.Sent  Heute	ADV ist	VFIN.Sein.3.Sg.Pres.Ind ein	ART.Indef.Nom.Sg.Masc sehr	ADV großer	ADJA.Pos.Nom.Sg.Masc Tag	N.Reg.Nom.Sg.Masc für	APPR.Acc uns	PRO.Pers.Subst.1.Acc.Pl.* alle	PRO.Indef.Subst.-.Acc.Pl.* ,	SYM.Pun.Comma die	PRO.Rel.Subst.-.Nom.Pl.Masc angelobt	ADJD.Pos wurden	VFIN.Aux.3.Pl.Past.Ind .	SYM.Pun.Sent  Jeder	PRO.Indef.Subst.-.Nom.Sg.Masc von	APPR.Dat uns	PRO.Pers.Subst.1.Dat.Pl.* trägt	VFIN.Full.3.Sg.Pres.Ind als	APPR.Als Abgeordneter	N.Reg.Nom.Sg.Masc eine	ART.Indef.Acc.Sg.Fem sehr	ADV ,	SYM.Pun.Comma sehr	ADV große	ADJA.Pos.Acc.Sg.Fem Verantwortung	N.Reg.Acc.Sg.Fem ,	SYM.Pun.Comma und	CONJ.Coord.- ich	PRO.Pers.Subst.1.Nom.Sg.* darf	VFIN.Mod.1.Sg.Pres.Ind allen	PRO.Indef.Subst.-.Dat.Pl.* hier	ADV herinnen	ADJD.Pos sehr	ADV herzlich	ADJD.Pos gratulieren	VINF.Full.- :	SYM.Pun.Colon allen	PRO.Indef.Subst.-.Dat.Pl.* ,	SYM.Pun.Comma die	PRO.Rel.Subst.-.Nom.Pl.Fem es	PRO.Pers.Subst.3.Acc.Sg.Neut neu	ADJD.Pos ins	APPRART.Acc.Sg.Neut Parlament	N.Reg.Acc.Sg.Neut geschafft	VPP.Full.Psp haben	VINF.Haben.- es	PRO.Pers.Subst.3.Nom.Sg.Neut gab	VFIN.Full.3.Sg.Past.Ind ja	ADV noch	ADV nie	ADV so	ADV viele	PRO.Indef.Attr.-.Nom.Pl.Masc Junge	ADJA.Pos.Nom.Pl.Masc und	CONJ.Coord.- vor	APPR.Vor allem	PRO.Indef.Subst.-.Dat.Sg.Neut auch	ADV so	ADV viele	PRO.Indef.Attr.-.Nom.Pl.Fem Frauen	N.Reg.Nom.Pl.Fem in	APPR.In diesem	PRO.Dem.Attr.-.Dat.Sg.Neut Hohen	ADJA.Pos.Dat.Sg.Neut Haus	N.Reg.Dat.Sg.Neut ,	SYM.Pun.Comma vor	APPR.Vor allem	PRO.Indef.Subst.-.Dat.Sg.Neut aber	ADV auch	ADV allen	PRO.Indef.Subst.-.Dat.Pl.* ,	SYM.Pun.Comma die	PRO.Rel.Subst.-.Nom.Pl.Fem es	PRO.Pers.Subst.3.Acc.Sg.Neut wieder	ADV geschafft	VPP.Full.Psp haben	VFIN.Haben.3.Pl.Pres.Ind ,	SYM.Pun.Comma in	APPR.In das	ART.Def.Acc.Sg.Neut Parlament	N.Reg.Acc.Sg.Neut gewählt	VPP.Full.Psp zu	PART.Zu werden	VINF.Aux.- .	SYM.Pun.Sent  ",True,Both,Standard,Standard,['a'],Alliteration,
10609,"Bevor ich zu ein paar Vorschlägen komme, die im Antrag stehen, möchte ich noch ganz kurz auf die Begründung eingehen. Es ist schon davon gesprochen worden. Man wirft dem Finanzminister, der Regierung eine Hü-hott-Politik vor, wie das hier formuliert ist. Das steht eigentlich in diesem Antrag so drinnen. Auf der einen Seite wird davon gesprochen, dass wir eine massive Neuverschuldung haben werden. Das ist richtig, gleichzeitig aber auch der Beweis dafür, dass Österreich im europäischen Vergleich immens hohe Unterstützungsleistungen für die Unternehmen, für die Unternehmer, für die arbeitenden Menschen, aber auch für die Arbeitslosen in diesem Lande ausgibt. Das führt logischerweise dazu, dass wir eine entsprechend hohe Neuverschuldung haben werden. Es wird aber, und davon bin ich zutiefst überzeugt, auch dazu führen, dass wir besser als alle anderen aus dieser Krise herauskommen werden, meine Damen und Herren.",31617,Abgeordneter Andreas Ottenschläger,NRSITZ_00079_PARSED,"Bevor	CONJ.SubFin.- ich	PRO.Pers.Subst.1.Nom.Sg.* zu	APPR.Dat ein	ART.Indef.*.*.* paar	PRO.Indef.Attr.-.*.*.* Vorschlägen	N.Reg.Dat.Pl.Masc komme	VFIN.Full.1.Sg.Pres.Ind ,	SYM.Pun.Comma die	PRO.Rel.Subst.-.Nom.Pl.Masc im	APPRART.Dat.Sg.Masc Antrag	N.Reg.Dat.Sg.Masc stehen	VFIN.Full.1.Pl.Pres.Ind ,	SYM.Pun.Comma möchte	VFIN.Mod.1.Sg.Past.Subj ich	PRO.Pers.Subst.1.Nom.Sg.* noch	ADV ganz	ADV kurz	ADJD.Pos auf	APPR.Auf die	ART.Def.Acc.Sg.Fem Begründung	N.Reg.Acc.Sg.Fem eingehen	VINF.Full.- .	SYM.Pun.Sent  Es	PRO.Pers.Subst.3.Nom.Sg.Neut ist	VFIN.Sein.3.Sg.Pres.Ind schon	ADV davon	PROADV.Dem gesprochen	VPP.Full.Psp worden	VPP.Aux.Psp .	SYM.Pun.Sent  Man	PRO.Indef.Subst.-.Nom.Sg.* wirft	VFIN.Full.3.Sg.Pres.Ind dem	ART.Def.Dat.Sg.Masc Finanzminister	N.Reg.Dat.Sg.Masc ,	SYM.Pun.Comma der	ART.Def.Dat.Sg.Fem Regierung	N.Reg.Dat.Sg.Fem eine	ART.Indef.Acc.Sg.Fem Hü-hott-Politik	N.Reg.Acc.Sg.Fem vor	PART.Verb ,	SYM.Pun.Comma wie	PROADV.Inter das	PRO.Dem.Subst.-.Nom.Sg.Neut hier	ADV formuliert	VPP.Full.Psp ist	VFIN.Sein.3.Sg.Pres.Ind .	SYM.Pun.Sent  Das	PRO.Dem.Subst.-.Nom.Sg.Neut steht	VFIN.Full.3.Sg.Pres.Ind eigentlich	ADV in	APPR.In diesem	PRO.Dem.Attr.-.Dat.Sg.Masc Antrag	N.Reg.Dat.Sg.Masc so	ADV drinnen	ADV .	SYM.Pun.Sent  Auf	APPR.Auf der	ART.Def.Dat.Sg.Fem einen	ADJA.Pos.Dat.Sg.Fem Seite	N.Reg.Dat.Sg.Fem wird	VFIN.Aux.3.Sg.Pres.Ind davon	PROADV.Dem gesprochen	VPP.Full.Psp ,	SYM.Pun.Comma dass	CONJ.SubFin.- wir	PRO.Pers.Subst.1.Nom.Pl.* eine	ART.Indef.Acc.Sg.Fem massive	ADJA.Pos.Acc.Sg.Fem Neuverschuldung	N.Reg.Acc.Sg.Fem haben	VINF.Haben.- werden	VFIN.Aux.1.Pl.Pres.Ind .	SYM.Pun.Sent  Das	PRO.Dem.Subst.-.Nom.Sg.Neut ist	VFIN.Sein.3.Sg.Pres.Ind richtig	ADJD.Pos ,	SYM.Pun.Comma gleichzeitig	ADJD.Pos aber	ADV auch	ADV der	ART.Def.Nom.Sg.Masc Beweis	N.Reg.Nom.Sg.Masc dafür	PROADV.Dem ,	SYM.Pun.Comma dass	CONJ.SubFin.- Österreich	N.Name.Nom.Sg.Neut im	APPRART.Dat.Sg.Masc europäischen	ADJA.Pos.Dat.Sg.Masc Vergleich	N.Reg.Dat.Sg.Masc immens	ADV hohe	ADJA.Pos.Acc.Pl.Fem Unterstützungsleistungen	N.Reg.Acc.Pl.Fem für	APPR.Acc die	ART.Def.Acc.Pl.Neut Unternehmen	N.Reg.Acc.Pl.Neut ,	SYM.Pun.Comma für	APPR.Acc die	ART.Def.Acc.Pl.Masc Unternehmer	N.Reg.Acc.Pl.Masc ,	SYM.Pun.Comma für	APPR.Acc die	ART.Def.Acc.Pl.Masc arbeitenden	ADJA.Pos.Acc.Pl.Masc Menschen	N.Reg.Acc.Pl.Masc ,	SYM.Pun.Comma aber	CONJ.Coord.Aber auch	ADV für	APPR.Acc die	ART.Def.Acc.Pl.* Arbeitslosen	N.Reg.Acc.Pl.* in	APPR.In diesem	PRO.Dem.Attr.-.Dat.Sg.Neut Lande	N.Reg.Dat.Sg.Neut ausgibt	VFIN.Full.3.Sg.Pres.Ind .	SYM.Pun.Sent  Das	PRO.Dem.Subst.-.Nom.Sg.Neut führt	VFIN.Full.3.Sg.Pres.Ind logischerweise	ADV dazu	PROADV.Dem ,	SYM.Pun.Comma dass	CONJ.SubFin.- wir	PRO.Pers.Subst.1.Nom.Pl.* eine	ART.Indef.Acc.Sg.Fem entsprechend	ADJD.Pos hohe	ADJA.Pos.Acc.Sg.Fem Neuverschuldung	N.Reg.Acc.Sg.Fem haben	VINF.Haben.- werden	VFIN.Aux.3.Pl.Pres.Ind .	SYM.Pun.Sent  Es	PRO.Pers.Subst.3.Nom.Sg.Neut wird	VFIN.Aux.3.Sg.Pres.Ind aber	ADV ,	SYM.Pun.Comma und	CONJ.Coord.- davon	PROADV.Dem bin	VFIN.Sein.1.Sg.Pres.Ind ich	PRO.Pers.Subst.1.Nom.Sg.* zutiefst	ADV überzeugt	VPP.Full.Psp ,	SYM.Pun.Comma auch	ADV dazu	PROADV.Dem führen	VINF.Full.- ,	SYM.Pun.Comma dass	CONJ.SubFin.- wir	PRO.Pers.Subst.1.Nom.Pl.* besser	ADJD.Comp als	CONJ.Comp.- alle	PRO.Indef.Subst.-.Nom.Pl.* anderen	PRO.Indef.Subst.-.Nom.Pl.* aus	APPR.Dat dieser	PRO.Dem.Attr.-.Dat.Sg.Fem Krise	N.Reg.Dat.Sg.Fem herauskommen	VINF.Full.- werden	VFIN.Aux.3.Pl.Pres.Ind ,	SYM.Pun.Comma meine	PRO.Poss.Attr.-.Nom.Pl.* Damen	N.Reg.Nom.Pl.Fem und	CONJ.Coord.- Herren	N.Reg.Nom.Pl.Masc .	SYM.Pun.Sent  ",True,Both,Standard,Standard,['a'],Alliteration,
10610,"Zu diesen Vorschlägen gehört zum Beispiel, dass die Helplines für Frauen in Not europaweit ausgebaut werden oder dass es eine einheitliche europaweite Nummer gibt, die Frauen überall wählen können vor allem auch in Zeiten, in denen wir alle viel mobiler sind. Es müssen aber zum Beispiel besonders vulnerable Gruppen auch einen Zugang haben, zum Beispiel Frauen, die auf der Flucht sind. Warum gibt man denen",48803,"Mitglied des Europäischen Parlaments Claudia Gamon, MSc (WU)",NRSITZ_00069_PARSED,"Zu	APPR.Dat diesen	PRO.Dem.Attr.-.Dat.Pl.Masc Vorschlägen	N.Reg.Dat.Pl.Masc gehört	VFIN.Full.3.Sg.Pres.Ind zum	APPRART.Dat.Sg.Neut Beispiel	N.Reg.Dat.Sg.Neut ,	SYM.Pun.Comma dass	CONJ.SubFin.- die	ART.Def.Nom.Sg.Fem Helplines	N.Name.Nom.Sg.Fem für	APPR.Acc Frauen	N.Reg.Acc.Pl.Fem in	APPR.In Not	N.Reg.Dat.Sg.Fem europaweit	ADJD.Pos ausgebaut	VPP.Full.Psp werden	VFIN.Aux.3.Pl.Pres.Ind oder	CONJ.Coord.- dass	CONJ.SubFin.- es	PRO.Pers.Subst.3.Nom.Sg.Neut eine	ART.Indef.Acc.Sg.Fem einheitliche	ADJA.Pos.Acc.Sg.Fem europaweite	ADJA.Pos.Acc.Sg.Fem Nummer	N.Reg.Acc.Sg.Fem gibt	VFIN.Full.3.Sg.Pres.Ind ,	SYM.Pun.Comma die	ART.Def.Nom.Pl.Fem Frauen	N.Reg.Nom.Pl.Fem überall	ADV wählen	VINF.Full.- können	VFIN.Mod.3.Pl.Pres.Ind vor	APPR.Vor allem	PRO.Indef.Subst.-.Dat.Sg.Neut auch	ADV in	APPR.In Zeiten	N.Reg.Dat.Pl.Fem ,	SYM.Pun.Comma in	APPR.In denen	PRO.Rel.Subst.-.Dat.Pl.Fem wir	PRO.Pers.Subst.1.Nom.Pl.* alle	PRO.Indef.Subst.-.Nom.Pl.* viel	ADV mobiler	ADJD.Comp sind	VFIN.Sein.1.Pl.Pres.Ind .	SYM.Pun.Sent  Es	PRO.Pers.Subst.3.Nom.Sg.Neut müssen	VFIN.Mod.3.Pl.Pres.Ind aber	ADV zum	APPRART.Dat.Sg.Neut Beispiel	N.Reg.Dat.Sg.Neut besonders	ADV vulnerable	ADJA.Pos.Nom.Pl.Fem Gruppen	N.Reg.Nom.Pl.Fem auch	ADV einen	ART.Indef.Acc.Sg.Masc Zugang	N.Reg.Acc.Sg.Masc haben	VFIN.Haben.3.Pl.Pres.Ind ,	SYM.Pun.Comma zum	APPRART.Dat.Sg.Neut Beispiel	N.Reg.Dat.Sg.Neut Frauen	N.Reg.Nom.Pl.Fem ,	SYM.Pun.Comma die	PRO.Rel.Subst.-.Nom.Pl.Fem auf	APPR.Auf der	ART.Def.Dat.Sg.Fem Flucht	N.Reg.Dat.Sg.Fem sind	VFIN.Sein.3.Pl.Pres.Ind .	SYM.Pun.Sent  Warum	PROADV.Inter gibt	VFIN.Full.3.Sg.Pres.Ind man	PRO.Indef.Subst.-.Nom.Sg.* denen	PRO.Dem.Subst.-.Dat.Pl.*  ",True,Both,Standard,Standard,['e'],No Alliteration,
10611,"Wir müssen einerseits auf Prävention setzen, andererseits aber auch auf den Ausbau und die Weiterentwicklung des entsprechenden Know-hows und der Ressourcen im öffentlichen Bereich. Das geht vor allem in Zusammenarbeit mit der Wirtschaft. Ganz besonders wichtig ist gerade auch in diesem Bereich die Vernetzung. Das Erkennen, meine Damen und Herren, ist das eine, aber ich weiß auch, dass ÖVP und Grüne in den Regierungsverhandlungen ich war selbst dabei gerade dem Thema Cybersicherheit große Aufmerksamkeit gewidmet und gemeinsame Vorhaben vereinbart haben.",33383,"Abgeordneter Karl Mahrer, BA (ÖVP)",NRSITZ_00010_PARSED,"Wir	PRO.Pers.Subst.1.Nom.Pl.* müssen	VFIN.Mod.1.Pl.Pres.Ind einerseits	ADV auf	APPR.Auf Prävention	N.Reg.Acc.Sg.Fem setzen	VINF.Full.- ,	SYM.Pun.Comma andererseits	ADV aber	ADV auch	ADV auf	APPR.Auf den	ART.Def.Acc.Sg.Masc Ausbau	N.Reg.Acc.Sg.Masc und	CONJ.Coord.- die	ART.Def.Acc.Sg.Fem Weiterentwicklung	N.Reg.Acc.Sg.Fem des	ART.Def.Gen.Sg.Masc entsprechenden	ADJA.Pos.Gen.Sg.Masc Know-hows	N.Name.Gen.Sg.Masc und	CONJ.Coord.- der	ART.Def.Gen.Pl.Fem Ressourcen	N.Reg.Gen.Pl.Fem im	APPRART.Dat.Sg.Masc öffentlichen	ADJA.Pos.Dat.Sg.Masc Bereich	N.Reg.Dat.Sg.Masc .	SYM.Pun.Sent  Das	PRO.Dem.Subst.-.Nom.Sg.Neut geht	VFIN.Full.3.Sg.Pres.Ind vor	APPR.Vor allem	PRO.Indef.Subst.-.Dat.Sg.Neut in	APPR.In Zusammenarbeit	N.Reg.Acc.Sg.Fem mit	APPR.Dat der	ART.Def.Dat.Sg.Fem Wirtschaft	N.Reg.Dat.Sg.Fem .	SYM.Pun.Sent  Ganz	ADV besonders	ADV wichtig	ADJD.Pos ist	VFIN.Sein.3.Sg.Pres.Ind gerade	ADV auch	ADV in	APPR.In diesem	PRO.Dem.Attr.-.Dat.Sg.Masc Bereich	N.Reg.Dat.Sg.Masc die	ART.Def.Nom.Sg.Fem Vernetzung	N.Reg.Nom.Sg.Fem .	SYM.Pun.Sent  Das	ART.Def.Nom.Sg.Neut Erkennen	N.Reg.Nom.Sg.Neut ,	SYM.Pun.Comma meine	PRO.Poss.Attr.-.Nom.Pl.* Damen	N.Reg.Nom.Pl.Fem und	CONJ.Coord.- Herren	N.Reg.Nom.Pl.Masc ,	SYM.Pun.Comma ist	VFIN.Sein.3.Sg.Pres.Ind das	ART.Def.Nom.Sg.Neut eine	PRO.Indef.Subst.-.Nom.Sg.Fem ,	SYM.Pun.Comma aber	CONJ.Coord.Aber ich	PRO.Pers.Subst.1.Nom.Sg.* weiß	VFIN.Full.1.Sg.Pres.Ind auch	ADV ,	SYM.Pun.Comma dass	CONJ.SubFin.- ÖVP	N.Name.Nom.Sg.* und	CONJ.Coord.- Grüne	N.Name.Nom.Pl.* in	APPR.In den	ART.Def.Dat.Pl.Fem Regierungsverhandlungen	N.Reg.Dat.Pl.Fem ich	PRO.Pers.Subst.1.Nom.Sg.* war	VFIN.Sein.1.Sg.Past.Ind selbst	ADV dabei	PROADV.Dem gerade	ADV dem	ART.Def.Dat.Sg.Neut Thema	N.Reg.Dat.Sg.Neut Cybersicherheit	N.Reg.Nom.Sg.Fem große	ADJA.Pos.Acc.Sg.Fem Aufmerksamkeit	N.Reg.Acc.Sg.Fem gewidmet	VPP.Full.Psp und	CONJ.Coord.- gemeinsame	ADJA.Pos.Nom.Pl.Neut Vorhaben	N.Reg.Nom.Pl.Neut vereinbart	VPP.Full.Psp haben	VFIN.Haben.3.Pl.Pres.Ind .	SYM.Pun.Sent  ",True,Both,Standard,Standard,['a'],Alliteration,
10612,"Daher der Appell an alle, auch die, die via Fernsehen oder via Livestream dabei sind, sich an die Infektionsregeln zu halten. Das wird in den nächsten Wochen ganz entscheidend sein: ein Verständnis dafür aufzubringen, dass die Regeln zwar schwer und hart sind, dass wir alle müde sind, dass aber die Erholung auf dem Arbeitsmarkt, in der Wirtschaft nur möglich ist, wenn wir das in den nächsten Wochen tun, um dann möglichst rasch wieder langfristig aus der Krise herauszukommen.",9805,"Bundesminister für Arbeit, Familie und Jugend Mag. Dr. Martin Kocher",NRSITZ_00077_PARSED,"Daher	PROADV.Dem der	ART.Def.Nom.Sg.Masc Appell	N.Reg.Nom.Sg.Masc an	APPR.An alle	PRO.Indef.Subst.-.Acc.Pl.* ,	SYM.Pun.Comma auch	ADV die	PRO.Dem.Subst.-.Acc.Pl.* ,	SYM.Pun.Comma die	PRO.Rel.Subst.-.Nom.Pl.Fem via	APPR.Acc Fernsehen	N.Reg.Acc.Sg.Neut oder	CONJ.Coord.- via	APPR.Acc Livestream	N.Reg.Acc.Sg.Neut dabei	PROADV.Dem sind	VFIN.Sein.3.Pl.Pres.Ind ,	SYM.Pun.Comma sich	PRO.Refl.Subst.3.Acc.Pl.* an	APPR.An die	ART.Def.Acc.Pl.Fem Infektionsregeln	N.Reg.Acc.Pl.Fem zu	PART.Zu halten	VINF.Full.- .	SYM.Pun.Sent  Das	PRO.Dem.Subst.-.Nom.Sg.Neut wird	VFIN.Aux.3.Sg.Pres.Ind in	APPR.In den	ART.Def.Dat.Pl.Fem nächsten	ADJA.Sup.Dat.Pl.Fem Wochen	N.Reg.Dat.Pl.Fem ganz	ADV entscheidend	ADJD.Pos sein	VINF.Sein.- :	SYM.Pun.Colon ein	ART.Indef.Acc.Sg.Neut Verständnis	N.Reg.Acc.Sg.Neut dafür	PROADV.Dem aufzubringen	VINF.Full.zu ,	SYM.Pun.Comma dass	CONJ.SubFin.- die	ART.Def.Nom.Pl.Fem Regeln	N.Reg.Nom.Pl.Fem zwar	ADV schwer	ADJD.Pos und	CONJ.Coord.- hart	ADJD.Pos sind	VFIN.Sein.3.Pl.Pres.Ind ,	SYM.Pun.Comma dass	CONJ.SubFin.- wir	PRO.Pers.Subst.1.Nom.Pl.* alle	PRO.Indef.Subst.-.Nom.Pl.* müde	ADJD.Pos sind	VFIN.Sein.1.Pl.Pres.Ind ,	SYM.Pun.Comma dass	CONJ.SubFin.- aber	ADV die	ART.Def.Nom.Sg.Fem Erholung	N.Reg.Nom.Sg.Fem auf	APPR.Auf dem	ART.Def.Dat.Sg.Masc Arbeitsmarkt	N.Reg.Dat.Sg.Masc ,	SYM.Pun.Comma in	APPR.In der	ART.Def.Dat.Sg.Fem Wirtschaft	N.Reg.Dat.Sg.Fem nur	ADV möglich	ADJD.Pos ist	VFIN.Sein.3.Sg.Pres.Ind ,	SYM.Pun.Comma wenn	CONJ.SubFin.- wir	PRO.Pers.Subst.1.Nom.Pl.* das	PRO.Dem.Subst.-.Acc.Sg.Neut in	APPR.In den	ART.Def.Dat.Pl.Fem nächsten	ADJA.Sup.Dat.Pl.Fem Wochen	N.Reg.Dat.Pl.Fem tun	VINF.Full.- ,	SYM.Pun.Comma um	CONJ.SubInf.- dann	ADV möglichst	ADV rasch	ADJD.Pos wieder	ADV langfristig	ADJD.Pos aus	APPR.Dat der	ART.Def.Dat.Sg.Fem Krise	N.Reg.Dat.Sg.Fem herauszukommen	VINF.Full.zu .	SYM.Pun.Sent  ",True,Both,Standard,Standard,['a'],Alliteration,
