id,text,,speaker,file,tagged,res_allit,res_both,res_both_updated,res_both_last_version,letters,label,Comments
10559,"Herr Kollege Fuchs, Ihre Sorgen möchten die Betriebe in Österreich haben, die haben nämlich ganz andere. Die Betriebe in Österreich machen sich Sorgen, wie sie die Kosten in ihrem Unternehmen bedecken, die machen sich Sorgen, wie sie die Gehälter für ihre Mitarbeiterinnen und Mitarbeiter bezahlen jetzt erst recht, da das 14. Gehalt ansteht , wie sie die Jobs ihrer MitarbeiterInnen sichern, wie sie überhaupt das Überleben ihrer Unternehmen sichern. Wir kümmern uns um diese Sorgen, um die wahren Sorgen dieser Unternehmerinnen und Unternehmer und nicht um Formalfragen oder Strukturfragen, die die betroffenen Unternehmen überhaupt nicht interessieren.",1958,Abgeordneter Karlheinz Kopf,NRSITZ_00062_PARSED,"Herr	N.Reg.Nom.Sg.Masc Kollege	N.Reg.Nom.Sg.Masc Fuchs	N.Name.Nom.Sg.Masc ,	SYM.Pun.Comma Ihre	PRO.Poss.Attr.-.Nom.Pl.Fem Sorgen	N.Reg.Nom.Pl.Fem möchten	VFIN.Mod.3.Pl.Past.Subj die	ART.Def.Acc.Pl.Masc Betriebe	N.Reg.Acc.Pl.Masc in	APPR.In Österreich	N.Name.Dat.Sg.Neut haben	VINF.Haben.- ,	SYM.Pun.Comma die	PRO.Dem.Subst.-.Nom.Pl.Masc haben	VFIN.Haben.3.Pl.Pres.Ind nämlich	ADV ganz	ADV andere	PRO.Indef.Subst.-.Nom.Pl.* .	SYM.Pun.Sent  Die	ART.Def.Nom.Pl.Masc Betriebe	N.Reg.Nom.Pl.Masc in	APPR.In Österreich	N.Name.Dat.Sg.Neut machen	VFIN.Full.3.Pl.Pres.Ind sich	PRO.Refl.Subst.3.Acc.Pl.* Sorgen	N.Reg.Nom.Pl.Fem ,	SYM.Pun.Comma wie	PROADV.Inter sie	PRO.Pers.Subst.3.Nom.Pl.* die	ART.Def.Acc.Pl.* Kosten	N.Reg.Acc.Pl.* in	APPR.In ihrem	PRO.Poss.Attr.-.Dat.Sg.Neut Unternehmen	N.Reg.Dat.Sg.Neut bedecken	VFIN.Full.3.Pl.Pres.Ind ,	SYM.Pun.Comma die	PRO.Dem.Subst.-.Nom.Pl.* machen	VFIN.Full.3.Pl.Pres.Ind sich	PRO.Refl.Subst.3.Dat.Pl.* Sorgen	N.Reg.Acc.Pl.Fem ,	SYM.Pun.Comma wie	CONJ.Comp.- sie	PRO.Pers.Subst.3.Nom.Pl.* die	ART.Def.Acc.Pl.Neut Gehälter	N.Reg.Acc.Pl.Neut für	APPR.Acc ihre	PRO.Poss.Attr.-.Acc.Pl.Fem Mitarbeiterinnen	N.Reg.Acc.Pl.Fem und	CONJ.Coord.- Mitarbeiter	N.Reg.Acc.Pl.Masc bezahlen	VFIN.Full.3.Pl.Pres.Ind jetzt	ADV erst	ADV recht	ADJD.Pos ,	SYM.Pun.Comma da	CONJ.SubFin.- das	ART.Def.Nom.Sg.Neut 14	CARD .	SYM.Pun.Sent  Gehalt	N.Reg.Nom.Sg.Masc ansteht	VFIN.Full.3.Sg.Pres.Ind ,	SYM.Pun.Comma wie	PROADV.Inter sie	PRO.Pers.Subst.3.Nom.Sg.Fem die	ART.Def.Acc.Pl.Masc Jobs	N.Reg.Acc.Pl.Masc ihrer	PRO.Poss.Attr.-.Gen.Pl.Fem MitarbeiterInnen	N.Reg.Gen.Pl.Fem sichern	VINF.Full.- ,	SYM.Pun.Comma wie	PROADV.Inter sie	PRO.Pers.Subst.3.Nom.Pl.* überhaupt	ADV das	ART.Def.Acc.Sg.Neut Überleben	N.Reg.Acc.Sg.Neut ihrer	PRO.Poss.Attr.-.Gen.Pl.Neut Unternehmen	N.Reg.Gen.Pl.Neut sichern	VINF.Full.- .	SYM.Pun.Sent  Wir	PRO.Pers.Subst.1.Nom.Pl.* kümmern	VFIN.Full.1.Pl.Pres.Ind uns	PRO.Refl.Subst.1.Acc.Pl.* um	APPR.Acc diese	PRO.Dem.Attr.-.Acc.Pl.Fem Sorgen	N.Reg.Acc.Pl.Fem ,	SYM.Pun.Comma um	CONJ.SubInf.- die	ART.Def.Acc.Pl.Fem wahren	ADJA.Pos.Acc.Pl.Fem Sorgen	N.Reg.Acc.Pl.Fem dieser	PRO.Dem.Attr.-.Gen.Pl.Fem Unternehmerinnen	N.Reg.Gen.Pl.Fem und	CONJ.Coord.- Unternehmer	N.Reg.Gen.Pl.Masc und	CONJ.Coord.- nicht	PART.Neg um	APPR.Acc Formalfragen	N.Reg.Acc.Pl.Fem oder	CONJ.Coord.- Strukturfragen	N.Reg.Acc.Pl.Fem ,	SYM.Pun.Comma die	PRO.Rel.Subst.-.Nom.Pl.Fem die	ART.Def.Acc.Pl.Neut betroffenen	ADJA.Pos.Acc.Pl.Neut Unternehmen	N.Reg.Acc.Pl.Neut überhaupt	ADV nicht	PART.Neg interessieren	VINF.Full.- .	SYM.Pun.Sent  ",True,Both,Standard,Standard,['u'],Alliteration,
10560,"Geben Sie den Künstlern, aber auch allen anderen Menschen die alte, die richtige Normalität wieder zurück, und beenden Sie diesen Coronawahnsinn!",46895,Abgeordneter Ing. Mag. Volker Reifenberger,NRSITZ_00051_PARSED,"Geben	VFIN.Full.3.Pl.Pres.Ind Sie	PRO.Pers.Subst.3.Nom.Pl.* den	ART.Def.Dat.Pl.Masc Künstlern	N.Reg.Dat.Pl.Masc ,	SYM.Pun.Comma aber	CONJ.Coord.Aber auch	ADV allen	PRO.Indef.Attr.-.Dat.Pl.Masc anderen	ADJA.Pos.Dat.Pl.Masc Menschen	N.Reg.Dat.Pl.Masc die	ART.Def.Acc.Sg.Fem alte	ADJA.Pos.Acc.Sg.Fem ,	SYM.Pun.Comma die	ART.Def.Acc.Sg.Fem richtige	ADJA.Pos.Acc.Sg.Fem Normalität	N.Reg.Acc.Sg.Fem wieder	ADV zurück	PART.Verb ,	SYM.Pun.Comma und	CONJ.Coord.- beenden	VFIN.Full.3.Pl.Pres.Ind Sie	PRO.Pers.Subst.3.Nom.Pl.* diesen	PRO.Dem.Attr.-.Acc.Sg.Masc Coronawahnsinn	N.Reg.Acc.Sg.Masc !	SYM.Pun.Sent  ",True,Both,Standard,Standard,['a'],Alliteration,
10561,"Gleichzeitig werden auch Atomkraftwerke abgeschaltet aber die falschen! Die hochmodernen Atomkraftwerke, etwa in Deutschland, werden abgeschaltet in Österreich haben wir ja keine , und Atomkraftwerke des sowjetischen Bautyps also Tschernobyltypen à la Krško, das noch dazu in einer Erdbebenregion gebaut wurde werden nicht abgeschaltet. Als Steirer macht mich das wirklich nervös, und jetzt frage ich Sie: Was tun Sie als Grüne dagegen? Sie sind ja mittlerweile in der Bundesregierung, Ihre Ministerin ist auch auf EU-Ebene vertreten: Was tun Sie ganz konkret dagegen, außer solche Entschließungsanträge zu unterstützen, wobei wir wissen, dass die Relevanz solcher Entschließungen überschaubar ist? Sie tun gar nichts!",41172,Abgeordneter MMMag. Dr. Axel Kassegger,NRSITZ_00131_PARSED,"Gleichzeitig	ADJD.Pos werden	VFIN.Aux.3.Pl.Pres.Ind auch	ADV Atomkraftwerke	N.Reg.Nom.Pl.Neut abgeschaltet	VPP.Full.Psp aber	CONJ.Coord.Aber die	ART.Def.Acc.Pl.Fem falschen	ADJA.Pos.Acc.Pl.Fem !	SYM.Pun.Sent  Die	ART.Def.Nom.Pl.Neut hochmodernen	ADJA.Pos.Nom.Pl.Neut Atomkraftwerke	N.Reg.Nom.Pl.Neut ,	SYM.Pun.Comma etwa	ADV in	APPR.In Deutschland	N.Name.Dat.Sg.Neut ,	SYM.Pun.Comma werden	VFIN.Aux.3.Pl.Pres.Ind abgeschaltet	VPP.Full.Psp in	APPR.In Österreich	N.Name.Dat.Sg.Neut haben	VFIN.Haben.3.Pl.Pres.Ind wir	PRO.Pers.Subst.1.Nom.Pl.* ja	ADV keine	PRO.Indef.Attr.-.Acc.Sg.Fem ,	SYM.Pun.Comma und	CONJ.Coord.- Atomkraftwerke	N.Reg.Nom.Pl.Neut des	ART.Def.Gen.Sg.Masc sowjetischen	ADJA.Pos.Gen.Sg.Masc Bautyps	N.Reg.Gen.Sg.Masc also	ADV Tschernobyltypen	FM à	FM la	FM Krško	FM ,	SYM.Pun.Comma das	PRO.Rel.Subst.-.Nom.Sg.Neut noch	ADV dazu	PROADV.Dem in	APPR.In einer	ART.Indef.Dat.Sg.Fem Erdbebenregion	N.Reg.Dat.Sg.Fem gebaut	VPP.Full.Psp wurde	VFIN.Aux.3.Sg.Past.Ind werden	VFIN.Aux.3.Pl.Pres.Ind nicht	PART.Neg abgeschaltet	VPP.Full.Psp .	SYM.Pun.Sent  Als	APPR.Als Steirer	N.Reg.Acc.Sg.Masc macht	VFIN.Full.3.Sg.Pres.Ind mich	PRO.Pers.Subst.1.Acc.Sg.* das	PRO.Dem.Subst.-.Nom.Sg.Neut wirklich	ADJD.Pos nervös	ADJD.Pos ,	SYM.Pun.Comma und	CONJ.Coord.- jetzt	ADV frage	VFIN.Full.1.Sg.Pres.Ind ich	PRO.Pers.Subst.1.Nom.Sg.* Sie	PRO.Pers.Subst.3.Acc.*.* :	SYM.Pun.Colon Was	PRO.Inter.Subst.-.Acc.Sg.Neut tun	VFIN.Full.3.Pl.Pres.Ind Sie	PRO.Pers.Subst.3.Nom.Pl.* als	APPR.Als Grüne	N.Reg.Nom.Pl.* dagegen	PROADV.Dem ?	SYM.Pun.Sent  Sie	PRO.Pers.Subst.3.Nom.Pl.* sind	VFIN.Sein.3.Pl.Pres.Ind ja	ADV mittlerweile	ADV in	APPR.In der	ART.Def.Dat.Sg.Fem Bundesregierung	N.Reg.Dat.Sg.Fem ,	SYM.Pun.Comma Ihre	PRO.Poss.Attr.-.Nom.Sg.Fem Ministerin	N.Reg.Nom.Sg.Fem ist	VFIN.Sein.3.Sg.Pres.Ind auch	ADV auf	APPR.Auf EU-Ebene	N.Reg.Acc.Sg.Fem vertreten	VPP.Full.Psp :	SYM.Pun.Colon Was	PRO.Inter.Subst.-.Acc.Sg.Neut tun	VFIN.Full.3.Pl.Pres.Ind Sie	PRO.Pers.Subst.3.Nom.Pl.* ganz	ADV konkret	ADJD.Pos dagegen	PROADV.Dem ,	SYM.Pun.Comma außer	APPR.Außer solche	PRO.Indef.Attr.-.Acc.Pl.Masc Entschließungsanträge	N.Reg.Acc.Pl.Masc zu	PART.Zu unterstützen	VINF.Full.- ,	SYM.Pun.Comma wobei	PROADV.Inter wir	PRO.Pers.Subst.1.Nom.Pl.* wissen	VFIN.Full.1.Pl.Pres.Ind ,	SYM.Pun.Comma dass	CONJ.SubFin.- die	ART.Def.Nom.Sg.Fem Relevanz	N.Reg.Nom.Sg.Fem solcher	PRO.Indef.Attr.-.Gen.Pl.Fem Entschließungen	N.Reg.Gen.Pl.Fem überschaubar	ADJD.Pos ist	VFIN.Sein.3.Sg.Pres.Ind ?	SYM.Pun.Sent  Sie	PRO.Pers.Subst.3.Nom.Pl.* tun	VFIN.Full.3.Pl.Pres.Ind gar	ADV nichts	PRO.Indef.Subst.-.*.*.Neut !	SYM.Pun.Sent  ",True,Both,Standard,Standard,['a'],Alliteration,
10562,"Ich ende wie fast immer mit einem Zitat, diesmal von Snoopy. Charlie Brown sagt da: Eines Tages, Snoopy, werden wir alle sterben!, und Snoopy sagt: Ja, das stimmt, aber an allen anderen Tagen nicht!",47613,"Abgeordnete Mag. Carmen Jeitler-Cincelli, BA",NRSITZ_00024_PARSED,"Ich	PRO.Pers.Subst.1.Nom.Sg.* ende	VFIN.Full.1.Sg.Pres.Ind wie	CONJ.Comp.- fast	ADV immer	ADV mit	APPR.Dat einem	ART.Indef.Dat.Sg.Neut Zitat	N.Reg.Dat.Sg.Neut ,	SYM.Pun.Comma diesmal	ADV von	APPR.Dat Snoopy	N.Name.Dat.Sg.Neut .	SYM.Pun.Sent  Charlie	N.Name.Nom.Sg.Masc Brown	N.Name.*.*.* sagt	VFIN.Full.3.Sg.Pres.Ind da	ADV :	SYM.Pun.Colon Eines	ART.Indef.Gen.Sg.Masc Tages	N.Reg.Gen.Sg.Masc ,	SYM.Pun.Comma Snoopy	FM ,	SYM.Pun.Comma werden	VFIN.Aux.1.Pl.Pres.Ind wir	PRO.Pers.Subst.1.Nom.Pl.* alle	PRO.Indef.Subst.-.Acc.Pl.* sterben	VINF.Full.- !	SYM.Pun.Sent ,	SYM.Pun.Comma und	CONJ.Coord.- Snoopy	N.Name.Nom.Sg.* sagt	VFIN.Full.3.Sg.Pres.Ind :	SYM.Pun.Colon Ja	PART.Ans ,	SYM.Pun.Comma das	PRO.Rel.Subst.-.Nom.Sg.Neut stimmt	VFIN.Full.3.Sg.Pres.Ind ,	SYM.Pun.Comma aber	ADV an	APPR.An allen	PRO.Indef.Attr.-.Dat.Pl.Masc anderen	ADJA.Pos.Dat.Pl.Masc Tagen	N.Reg.Dat.Pl.Masc nicht	PART.Neg !	SYM.Pun.Sent  ",True,Both,Standard,Standard,['a'],Alliteration,
10563,"Ein Beispiel: Ein Pendler aus Oberwart, der einen langen Anreiseweg und wenig Freizeit hat, wird in Zukunft auch in Wien Anbringungen, Einbringungen in zivilrechtlichen Dingen vornehmen können, sei es die Scheidung betreffend das ist wohl etwas Unerfreulicheres , aber auch Auszüge aus Registern, aus dem Grund- oder Firmenbuch wird man dann als Pendler natürlich nicht nur als Pendler, auch in dem Bereich, in dem man arbeitet, in dem man beschäftigt ist erhalten können. Das kann auch eine Zeitersparnis für viele Bürgerinnen und Bürger bedeuten.",19009,Abgeordneter Dr. Harald Troch,NRSITZ_00099_PARSED,"Ein	ART.Indef.Nom.Sg.Neut Beispiel	N.Reg.Nom.Sg.Neut :	SYM.Pun.Colon Ein	ART.Indef.Nom.Sg.Masc Pendler	N.Reg.Nom.Sg.Masc aus	APPR.Dat Oberwart	N.Name.Dat.Sg.Masc ,	SYM.Pun.Comma der	PRO.Rel.Subst.-.Nom.Sg.Masc einen	ART.Indef.Acc.Sg.Masc langen	ADJA.Pos.Acc.Sg.Masc Anreiseweg	N.Reg.Acc.Sg.Masc und	CONJ.Coord.- wenig	PRO.Indef.Attr.-.*.*.* Freizeit	N.Reg.Acc.Sg.Fem hat	VFIN.Haben.3.Sg.Pres.Ind ,	SYM.Pun.Comma wird	VFIN.Aux.3.Sg.Pres.Ind in	APPR.In Zukunft	N.Reg.Dat.Sg.Fem auch	ADV in	APPR.In Wien	N.Name.Dat.Sg.Neut Anbringungen	N.Reg.Acc.Pl.Fem ,	SYM.Pun.Comma Einbringungen	N.Reg.Acc.Pl.Fem in	APPR.In zivilrechtlichen	ADJA.Pos.Dat.Pl.Neut Dingen	N.Reg.Dat.Pl.Neut vornehmen	VINF.Full.- können	VINF.Mod.- ,	SYM.Pun.Comma sei	VFIN.Sein.3.Sg.Pres.Subj es	PRO.Pers.Subst.3.Nom.Sg.Neut die	ART.Def.Nom.Sg.Fem Scheidung	N.Reg.Nom.Sg.Fem betreffend	ADJD.Pos das	PRO.Dem.Subst.-.Nom.Sg.Neut ist	VFIN.Sein.3.Sg.Pres.Ind wohl	ADV etwas	PRO.Indef.Attr.-.*.*.* Unerfreulicheres	N.Reg.Acc.Sg.Neut ,	SYM.Pun.Comma aber	CONJ.Coord.Aber auch	ADV Auszüge	N.Reg.Nom.Pl.Masc aus	APPR.Dat Registern	N.Reg.Dat.Pl.Neut ,	SYM.Pun.Comma aus	APPR.Dat dem	ART.Def.Dat.Sg.Neut Grund-	TRUNC.Noun oder	CONJ.Coord.- Firmenbuch	N.Reg.Dat.Sg.Neut wird	VFIN.Aux.3.Sg.Pres.Ind man	PRO.Indef.Subst.-.Nom.Sg.* dann	ADV als	APPR.Als Pendler	N.Reg.Nom.Sg.Masc natürlich	ADV nicht	PART.Neg nur	ADV als	APPR.Als Pendler	N.Reg.Nom.Sg.Masc ,	SYM.Pun.Comma auch	ADV in	APPR.In dem	ART.Def.Dat.Sg.Masc Bereich	N.Reg.Dat.Sg.Masc ,	SYM.Pun.Comma in	APPR.In dem	PRO.Rel.Subst.-.Dat.Sg.Masc man	PRO.Indef.Subst.-.Nom.Sg.* arbeitet	VFIN.Full.3.Sg.Pres.Ind ,	SYM.Pun.Comma in	APPR.In dem	PRO.Rel.Subst.-.Dat.Sg.Masc man	PRO.Indef.Subst.-.Nom.Sg.* beschäftigt	VPP.Full.Psp ist	VFIN.Sein.3.Sg.Pres.Ind erhalten	VINF.Full.- können	VFIN.Mod.3.Pl.Pres.Ind .	SYM.Pun.Sent  Das	PRO.Dem.Subst.-.Nom.Sg.Neut kann	VFIN.Mod.3.Sg.Pres.Ind auch	ADV eine	ART.Indef.Acc.Sg.Fem Zeitersparnis	N.Reg.Acc.Sg.Fem für	APPR.Acc viele	PRO.Indef.Attr.-.Acc.Pl.Fem Bürgerinnen	N.Reg.Acc.Pl.Fem und	CONJ.Coord.- Bürger	N.Reg.Acc.Pl.Masc bedeuten	VINF.Full.- .	SYM.Pun.Sent  ",True,Both,Standard,Standard,['a'],Alliteration,
10564,"Zum Ersten, zum ZaBiStaG: Worum es uns da geht, ist, dass wir in der österreichischen Wirtschaft und im Tourismus sehr stark davon abhängig sind, was in der restlichen Europäischen Union geschieht. Italien ist unser zweitwichtigster Handelspartner, und die Entwicklungen in der Europäischen Union können uns nicht egal sein. Jetzt gibt es auf europäischer Ebene endlich eine Einigung zumindest auf drei Instrumente dieses Dreisäulenmodell , mit denen sich europäische Länder gegenseitig unterstützen können und ein gewisses Sicherheitsnetz geschaffen wird.",52492,"Abgeordneter Mag. Dr. Jakob Schwarz, BA",NRSITZ_00030_PARSED,"Zum	APPRART.Dat.Sg.Masc Ersten	ADJA.Pos.Dat.Sg.Masc ,	SYM.Pun.Comma zum	APPRART.Dat.Sg.Masc ZaBiStaG	N.Name.Dat.Sg.Masc :	SYM.Pun.Colon Worum	PROADV.Inter es	PRO.Pers.Subst.3.Nom.Sg.Neut uns	PRO.Pers.Subst.1.Dat.Pl.* da	ADV geht	VFIN.Full.3.Sg.Pres.Ind ,	SYM.Pun.Comma ist	VFIN.Sein.3.Sg.Pres.Ind ,	SYM.Pun.Comma dass	CONJ.SubFin.- wir	PRO.Pers.Subst.1.Nom.Pl.* in	APPR.In der	ART.Def.Dat.Sg.Fem österreichischen	ADJA.Pos.Dat.Sg.Fem Wirtschaft	N.Reg.Dat.Sg.Fem und	CONJ.Coord.- im	APPRART.Dat.Sg.Masc Tourismus	N.Reg.Dat.Sg.Masc sehr	ADV stark	ADJD.Pos davon	PROADV.Dem abhängig	ADJD.Pos sind	VFIN.Sein.3.Pl.Pres.Ind ,	SYM.Pun.Comma was	PRO.Inter.Subst.-.Nom.Sg.Neut in	APPR.In der	ART.Def.Dat.Sg.Fem restlichen	ADJA.Pos.Dat.Sg.Fem Europäischen	ADJA.Pos.Dat.Sg.Fem Union	N.Reg.Dat.Sg.Fem geschieht	VFIN.Full.3.Sg.Pres.Ind .	SYM.Pun.Sent  Italien	N.Name.Nom.Sg.Neut ist	VFIN.Sein.3.Sg.Pres.Ind unser	PRO.Poss.Attr.-.Nom.Sg.Masc zweitwichtigster	ADJA.Sup.Nom.Sg.Masc Handelspartner	N.Reg.Nom.Sg.Masc ,	SYM.Pun.Comma und	CONJ.Coord.- die	ART.Def.Nom.Pl.Fem Entwicklungen	N.Reg.Nom.Pl.Fem in	APPR.In der	ART.Def.Dat.Sg.Fem Europäischen	ADJA.Pos.Dat.Sg.Fem Union	N.Reg.Dat.Sg.Fem können	VFIN.Mod.3.Pl.Pres.Ind uns	PRO.Pers.Subst.1.Dat.Pl.* nicht	PART.Neg egal	ADJD.Pos sein	VINF.Sein.- .	SYM.Pun.Sent  Jetzt	ADV gibt	VFIN.Full.3.Sg.Pres.Ind es	PRO.Pers.Subst.3.Nom.Sg.Neut auf	APPR.Auf europäischer	ADJA.Pos.Dat.Sg.Fem Ebene	N.Reg.Dat.Sg.Fem endlich	ADV eine	ART.Indef.Acc.Sg.Fem Einigung	N.Reg.Acc.Sg.Fem zumindest	ADV auf	APPR.Auf drei	CARD Instrumente	N.Reg.Acc.Pl.Neut dieses	PRO.Dem.Attr.-.Acc.Sg.Neut Dreisäulenmodell	N.Reg.Acc.Sg.Neut ,	SYM.Pun.Comma mit	APPR.Dat denen	PRO.Rel.Subst.-.Dat.Pl.Fem sich	PRO.Refl.Subst.3.Acc.Sg.* europäische	ADJA.Pos.Nom.Pl.Neut Länder	N.Reg.Nom.Pl.Neut gegenseitig	ADJD.Pos unterstützen	VINF.Full.- können	VFIN.Mod.3.Pl.Pres.Ind und	CONJ.Coord.- ein	ART.Indef.Acc.Sg.Neut gewisses	ADJA.Pos.Acc.Sg.Neut Sicherheitsnetz	N.Reg.Acc.Sg.Neut geschaffen	VPP.Full.Psp wird	VFIN.Aux.3.Sg.Pres.Ind .	SYM.Pun.Sent  ",True,Both,Standard,Standard,"['e', 'e']",No Alliteration,
10565,"Das heißt, das österreichische Parlament mit unserem Nationalratspräsidenten Wolfgang Sobotka an der Spitze ist da aktiv aktiver als andere Parlamente. Das Entscheidende ist aber, dass in diesem Kampf gegen Antisemitismus nicht nur die Politik aktiv ist, sondern es ist auch eine Aufgabe jeder Staatsbürgerin und jedes Staatsbürgers, in unserer Gesellschaft alles zu tun, um diesen Tendenzen, die europaweit im Steigen sind, entschieden entgegenzutreten. Antisemitismus darf keinen Platz in unserer Gesellschaft haben!",25802,Abgeordneter Dr. Reinhold Lopatka (ÖVP),NRSITZ_00012_PARSED,"Das	PRO.Dem.Subst.-.Nom.Sg.Neut heißt	VFIN.Full.3.Sg.Pres.Ind ,	SYM.Pun.Comma das	ART.Def.Nom.Sg.Neut österreichische	ADJA.Pos.Nom.Sg.Neut Parlament	N.Reg.Nom.Sg.Neut mit	APPR.Dat unserem	PRO.Poss.Attr.-.Dat.Sg.Masc Nationalratspräsidenten	N.Reg.Dat.Sg.Masc Wolfgang	N.Name.Nom.Sg.Masc Sobotka	N.Name.Nom.Sg.Masc an	APPR.An der	ART.Def.Dat.Sg.Fem Spitze	N.Reg.Dat.Sg.Fem ist	VFIN.Sein.3.Sg.Pres.Ind da	ADV aktiv	ADJD.Pos aktiver	ADJD.Comp als	CONJ.Comp.- andere	ADJA.Pos.Nom.Pl.Neut Parlamente	N.Reg.Nom.Pl.Neut .	SYM.Pun.Sent  Das	ART.Def.Nom.Sg.Neut Entscheidende	N.Reg.Nom.Sg.Neut ist	VFIN.Sein.3.Sg.Pres.Ind aber	ADV ,	SYM.Pun.Comma dass	CONJ.SubFin.- in	APPR.In diesem	PRO.Dem.Attr.-.Dat.Sg.Masc Kampf	N.Reg.Dat.Sg.Masc gegen	APPR.Acc Antisemitismus	N.Reg.Acc.Sg.Masc nicht	PART.Neg nur	ADV die	ART.Def.Nom.Sg.Fem Politik	N.Reg.Nom.Sg.Fem aktiv	ADJD.Pos ist	VFIN.Sein.3.Sg.Pres.Ind ,	SYM.Pun.Comma sondern	CONJ.Coord.- es	PRO.Pers.Subst.3.Nom.Sg.Neut ist	VFIN.Sein.3.Sg.Pres.Ind auch	ADV eine	ART.Indef.Nom.Sg.Fem Aufgabe	N.Reg.Nom.Sg.Fem jeder	PRO.Indef.Attr.-.Gen.Sg.Fem Staatsbürgerin	N.Reg.Gen.Sg.Fem und	CONJ.Coord.- jedes	PRO.Indef.Attr.-.Gen.Sg.Masc Staatsbürgers	N.Reg.Gen.Sg.Masc ,	SYM.Pun.Comma in	APPR.In unserer	PRO.Poss.Attr.-.Dat.Sg.Fem Gesellschaft	N.Reg.Dat.Sg.Fem alles	PRO.Indef.Subst.-.Acc.Sg.Neut zu	PART.Zu tun	VINF.Full.- ,	SYM.Pun.Comma um	CONJ.SubInf.- diesen	PRO.Dem.Attr.-.Dat.Pl.Fem Tendenzen	N.Reg.Dat.Pl.Fem ,	SYM.Pun.Comma die	PRO.Rel.Subst.-.Nom.Pl.Fem europaweit	ADJD.Pos im	APPRART.Dat.Sg.Neut Steigen	N.Reg.Nom.Sg.Neut sind	VFIN.Sein.3.Pl.Pres.Ind ,	SYM.Pun.Comma entschieden	ADJD.Pos entgegenzutreten	VINF.Full.zu .	SYM.Pun.Sent  Antisemitismus	N.Reg.Nom.Sg.Masc darf	VFIN.Mod.3.Sg.Pres.Ind keinen	PRO.Indef.Attr.-.Acc.Sg.Masc Platz	N.Reg.Acc.Sg.Masc in	APPR.In unserer	PRO.Poss.Attr.-.Dat.Sg.Fem Gesellschaft	N.Reg.Dat.Sg.Fem haben	VINF.Haben.- !	SYM.Pun.Sent  ",True,Both,Standard,Standard,['a'],Alliteration,
10566,"Ich habe in den vergangenen Tagen schon klar gesagt, dass dies eine Phase ist, die eine enorme Verantwortung und vor allem Eigenverantwortung erfordert Eigenverantwortung eines jeden Einzelnen, einer jeden Einzelnen, aber auch Verantwortung füreinander: aufeinander schauen, umsichtig sein und miteinander diesen Weg gehen, allerdings auf Distanz. Menschen übernehmen Verantwortung für andere Menschen. Natürlich geht es es wurde schon oft gesagt ganz besonders um die Menschen, die in die Risikogruppe fallen. Das sind ältere Menschen, das sind Menschen mit Herz-Kreislauf-Erkrankungen, mit erhöhtem Blutdruck, mit Diabetes. Das sind alles Risikofaktoren, die in der Bevölkerung sehr weit verbreitet sind, wie Sie wissen. Dieses Aufeinanderschauen und Miteinander-durch-diese-Krise-Gehen, etwa indem Kinder für die Älteren einkaufen gehen und das Sackerl an die Tür hängen, ist daher etwas ganz, ganz Notwendiges.",63183,"Abgeordnete Mag. Beate Meinl-Reisinger, MES",NRSITZ_00016_PARSED,"Ich	PRO.Pers.Subst.1.Nom.Sg.* habe	VFIN.Haben.1.Sg.Pres.Ind in	APPR.In den	ART.Def.Dat.Pl.Masc vergangenen	ADJA.Pos.Dat.Pl.Masc Tagen	N.Reg.Dat.Pl.Masc schon	ADV klar	ADJD.Pos gesagt	VPP.Full.Psp ,	SYM.Pun.Comma dass	CONJ.SubFin.- dies	PRO.Dem.Subst.-.Nom.Sg.Neut eine	ART.Indef.Nom.Sg.Fem Phase	N.Reg.Nom.Sg.Fem ist	VFIN.Sein.3.Sg.Pres.Ind ,	SYM.Pun.Comma die	PRO.Rel.Subst.-.Nom.Sg.Fem eine	ART.Indef.Acc.Sg.Fem enorme	ADJA.Pos.Acc.Sg.Fem Verantwortung	N.Reg.Acc.Sg.Fem und	CONJ.Coord.- vor	APPR.Vor allem	PRO.Indef.Subst.-.Dat.Sg.Neut Eigenverantwortung	N.Reg.Acc.Sg.Fem erfordert	ADJD.Pos Eigenverantwortung	N.Reg.Nom.Sg.Fem eines	ART.Indef.Gen.Sg.Masc jeden	PRO.Indef.Attr.-.Gen.Sg.Masc Einzelnen	ADJA.Pos.Gen.Sg.Masc ,	SYM.Pun.Comma einer	ART.Indef.Gen.Sg.Fem jeden	PRO.Indef.Attr.-.Gen.Sg.Masc Einzelnen	ADJA.Pos.Gen.Sg.Masc ,	SYM.Pun.Comma aber	CONJ.Coord.Aber auch	ADV Verantwortung	N.Reg.Acc.Sg.Fem füreinander	ADV :	SYM.Pun.Colon aufeinander	ADV schauen	VINF.Full.- ,	SYM.Pun.Comma umsichtig	ADJD.Pos sein	VINF.Sein.- und	CONJ.Coord.- miteinander	ADV diesen	PRO.Dem.Attr.-.Acc.Sg.Masc Weg	N.Reg.Acc.Sg.Masc gehen	VINF.Full.- ,	SYM.Pun.Comma allerdings	ADV auf	APPR.Auf Distanz	N.Reg.Acc.Sg.Fem .	SYM.Pun.Sent  Menschen	N.Reg.Nom.Pl.Masc übernehmen	VFIN.Full.3.Pl.Pres.Ind Verantwortung	N.Reg.Acc.Sg.Fem für	APPR.Acc andere	ADJA.Pos.Acc.Pl.Masc Menschen	N.Reg.Acc.Pl.Masc .	SYM.Pun.Sent  Natürlich	ADV geht	VFIN.Full.3.Sg.Pres.Ind es	PRO.Pers.Subst.3.Nom.Sg.Neut es	PRO.Pers.Subst.3.Nom.Sg.Neut wurde	VFIN.Aux.3.Sg.Past.Ind schon	ADV oft	ADV gesagt	VPP.Full.Psp ganz	ADV besonders	ADV um	APPR.Acc die	ART.Def.Acc.Pl.Masc Menschen	N.Reg.Acc.Pl.Masc ,	SYM.Pun.Comma die	PRO.Rel.Subst.-.Nom.Pl.Masc in	APPR.In die	ART.Def.Acc.Sg.Fem Risikogruppe	N.Reg.Acc.Sg.Fem fallen	VFIN.Full.3.Pl.Pres.Ind .	SYM.Pun.Sent  Das	PRO.Dem.Subst.-.Nom.Sg.Neut sind	VFIN.Sein.3.Pl.Pres.Ind ältere	ADJA.Comp.Nom.Pl.Masc Menschen	N.Reg.Nom.Pl.Masc ,	SYM.Pun.Comma das	PRO.Dem.Subst.-.Nom.Sg.Neut sind	VFIN.Sein.3.Pl.Pres.Ind Menschen	N.Reg.Nom.Pl.Masc mit	APPR.Dat Herz-Kreislauf-Erkrankungen	N.Reg.Dat.Pl.Fem ,	SYM.Pun.Comma mit	APPR.Dat erhöhtem	ADJA.Pos.Dat.Sg.Masc Blutdruck	N.Reg.Dat.Sg.Masc ,	SYM.Pun.Comma mit	APPR.Dat Diabetes	N.Reg.Dat.Sg.Masc .	SYM.Pun.Sent  Das	PRO.Dem.Subst.-.Nom.Sg.Neut sind	VFIN.Sein.3.Pl.Pres.Ind alles	PRO.Indef.Subst.-.Nom.Sg.Neut Risikofaktoren	N.Reg.Nom.Pl.Masc ,	SYM.Pun.Comma die	PRO.Rel.Subst.-.Nom.Pl.Masc in	APPR.In der	ART.Def.Dat.Sg.Fem Bevölkerung	N.Reg.Dat.Sg.Fem sehr	ADV weit	ADJD.Pos verbreitet	VPP.Full.Psp sind	VFIN.Sein.3.Pl.Pres.Ind ,	SYM.Pun.Comma wie	PROADV.Inter Sie	PRO.Pers.Subst.3.Nom.Pl.* wissen	VFIN.Full.3.Pl.Pres.Ind .	SYM.Pun.Sent  Dieses	PRO.Dem.Attr.-.Nom.Sg.Neut Aufeinanderschauen	N.Reg.Nom.Sg.Neut und	CONJ.Coord.- Miteinander-durch-diese-Krise-Gehen	N.Reg.Nom.Sg.Neut ,	SYM.Pun.Comma etwa	ADV indem	CONJ.SubFin.- Kinder	N.Reg.Nom.Pl.Neut für	APPR.Acc die	ART.Def.Acc.Pl.* Älteren	N.Reg.Acc.Pl.* einkaufen	VINF.Full.- gehen	VINF.Full.- und	CONJ.Coord.- das	ART.Def.Acc.Sg.Neut Sackerl	N.Reg.Acc.Sg.Neut an	APPR.An die	ART.Def.Acc.Sg.Fem Tür	N.Reg.Acc.Sg.Fem hängen	VFIN.Full.3.Pl.Pres.Ind ,	SYM.Pun.Comma ist	VFIN.Sein.3.Sg.Pres.Ind daher	PROADV.Dem etwas	ADV ganz	ADJD.Pos ,	SYM.Pun.Comma ganz	ADV Notwendiges	N.Reg.Acc.Sg.Neut .	SYM.Pun.Sent  ",True,Both,Standard,Standard,['e'],No Alliteration,
10567,Ich bringe auch einen entsprechenden Entschließungsantrag ein:,30008,Abgeordneter Mag. Gerhard Kaniak,NRSITZ_00077_PARSED,Ich	PRO.Pers.Subst.1.Nom.Sg.* bringe	VFIN.Full.1.Sg.Pres.Ind auch	ADV einen	ART.Indef.Acc.Sg.Masc entsprechenden	ADJA.Pos.Acc.Sg.Masc Entschließungsantrag	N.Reg.Acc.Sg.Masc ein	PART.Verb :	SYM.Pun.Colon  ,True,Both,Standard,Standard,['e'],No Alliteration,
10568,"Ein wirkliches Geschenk hingegen in Ihrem Budget und in Ihrer Steuerreform ist die Senkung der Konzernsteuern. Davon profitieren natürlich alle Unternehmerinnen und Unternehmer unseres Landes. Es sind 5 Prozent der größten Konzerne Österreichs, die von dieser KöSt-Senkung profitieren über 1 Milliarde Euro pro Jahr. Viel Geld, wenig Wirkung: Das sagen auch die Vertreterinnen und Vertreter der mittelständischen Wirtschaft, das sagt nicht nur die Sozialdemokratie.",57110,"Abgeordnete Dr. Pamela Rendi-Wagner, MSc",NRSITZ_00127_PARSED,"Ein	ART.Indef.Nom.Sg.Neut wirkliches	ADJA.Pos.Nom.Sg.Neut Geschenk	N.Reg.Nom.Sg.Neut hingegen	ADV in	APPR.In Ihrem	PRO.Poss.Attr.-.Dat.Sg.Neut Budget	N.Reg.Dat.Sg.Neut und	CONJ.Coord.- in	APPR.In Ihrer	PRO.Poss.Attr.-.Dat.Sg.Fem Steuerreform	N.Reg.Dat.Sg.Fem ist	VFIN.Sein.3.Sg.Pres.Ind die	ART.Def.Nom.Sg.Fem Senkung	N.Reg.Nom.Sg.Fem der	ART.Def.Gen.Pl.Fem Konzernsteuern	N.Reg.Gen.Pl.Fem .	SYM.Pun.Sent  Davon	PROADV.Dem profitieren	VFIN.Full.3.Pl.Pres.Ind natürlich	ADV alle	PRO.Indef.Attr.-.Nom.Pl.Fem Unternehmerinnen	N.Reg.Nom.Pl.Fem und	CONJ.Coord.- Unternehmer	N.Reg.Nom.Pl.Masc unseres	PRO.Poss.Attr.-.Gen.Sg.Neut Landes	N.Reg.Gen.Sg.Neut .	SYM.Pun.Sent  Es	PRO.Pers.Subst.3.Nom.Sg.Neut sind	VFIN.Sein.3.Pl.Pres.Ind 5	CARD Prozent	N.Reg.*.*.Neut der	ART.Def.Gen.Pl.Masc größten	ADJA.Sup.Gen.Pl.Masc Konzerne	N.Reg.Gen.Pl.Masc Österreichs	N.Name.Gen.Sg.Neut ,	SYM.Pun.Comma die	PRO.Rel.Subst.-.Nom.Pl.Masc von	APPR.Dat dieser	PRO.Dem.Attr.-.Dat.Sg.Fem KöSt-Senkung	N.Reg.Dat.Sg.Fem profitieren	VFIN.Full.3.Pl.Pres.Ind über	APPR.Über 1	CARD Milliarde	N.Reg.Acc.Sg.Fem Euro	N.Reg.Nom.Sg.Masc pro	APPR.Pro Jahr	N.Reg.Dat.Sg.Neut .	SYM.Pun.Sent  Viel	PRO.Indef.Attr.-.*.*.* Geld	N.Reg.Acc.Sg.Neut ,	SYM.Pun.Comma wenig	PRO.Indef.Attr.-.*.*.* Wirkung	N.Reg.Acc.Sg.Fem :	SYM.Pun.Colon Das	PRO.Dem.Subst.-.Acc.Sg.Neut sagen	VFIN.Full.3.Pl.Pres.Ind auch	ADV die	ART.Def.Nom.Pl.Fem Vertreterinnen	N.Reg.Nom.Pl.Fem und	CONJ.Coord.- Vertreter	N.Reg.Nom.Pl.Masc der	ART.Def.Gen.Sg.Fem mittelständischen	ADJA.Pos.Gen.Sg.Fem Wirtschaft	N.Reg.Gen.Sg.Fem ,	SYM.Pun.Comma das	PRO.Dem.Subst.-.Nom.Sg.Neut sagt	VFIN.Full.3.Sg.Pres.Ind nicht	PART.Neg nur	ADV die	ART.Def.Acc.Sg.Fem Sozialdemokratie	N.Reg.Acc.Sg.Fem .	SYM.Pun.Sent  ",True,Both,Standard,Standard,['u'],Alliteration,
