id,text,,speaker,file,tagged,res_allit,res_both,res_both_updated,res_both_last_version,letters,label,Comments
10654,"Es wird aber auch danach noch Schwierigkeiten geben. Wir werden danach eine Wachstumsstrategie brauchen, eine rasche Strategie, um eben Beschäftigung zu schaffen und den Sockel an Arbeitslosigkeit zu reduzieren. Ein weiterer Punkt, der aber in meinem Haus auch schon angegangen wird, ist die Gestaltung der Zukunft der Arbeit. Arbeit in fünf oder zehn Jahren wird anders ausschauen als Arbeit vor fünf oder zehn Jahren, und die Krise hat diesen Strukturwandel beschleunigt.",9815,"Bundesminister für Arbeit, Familie und Jugend Mag. Dr. Martin Kocher",NRSITZ_00077_PARSED,"Es	PRO.Pers.Subst.3.Nom.Sg.Neut wird	VFIN.Aux.3.Sg.Pres.Ind aber	ADV auch	ADV danach	PROADV.Dem noch	ADV Schwierigkeiten	N.Reg.Acc.Pl.Fem geben	VINF.Full.- .	SYM.Pun.Sent  Wir	PRO.Pers.Subst.1.Nom.Pl.* werden	VFIN.Aux.1.Pl.Pres.Ind danach	PROADV.Dem eine	ART.Indef.Acc.Sg.Fem Wachstumsstrategie	N.Reg.Acc.Sg.Fem brauchen	VINF.Full.- ,	SYM.Pun.Comma eine	ART.Indef.Acc.Sg.Fem rasche	ADJA.Pos.Acc.Sg.Fem Strategie	N.Reg.Acc.Sg.Fem ,	SYM.Pun.Comma um	CONJ.SubInf.- eben	ADV Beschäftigung	N.Reg.Acc.Sg.Fem zu	PART.Zu schaffen	VINF.Full.- und	CONJ.Coord.- den	ART.Def.Acc.Sg.Masc Sockel	N.Reg.Acc.Sg.Masc an	APPR.An Arbeitslosigkeit	N.Reg.Dat.Sg.Fem zu	PART.Zu reduzieren	VINF.Full.- .	SYM.Pun.Sent  Ein	ART.Indef.Nom.Sg.Masc weiterer	ADJA.Comp.Nom.Sg.Masc Punkt	N.Reg.Nom.Sg.Masc ,	SYM.Pun.Comma der	PRO.Rel.Subst.-.Nom.Sg.Masc aber	ADV in	APPR.In meinem	PRO.Poss.Attr.-.Dat.Sg.Neut Haus	N.Reg.Dat.Sg.Neut auch	ADV schon	ADV angegangen	VPP.Full.Psp wird	VFIN.Aux.3.Sg.Pres.Ind ,	SYM.Pun.Comma ist	VFIN.Sein.3.Sg.Pres.Ind die	ART.Def.Nom.Sg.Fem Gestaltung	N.Reg.Nom.Sg.Fem der	ART.Def.Gen.Sg.Fem Zukunft	N.Reg.Gen.Sg.Fem der	ART.Def.Gen.Sg.Fem Arbeit	N.Reg.Gen.Sg.Fem .	SYM.Pun.Sent  Arbeit	N.Reg.Nom.Sg.Fem in	APPR.In fünf	CARD oder	CONJ.Coord.- zehn	CARD Jahren	N.Reg.Dat.Pl.Neut wird	VFIN.Aux.3.Sg.Pres.Ind anders	ADV ausschauen	VINF.Full.- als	CONJ.Comp.- Arbeit	N.Reg.Acc.Sg.Fem vor	APPR.Vor fünf	CARD oder	CONJ.Coord.- zehn	CARD Jahren	N.Reg.Dat.Pl.Neut ,	SYM.Pun.Comma und	CONJ.Coord.- die	ART.Def.Nom.Sg.Fem Krise	N.Reg.Nom.Sg.Fem hat	VFIN.Haben.3.Sg.Pres.Ind diesen	PRO.Dem.Attr.-.Acc.Sg.Masc Strukturwandel	N.Reg.Acc.Sg.Masc beschleunigt	VPP.Full.Psp .	SYM.Pun.Sent  ",True,Both,Standard,Standard,['a'],Alliteration,
10655,"Wenn Sie so wollen, bin ich deswegen zufrieden, weil alle unzufrieden sind, und wenn alle unzufrieden sind, heißt das, es wurde niemand bevorzugt, aber andererseits auf alle Rücksicht genommen.",20312,Abgeordnete Mag. Eva Blimlinger,NRSITZ_00137_PARSED,"Wenn	CONJ.SubFin.- Sie	PRO.Pers.Subst.3.Nom.Pl.* so	ADV wollen	VFIN.Mod.1.Pl.Pres.Ind ,	SYM.Pun.Comma bin	VFIN.Sein.1.Sg.Pres.Ind ich	PRO.Pers.Subst.1.Nom.Sg.* deswegen	PROADV.Dem zufrieden	ADJD.Pos ,	SYM.Pun.Comma weil	CONJ.SubFin.- alle	PRO.Indef.Subst.-.Nom.Pl.* unzufrieden	ADJD.Pos sind	VFIN.Sein.3.Pl.Pres.Ind ,	SYM.Pun.Comma und	CONJ.Coord.- wenn	CONJ.SubFin.- alle	PRO.Indef.Subst.-.Nom.Pl.* unzufrieden	ADJD.Pos sind	VFIN.Sein.3.Pl.Pres.Ind ,	SYM.Pun.Comma heißt	VFIN.Full.3.Sg.Pres.Ind das	PRO.Dem.Subst.-.Acc.Sg.Neut ,	SYM.Pun.Comma es	PRO.Pers.Subst.3.Nom.Sg.Neut wurde	VFIN.Aux.3.Sg.Past.Ind niemand	PRO.Indef.Subst.-.Nom.Sg.Masc bevorzugt	VPP.Full.Psp ,	SYM.Pun.Comma aber	CONJ.Coord.Aber andererseits	ADV auf	APPR.Auf alle	PRO.Indef.Attr.-.Acc.Sg.Fem Rücksicht	N.Reg.Acc.Sg.Fem genommen	VPP.Full.Psp .	SYM.Pun.Sent  ",True,Both,Standard,Standard,['a'],Alliteration,
10656,"Worüber ich jetzt sprechen möchte, ist der von der Regierung initiierte und sehr wichtige Teuerungsausgleich von 150 Euro: 150 Euro für Ausgleichzulagenbezieher und -bezieherinnen, für Krankengeldbezieher und -bezieherinnen, für Rehabilitationsgeldbezieher und -bezieherinnen; dazugekommen sind jetzt zum Glück aufgrund eines §-27- Geschäftsordnungsantrages im Ausschuss, als wir zusammengekommen sind, auch noch die KrankengeldbezieherInnen, die aus der Arbeitslosigkeit heraus krank geworden sind. Die sind vorher vergessen worden.",40579,Abgeordnete Gabriele Heinisch-Hosek,NRSITZ_00143_PARSED,"Worüber	PROADV.Inter ich	PRO.Pers.Subst.1.Nom.Sg.* jetzt	ADV sprechen	VINF.Full.- möchte	VFIN.Mod.1.Sg.Past.Subj ,	SYM.Pun.Comma ist	VFIN.Sein.3.Sg.Pres.Ind der	ART.Def.Nom.Sg.Masc von	APPR.Dat der	ART.Def.Dat.Sg.Fem Regierung	N.Reg.Dat.Sg.Fem initiierte	ADJA.Pos.Nom.Sg.Fem und	CONJ.Coord.- sehr	ADV wichtige	ADJA.Pos.Nom.Sg.Masc Teuerungsausgleich	N.Reg.Nom.Sg.Masc von	APPR.Dat 150	CARD Euro	N.Reg.Dat.Sg.Masc :	SYM.Pun.Colon 150	CARD Euro	N.Reg.Acc.Sg.Masc für	APPR.Acc Ausgleichzulagenbezieher	N.Reg.Acc.Sg.Masc und	CONJ.Coord.- -bezieherinnen	N.Reg.Acc.Sg.Neut ,	SYM.Pun.Comma für	APPR.Acc Krankengeldbezieher	N.Reg.Acc.Sg.Masc und	CONJ.Coord.- -bezieherinnen	N.Reg.Acc.Sg.Neut ,	SYM.Pun.Comma für	APPR.Acc Rehabilitationsgeldbezieher	N.Reg.Acc.Sg.Masc und	CONJ.Coord.- -bezieherinnen	N.Reg.Acc.Sg.Neut ;	SYM.Pun.Sent dazugekommen	ADJD.Pos sind	VFIN.Sein.3.Pl.Pres.Ind jetzt	ADV zum	APPRART.Dat.Sg.Neut Glück	N.Reg.Dat.Sg.Neut aufgrund	APPR.Gen eines	ART.Indef.Gen.Sg.Masc §-27-	ADJA.Pos.Gen.Sg.Masc Geschäftsordnungsantrages	N.Reg.Gen.Sg.Masc im	APPRART.Dat.Sg.Masc Ausschuss	N.Reg.Dat.Sg.Masc ,	SYM.Pun.Comma als	CONJ.SubFin.- wir	PRO.Pers.Subst.1.Nom.Pl.* zusammengekommen	VPP.Full.Psp sind	VFIN.Sein.1.Pl.Pres.Ind ,	SYM.Pun.Comma auch	ADV noch	ADV die	ART.Def.Nom.Pl.Fem KrankengeldbezieherInnen	N.Reg.Nom.Pl.Fem ,	SYM.Pun.Comma die	PRO.Rel.Subst.-.Nom.Pl.Fem aus	APPR.Dat der	ART.Def.Dat.Sg.Fem Arbeitslosigkeit	N.Reg.Dat.Sg.Fem heraus	APZR krank	ADJD.Pos geworden	VPP.Aux.Psp sind	VFIN.Sein.3.Pl.Pres.Ind .	SYM.Pun.Sent  Die	PRO.Dem.Subst.-.Nom.Pl.* sind	VFIN.Sein.3.Pl.Pres.Ind vorher	ADV vergessen	VPP.Full.Psp worden	VPP.Aux.Psp .	SYM.Pun.Sent  ",True,Both,Standard,Standard,['e'],No Alliteration,
10657,"Es ist ein der in der Zwischenzeit auch hier im Haus verteilt worden ist, es ist der Antrag, den auch Kollege Scherak soeben angesprochen hat, der gestern am Abend auch an die Fraktionen ergangen ist.",46041,Abgeordneter Ralph Schallmeiner,NRSITZ_00051_PARSED,"Es	PRO.Pers.Subst.3.Nom.Sg.Neut ist	VFIN.Sein.3.Sg.Pres.Ind ein	ART.Indef.Nom.Sg.Masc der	ART.Def.Nom.Sg.Masc in	APPR.In der	ART.Def.Dat.Sg.Fem Zwischenzeit	N.Reg.Dat.Sg.Fem auch	ADV hier	ADV im	APPRART.Dat.Sg.Neut Haus	N.Reg.Dat.Sg.Neut verteilt	VPP.Full.Psp worden	VPP.Aux.Psp ist	VFIN.Sein.3.Sg.Pres.Ind ,	SYM.Pun.Comma es	PRO.Pers.Subst.3.Nom.Sg.Neut ist	VFIN.Sein.3.Sg.Pres.Ind der	ART.Def.Nom.Sg.Masc Antrag	N.Reg.Nom.Sg.Masc ,	SYM.Pun.Comma den	PRO.Rel.Subst.-.Acc.Sg.Masc auch	ADV Kollege	N.Reg.Nom.Sg.Masc Scherak	N.Name.Nom.Sg.Masc soeben	ADV angesprochen	VPP.Full.Psp hat	VFIN.Haben.3.Sg.Pres.Ind ,	SYM.Pun.Comma der	PRO.Rel.Subst.-.Nom.Sg.Masc gestern	ADV am	APPRART.Dat.Sg.Masc Abend	N.Reg.Dat.Sg.Masc auch	ADV an	APPR.An die	ART.Def.Acc.Pl.Fem Fraktionen	N.Reg.Acc.Pl.Fem ergangen	VPP.Full.Psp ist	VFIN.Sein.3.Sg.Pres.Ind .	SYM.Pun.Sent  ",True,Both,Standard,Standard,['a'],Alliteration,
10658,"Wir haben diesen Punkt auch im Tierschutzvolksbegehren aufgegriffen, und wir haben uns in unserem Entschließungsantrag darauf verständigt, einen Schwerpunkt dazu zu setzen. Konkret wird es darum gehen, erstmals eine evidenzbasierte Erhebung von Daten in Bezug auf die Streunerkatzenpopulation und die Katzenkastration durchzuführen und einen runden Tisch zum Thema Katzenkastration, zu möglichen Förderprogrammen und zu Vorgehensstandards beim Auffinden von Streunerkatzen durchzuführen. Dazu braucht es auch ein Commitment zur Verstärkung der Zusammenarbeit von Bund und Ländern zur Beobachtung und zur Eindämmung von Streunerkatzenpopulationen.",43543,Abgeordnete Mag. Faika El-Nagashi (Grüne),NRSITZ_00139_PARSED,"Wir	PRO.Pers.Subst.1.Nom.Pl.* haben	VFIN.Haben.1.Pl.Pres.Ind diesen	PRO.Dem.Attr.-.Acc.Sg.Masc Punkt	N.Reg.Acc.Sg.Masc auch	ADV im	APPRART.Dat.Sg.Neut Tierschutzvolksbegehren	N.Reg.Dat.Sg.Neut aufgegriffen	VPP.Full.Psp ,	SYM.Pun.Comma und	CONJ.Coord.- wir	PRO.Pers.Subst.1.Nom.Pl.* haben	VFIN.Haben.1.Pl.Pres.Ind uns	PRO.Refl.Subst.1.Acc.Pl.* in	APPR.In unserem	PRO.Poss.Attr.-.Dat.Sg.Masc Entschließungsantrag	N.Reg.Dat.Sg.Masc darauf	PROADV.Dem verständigt	VPP.Full.Psp ,	SYM.Pun.Comma einen	ART.Indef.Acc.Sg.Masc Schwerpunkt	N.Reg.Acc.Sg.Masc dazu	PROADV.Dem zu	PART.Zu setzen	VINF.Full.- .	SYM.Pun.Sent  Konkret	ADJD.Pos wird	VFIN.Aux.3.Sg.Pres.Ind es	PRO.Pers.Subst.3.Nom.Sg.Neut darum	PROADV.Dem gehen	VINF.Full.- ,	SYM.Pun.Comma erstmals	ADV eine	ART.Indef.Nom.Sg.Fem evidenzbasierte	ADJA.Pos.Nom.Sg.Fem Erhebung	N.Reg.Nom.Sg.Fem von	APPR.Dat Daten	N.Reg.Dat.Pl.Neut in	APPR.In Bezug	N.Reg.Dat.Sg.Masc auf	APPR.Auf die	ART.Def.Acc.Sg.Fem Streunerkatzenpopulation	N.Reg.Acc.Sg.Fem und	CONJ.Coord.- die	ART.Def.Acc.Sg.Fem Katzenkastration	N.Reg.Acc.Sg.Fem durchzuführen	VINF.Full.zu und	CONJ.Coord.- einen	ART.Indef.Acc.Sg.Masc runden	ADJA.Pos.Acc.Sg.Masc Tisch	N.Reg.Acc.Sg.Masc zum	APPRART.Dat.Sg.Neut Thema	N.Reg.Dat.Sg.Neut Katzenkastration	N.Reg.Nom.Sg.Fem ,	SYM.Pun.Comma zu	APPR.Dat möglichen	ADJA.Pos.Dat.Pl.Neut Förderprogrammen	N.Reg.Dat.Pl.Neut und	CONJ.Coord.- zu	APPR.Dat Vorgehensstandards	N.Reg.Dat.Pl.Masc beim	APPRART.Dat.Sg.Neut Auffinden	N.Reg.Dat.Sg.Neut von	APPR.Dat Streunerkatzen	N.Reg.Dat.Pl.Masc durchzuführen	VINF.Full.zu .	SYM.Pun.Sent  Dazu	PROADV.Dem braucht	VFIN.Full.3.Sg.Pres.Ind es	PRO.Pers.Subst.3.Nom.Sg.Neut auch	ADV ein	ART.Indef.Acc.Sg.Neut Commitment	N.Reg.Acc.Sg.Neut zur	APPRART.Dat.Sg.Fem Verstärkung	N.Reg.Dat.Sg.Fem der	ART.Def.Gen.Sg.Fem Zusammenarbeit	N.Reg.Gen.Sg.Fem von	APPR.Dat Bund	N.Reg.Dat.Sg.Masc und	CONJ.Coord.- Ländern	N.Reg.Dat.Pl.Neut zur	APPRART.Dat.Sg.Fem Beobachtung	N.Reg.Dat.Sg.Fem und	CONJ.Coord.- zur	APPRART.Dat.Sg.Fem Eindämmung	N.Reg.Dat.Sg.Fem von	APPR.Dat Streunerkatzenpopulationen	N.Reg.Dat.Pl.Fem .	SYM.Pun.Sent  ",True,Both,Standard,Standard,['e'],No Alliteration,
10659,"Die Frauenministerin und die Justizministerin sind in der Pflicht, damit die Frauen in Österreich die Hilfe und Unterstützung bekommen, die sie brauchen. Es braucht mehr Gewaltprävention, und wir müssen die Opfer schützen und nicht die Täter. Dazu gehört auch, dass die rechtlichen Möglichkeiten der Wegweisung und auch der Untersuchungshaft zum Schutz des Opfers genutzt und angewendet u nd, bitte, Betretungsverbote und Annäherungsverbote schneller ausgesprochen werden, sonst führt das wir haben es gehört! immer öfter zum Mordfall. Das ist für die Familie des Opfers unfassbar und untragbar, und das muss es auch für uns sein.",25643,"Abgeordnete Rosa Ecker, MBA",NRSITZ_00012_PARSED,"Die	ART.Def.Nom.Sg.Fem Frauenministerin	N.Reg.Nom.Sg.Fem und	CONJ.Coord.- die	ART.Def.Nom.Sg.Fem Justizministerin	N.Reg.Nom.Sg.Fem sind	VFIN.Sein.3.Pl.Pres.Ind in	APPR.In der	ART.Def.Dat.Sg.Fem Pflicht	N.Reg.Dat.Sg.Fem ,	SYM.Pun.Comma damit	CONJ.SubFin.- die	ART.Def.Nom.Pl.Fem Frauen	N.Reg.Nom.Pl.Fem in	APPR.In Österreich	N.Name.Dat.Sg.Neut die	ART.Def.Acc.Sg.Fem Hilfe	N.Reg.Acc.Sg.Fem und	CONJ.Coord.- Unterstützung	N.Reg.Acc.Sg.Fem bekommen	VINF.Full.- ,	SYM.Pun.Comma die	PRO.Rel.Subst.-.Acc.Sg.Fem sie	PRO.Pers.Subst.3.Nom.Pl.* brauchen	VFIN.Full.3.Pl.Pres.Ind .	SYM.Pun.Sent  Es	PRO.Pers.Subst.3.Nom.Sg.Neut braucht	VFIN.Full.3.Sg.Pres.Ind mehr	PRO.Indef.Attr.-.*.*.* Gewaltprävention	N.Reg.Acc.Sg.Fem ,	SYM.Pun.Comma und	CONJ.Coord.- wir	PRO.Pers.Subst.1.Nom.Pl.* müssen	VFIN.Mod.1.Pl.Pres.Ind die	ART.Def.Acc.Pl.Neut Opfer	N.Reg.Acc.Pl.Neut schützen	VINF.Full.- und	CONJ.Coord.- nicht	PART.Neg die	ART.Def.Acc.Pl.Masc Täter	N.Reg.Acc.Pl.Masc .	SYM.Pun.Sent  Dazu	PROADV.Dem gehört	VFIN.Full.3.Sg.Pres.Ind auch	ADV ,	SYM.Pun.Comma dass	CONJ.SubFin.- die	ART.Def.Nom.Pl.Fem rechtlichen	ADJA.Pos.Nom.Pl.Fem Möglichkeiten	N.Reg.Nom.Pl.Fem der	ART.Def.Gen.Sg.Fem Wegweisung	N.Reg.Gen.Sg.Fem und	CONJ.Coord.- auch	ADV der	ART.Def.Dat.Sg.Fem Untersuchungshaft	N.Reg.Dat.Sg.Fem zum	APPRART.Dat.Sg.Masc Schutz	N.Reg.Dat.Sg.Masc des	ART.Def.Gen.Sg.Neut Opfers	N.Reg.Gen.Sg.Neut genutzt	VPP.Full.Psp und	CONJ.Coord.- angewendet	VPP.Full.Psp u	CONJ.Coord.- nd	ADJD.Pos ,	SYM.Pun.Comma bitte	PART.Ans ,	SYM.Pun.Comma Betretungsverbote	N.Reg.Nom.Pl.Neut und	CONJ.Coord.- Annäherungsverbote	N.Reg.Nom.Pl.Neut schneller	ADJD.Comp ausgesprochen	VPP.Full.Psp werden	VINF.Aux.- ,	SYM.Pun.Comma sonst	ADV führt	VFIN.Full.3.Sg.Pres.Ind das	ART.Def.Nom.Sg.Neut wir	PRO.Pers.Subst.1.Nom.Pl.* haben	VFIN.Haben.1.Pl.Pres.Ind es	PRO.Pers.Subst.3.Acc.Sg.Neut gehört	VPP.Full.Psp !	SYM.Pun.Sent  immer	ADV öfter	ADV zum	APPRART.Dat.Sg.Masc Mordfall	N.Reg.Dat.Sg.Masc .	SYM.Pun.Sent  Das	PRO.Dem.Subst.-.Nom.Sg.Neut ist	VFIN.Sein.3.Sg.Pres.Ind für	APPR.Acc die	ART.Def.Acc.Sg.Fem Familie	N.Reg.Acc.Sg.Fem des	ART.Def.Gen.Sg.Neut Opfers	N.Reg.Gen.Sg.Neut unfassbar	ADJD.Pos und	CONJ.Coord.- untragbar	ADJD.Pos ,	SYM.Pun.Comma und	CONJ.Coord.- das	PRO.Dem.Subst.-.Acc.Sg.Neut muss	VFIN.Mod.3.Sg.Pres.Ind es	PRO.Pers.Subst.3.Nom.Sg.Neut auch	ADV für	APPR.Acc uns	PRO.Pers.Subst.1.Acc.Pl.* sein	VINF.Sein.- .	SYM.Pun.Sent  ",True,Both,Standard,Standard,['u'],Alliteration,
10660,"Die Erhebung der Europäischen Grundrechteagentur in diesem Jahr hat ergeben, dass 24 Prozent der Transpersonen in Österreich aus Angst vor Hass und Gewalt vermeiden, ihr gelebtes Geschlecht erkennbar zu machen. Mehr als die Hälfte war im vergangenen Jahr Diskriminierungen im Privatleben und ein Drittel Diskriminierungen am Arbeitsplatz ausgesetzt. Auch wir haben dringenden Handlungsbedarf, wenn es darum geht, endlich alle Diskriminierungen aus dem Weg zu schaffen, die diese Gruppe betreffen.",29067,Abgeordnete Sabine Schatz,NRSITZ_00055_PARSED,"Die	ART.Def.Nom.Sg.Fem Erhebung	N.Reg.Nom.Sg.Fem der	ART.Def.Gen.Sg.Fem Europäischen	ADJA.Pos.Gen.Sg.Fem Grundrechteagentur	N.Reg.Gen.Sg.Fem in	APPR.In diesem	PRO.Dem.Attr.-.Dat.Sg.Neut Jahr	N.Reg.Dat.Sg.Neut hat	VFIN.Haben.3.Sg.Pres.Ind ergeben	VPP.Full.Psp ,	SYM.Pun.Comma dass	CONJ.SubFin.- 24	CARD Prozent	N.Reg.*.*.Neut der	ART.Def.Gen.Pl.Fem Transpersonen	N.Reg.Gen.Pl.Fem in	APPR.In Österreich	N.Name.Dat.Sg.Neut aus	APPR.Dat Angst	N.Reg.Dat.Sg.Fem vor	APPR.Vor Hass	N.Reg.Dat.Sg.Masc und	CONJ.Coord.- Gewalt	N.Reg.Dat.Sg.Fem vermeiden	VINF.Full.- ,	SYM.Pun.Comma ihr	PRO.Poss.Attr.-.Acc.Sg.Neut gelebtes	ADJA.Pos.Acc.Sg.Neut Geschlecht	N.Reg.Acc.Sg.Neut erkennbar	ADJD.Pos zu	PART.Zu machen	VINF.Full.- .	SYM.Pun.Sent  Mehr	PRO.Indef.Subst.-.*.*.* als	CONJ.Comp.- die	ART.Def.Nom.Sg.Fem Hälfte	N.Reg.Nom.Sg.Fem war	VFIN.Sein.3.Sg.Past.Ind im	APPRART.Dat.Sg.Neut vergangenen	ADJA.Pos.Dat.Sg.Neut Jahr	N.Reg.Dat.Sg.Neut Diskriminierungen	N.Reg.Nom.Pl.Fem im	APPRART.Dat.Sg.Neut Privatleben	N.Reg.Dat.Sg.Neut und	CONJ.Coord.- ein	ART.Indef.Nom.Sg.Neut Drittel	N.Reg.Nom.Sg.Neut Diskriminierungen	N.Reg.Nom.Pl.Fem am	APPRART.Dat.Sg.Masc Arbeitsplatz	N.Reg.Dat.Sg.Masc ausgesetzt	VPP.Full.Psp .	SYM.Pun.Sent  Auch	ADV wir	PRO.Pers.Subst.1.Nom.Pl.* haben	VFIN.Haben.1.Pl.Pres.Ind dringenden	ADJA.Pos.Acc.Sg.Masc Handlungsbedarf	N.Reg.Acc.Sg.Masc ,	SYM.Pun.Comma wenn	CONJ.SubFin.- es	PRO.Pers.Subst.3.Nom.Sg.Neut darum	PROADV.Dem geht	VFIN.Full.3.Sg.Pres.Ind ,	SYM.Pun.Comma endlich	ADV alle	PRO.Indef.Attr.-.Acc.Pl.Fem Diskriminierungen	N.Reg.Acc.Pl.Fem aus	APPR.Dat dem	ART.Def.Dat.Sg.Masc Weg	N.Reg.Dat.Sg.Masc zu	PART.Zu schaffen	VINF.Full.- ,	SYM.Pun.Comma die	PRO.Rel.Subst.-.Nom.Pl.Masc diese	PRO.Dem.Attr.-.Acc.Sg.Fem Gruppe	N.Reg.Acc.Sg.Fem betreffen	VFIN.Full.3.Pl.Pres.Ind .	SYM.Pun.Sent  ",True,Both,Standard,Standard,['a'],No Alliteration,
10661,"Herr Präsident! Ich möchte eine tatsächliche Berichtigung machen. Kollege Obernosterer hat behauptet, die SPÖ sei stets für eine höhere Besteuerung der Unternehmerinnen und Unternehmer und führt dabei die Vermögensteuer an.",866,Abgeordneter Dr. Christoph Matznetter (SPÖ),NRSITZ_00137_PARSED,"Herr	N.Reg.Nom.Sg.Masc Präsident	N.Reg.Nom.Sg.Masc !	SYM.Pun.Sent  Ich	PRO.Pers.Subst.1.Nom.Sg.* möchte	VFIN.Mod.1.Sg.Past.Subj eine	ART.Indef.Acc.Sg.Fem tatsächliche	ADJA.Pos.Acc.Sg.Fem Berichtigung	N.Reg.Acc.Sg.Fem machen	VINF.Full.- .	SYM.Pun.Sent  Kollege	N.Reg.Nom.Sg.Masc Obernosterer	N.Name.Nom.Sg.Masc hat	VFIN.Haben.3.Sg.Pres.Ind behauptet	VPP.Full.Psp ,	SYM.Pun.Comma die	ART.Def.Nom.Sg.Fem SPÖ	N.Name.Nom.Sg.Fem sei	VFIN.Sein.3.Sg.Pres.Subj stets	ADV für	APPR.Acc eine	ART.Indef.Acc.Sg.Fem höhere	ADJA.Comp.Acc.Sg.Fem Besteuerung	N.Reg.Acc.Sg.Fem der	ART.Def.Gen.Pl.* Unternehmerinnen	N.Reg.Gen.Pl.Fem und	CONJ.Coord.- Unternehmer	N.Reg.Gen.Pl.Masc und	CONJ.Coord.- führt	VFIN.Full.3.Sg.Pres.Ind dabei	PROADV.Dem die	ART.Def.Acc.Sg.Fem Vermögensteuer	N.Reg.Acc.Sg.Fem an	PART.Verb .	SYM.Pun.Sent  ",True,Both,Standard,Standard,['u'],Alliteration,
10662,"Im Übrigen entspricht das, was vorgeschlagen wird, einer Empfehlung des Europäischen Rates, es entspricht einer Empfehlung des Verfassungsdienstes und es entspricht darüber hinaus auch einer Gepflogenheit, die im Umgang von Gebietskörperschaften im Stabilitätspakt geregelt ist.",37395,Abgeordneter Mag. Thomas Drozda (SPÖ),NRSITZ_00010_PARSED,"Im	APPRART.Dat.Sg.Neut Übrigen	ADJA.Pos.Dat.Sg.Neut entspricht	VFIN.Full.3.Sg.Pres.Ind das	PRO.Dem.Subst.-.Nom.Sg.Neut ,	SYM.Pun.Comma was	PRO.Rel.Subst.-.Nom.Sg.Neut vorgeschlagen	VPP.Full.Psp wird	VFIN.Aux.3.Sg.Pres.Ind ,	SYM.Pun.Comma einer	ART.Indef.Dat.Sg.Fem Empfehlung	N.Reg.Dat.Sg.Fem des	ART.Def.Gen.Sg.Masc Europäischen	ADJA.Pos.Gen.Sg.Masc Rates	N.Reg.Gen.Sg.Masc ,	SYM.Pun.Comma es	PRO.Pers.Subst.3.Nom.Sg.Neut entspricht	VFIN.Full.3.Sg.Pres.Ind einer	ART.Indef.Dat.Sg.Fem Empfehlung	N.Reg.Dat.Sg.Fem des	ART.Def.Gen.Sg.Masc Verfassungsdienstes	N.Reg.Gen.Sg.Masc und	CONJ.Coord.- es	PRO.Pers.Subst.3.Nom.Sg.Neut entspricht	VFIN.Full.3.Sg.Pres.Ind darüber	PROADV.Dem hinaus	APZR auch	ADV einer	ART.Indef.Dat.Sg.Fem Gepflogenheit	N.Reg.Dat.Sg.Fem ,	SYM.Pun.Comma die	PRO.Rel.Subst.-.Nom.Sg.Fem im	APPRART.Dat.Sg.Masc Umgang	N.Reg.Dat.Sg.Masc von	APPR.Dat Gebietskörperschaften	N.Reg.Dat.Pl.Fem im	APPRART.Dat.Sg.Masc Stabilitätspakt	N.Reg.Dat.Sg.Masc geregelt	VPP.Full.Psp ist	VFIN.Sein.3.Sg.Pres.Ind .	SYM.Pun.Sent  ",True,Both,Standard,Standard,['e'],No Alliteration,
10663,"Da ist der 57-jährige gelernte Maurer, der es schon vor der Krise sehr schwer hatte, mit seinem kaputten Kreuz eine Stelle zu finden; langzeitarbeitslos nennt man das. Da ist die alleinerziehende Mutter aus Wien, die in den letzten Monaten nicht mehr weiß, wie sie die Miete für sich und ihre Kinder zahlen soll. Da sind aber auch die vielen Unternehmerinnen und Unternehmer unseres Landes, die sich ihr Leben lang ihren persönlichen Traum aufgebaut haben, die alles investiert haben, alles hineingesteckt haben und von heute auf morgen ihre Betriebe schließen müssen, ihren Traum, ihre Zukunft aufgeben müssen. Ja, diese Krise kennt viele Verliererinnen und Verlierer, und einige von ihnen habe ich in den letzten Tagen, Wochen und Monaten persönlich getroffen. Ich habe ihnen zugehört, ich habe mit ihnen gesprochen. Sie waren verzweifelt. Sie alle sind aber keine Einzelfälle.",30766,"Abgeordnete Dr. Pamela Rendi-Wagner, MSc",NRSITZ_00085_PARSED,"Da	ADV ist	VFIN.Sein.3.Sg.Pres.Ind der	ART.Def.Nom.Sg.Masc 57-jährige	ADJA.Pos.Nom.Sg.Masc gelernte	ADJA.Pos.Nom.Sg.Masc Maurer	N.Reg.Nom.Sg.Masc ,	SYM.Pun.Comma der	PRO.Rel.Subst.-.Nom.Sg.Masc es	PRO.Pers.Subst.3.Acc.Sg.Neut schon	ADV vor	APPR.Vor der	ART.Def.Dat.Sg.Fem Krise	N.Reg.Dat.Sg.Fem sehr	ADV schwer	ADJD.Pos hatte	VFIN.Haben.3.Sg.Past.Ind ,	SYM.Pun.Comma mit	APPR.Dat seinem	PRO.Poss.Attr.-.Dat.Sg.Neut kaputten	ADJA.Pos.Dat.Sg.Neut Kreuz	N.Reg.Dat.Sg.Neut eine	ART.Indef.Acc.Sg.Fem Stelle	N.Reg.Acc.Sg.Fem zu	PART.Zu finden	VINF.Full.- ;	SYM.Pun.Sent langzeitarbeitslos	ADJD.Pos nennt	VFIN.Full.3.Sg.Pres.Ind man	PRO.Indef.Subst.-.Nom.Sg.* das	PRO.Dem.Subst.-.Acc.Sg.Neut .	SYM.Pun.Sent  Da	ADV ist	VFIN.Sein.3.Sg.Pres.Ind die	ART.Def.Nom.Sg.Fem alleinerziehende	ADJA.Pos.Nom.Sg.Fem Mutter	N.Reg.Nom.Sg.Fem aus	APPR.Dat Wien	N.Name.Dat.Sg.Neut ,	SYM.Pun.Comma die	PRO.Rel.Subst.-.Nom.Sg.Fem in	APPR.In den	ART.Def.Dat.Pl.Masc letzten	ADJA.Pos.Dat.Pl.Masc Monaten	N.Reg.Dat.Pl.Masc nicht	PART.Neg mehr	ADV weiß	VFIN.Full.3.Sg.Pres.Ind ,	SYM.Pun.Comma wie	PROADV.Inter sie	PRO.Pers.Subst.3.Nom.Sg.Fem die	ART.Def.Acc.Sg.Fem Miete	N.Reg.Acc.Sg.Fem für	APPR.Acc sich	PRO.Refl.Subst.3.Acc.Sg.* und	CONJ.Coord.- ihre	PRO.Poss.Attr.-.Acc.Pl.Neut Kinder	N.Reg.Acc.Pl.Neut zahlen	VINF.Full.- soll	VFIN.Mod.3.Sg.Pres.Ind .	SYM.Pun.Sent  Da	ADV sind	VFIN.Sein.3.Pl.Pres.Ind aber	ADV auch	ADV die	ART.Def.Nom.Pl.Fem vielen	PRO.Indef.Attr.-.Nom.Pl.Fem Unternehmerinnen	N.Reg.Nom.Pl.Fem und	CONJ.Coord.- Unternehmer	N.Reg.Nom.Pl.Masc unseres	PRO.Poss.Attr.-.Gen.Sg.Neut Landes	N.Reg.Gen.Sg.Neut ,	SYM.Pun.Comma die	PRO.Rel.Subst.-.Nom.Pl.* sich	PRO.Refl.Subst.3.Dat.Pl.* ihr	PRO.Poss.Attr.-.Acc.Sg.Neut Leben	N.Reg.Acc.Sg.Neut lang	ADJD.Pos ihren	PRO.Poss.Attr.-.Acc.Sg.Masc persönlichen	ADJA.Pos.Acc.Sg.Masc Traum	N.Reg.Acc.Sg.Masc aufgebaut	VPP.Full.Psp haben	VINF.Haben.- ,	SYM.Pun.Comma die	PRO.Rel.Subst.-.Nom.Sg.Fem alles	PRO.Indef.Subst.-.Acc.Sg.Neut investiert	VPP.Full.Psp haben	VFIN.Haben.1.Pl.Pres.Ind ,	SYM.Pun.Comma alles	PRO.Indef.Subst.-.Acc.Sg.Neut hineingesteckt	VPP.Full.Psp haben	VFIN.Haben.3.Pl.Pres.Ind und	CONJ.Coord.- von	APPR.Dat heute	ADV auf	APZR morgen	ADV ihre	PRO.Poss.Attr.-.Acc.Pl.Masc Betriebe	N.Reg.Acc.Pl.Masc schließen	VINF.Full.- müssen	VINF.Mod.- ,	SYM.Pun.Comma ihren	PRO.Poss.Attr.-.Acc.Sg.Masc Traum	N.Reg.Acc.Sg.Masc ,	SYM.Pun.Comma ihre	PRO.Poss.Attr.-.Acc.Sg.Fem Zukunft	N.Reg.Acc.Sg.Fem aufgeben	VINF.Full.- müssen	VINF.Mod.- .	SYM.Pun.Sent  Ja	PART.Ans ,	SYM.Pun.Comma diese	PRO.Dem.Attr.-.Nom.Sg.Fem Krise	N.Reg.Nom.Sg.Fem kennt	VFIN.Full.3.Sg.Pres.Ind viele	PRO.Indef.Attr.-.Acc.Pl.Fem Verliererinnen	N.Reg.Acc.Pl.Fem und	CONJ.Coord.- Verlierer	N.Reg.Acc.Pl.Masc ,	SYM.Pun.Comma und	CONJ.Coord.- einige	PRO.Indef.Subst.-.Nom.Pl.Masc von	APPR.Dat ihnen	PRO.Pers.Subst.3.Dat.Pl.* habe	VFIN.Haben.1.Sg.Pres.Ind ich	PRO.Pers.Subst.1.Nom.Sg.* in	APPR.In den	ART.Def.Dat.Pl.Masc letzten	ADJA.Pos.Dat.Pl.Masc Tagen	N.Reg.Dat.Pl.Masc ,	SYM.Pun.Comma Wochen	N.Reg.Dat.Pl.Fem und	CONJ.Coord.- Monaten	N.Reg.Dat.Pl.Masc persönlich	ADJD.Pos getroffen	VPP.Full.Psp .	SYM.Pun.Sent  Ich	PRO.Pers.Subst.1.Nom.Sg.* habe	VFIN.Haben.1.Sg.Pres.Ind ihnen	PRO.Pers.Subst.3.Dat.Pl.* zugehört	VPP.Full.Psp ,	SYM.Pun.Comma ich	PRO.Pers.Subst.1.Nom.Sg.* habe	VFIN.Haben.1.Sg.Pres.Ind mit	APPR.Dat ihnen	PRO.Pers.Subst.3.Dat.Pl.* gesprochen	VPP.Full.Psp .	SYM.Pun.Sent  Sie	PRO.Pers.Subst.3.Nom.Pl.* waren	VFIN.Sein.3.Pl.Past.Ind verzweifelt	ADJD.Pos .	SYM.Pun.Sent  Sie	PRO.Pers.Subst.3.Nom.Pl.* alle	PRO.Indef.Subst.-.Nom.Pl.* sind	VFIN.Sein.3.Pl.Pres.Ind aber	ADV keine	PRO.Indef.Attr.-.Acc.Pl.Masc Einzelfälle	N.Reg.Acc.Pl.Masc .	SYM.Pun.Sent  ",True,Both,Standard,Standard,['u'],Alliteration,
10664,"Herr Präsident! Geschätzte Frau Ministerin! Ich möchte meine Rede mit einem Appell an alle Abgeordneten beginnen: Wenn wir auf die Vorredner replizieren und es wie in meinem Fall Ecker eine Namensgleichheit gibt, dann würde ich bitten: Nennen wir den Vornamen dazu! Ich möchte an dieser Stelle noch einmal sagen, dass ich mich von der Aussage der Kollegin Rosa Ecker aufs Schärfste distanzieren möchte, dies auch im Sinne meiner Fraktion.",41061,Abgeordnete Cornelia Ecker,NRSITZ_00131_PARSED,"Herr	N.Reg.Nom.Sg.Masc Präsident	N.Reg.Nom.Sg.Masc !	SYM.Pun.Sent  Geschätzte	ADJA.Pos.Nom.Sg.Fem Frau	N.Reg.Nom.Sg.Fem Ministerin	N.Reg.Nom.Sg.Fem !	SYM.Pun.Sent  Ich	PRO.Pers.Subst.1.Nom.Sg.* möchte	VFIN.Mod.1.Sg.Past.Subj meine	PRO.Poss.Attr.-.Acc.Sg.Fem Rede	N.Reg.Acc.Sg.Fem mit	APPR.Dat einem	ART.Indef.Dat.Sg.Masc Appell	N.Reg.Dat.Sg.Masc an	APPR.An alle	PRO.Indef.Attr.-.Acc.Pl.* Abgeordneten	N.Reg.Acc.Pl.* beginnen	VINF.Full.- :	SYM.Pun.Colon Wenn	CONJ.SubFin.- wir	PRO.Pers.Subst.1.Nom.Pl.* auf	APPR.Auf die	ART.Def.Acc.Pl.Masc Vorredner	N.Reg.Acc.Pl.Masc replizieren	VFIN.Full.1.Pl.Pres.Ind und	CONJ.Coord.- es	PRO.Pers.Subst.3.Nom.Sg.Neut wie	CONJ.Comp.- in	APPR.In meinem	PRO.Poss.Attr.-.Dat.Sg.Masc Fall	N.Reg.Dat.Sg.Masc Ecker	N.Reg.Nom.Sg.Fem eine	ART.Indef.Acc.Sg.Fem Namensgleichheit	N.Reg.Acc.Sg.Fem gibt	VFIN.Full.3.Sg.Pres.Ind ,	SYM.Pun.Comma dann	ADV würde	VFIN.Aux.1.Sg.Past.Subj ich	PRO.Pers.Subst.1.Nom.Sg.* bitten	VINF.Full.- :	SYM.Pun.Colon Nennen	VIMP.Full.3.Pl wir	PRO.Pers.Subst.1.Nom.Pl.* den	ART.Def.Acc.Sg.Masc Vornamen	N.Reg.Acc.Sg.Masc dazu	PROADV.Dem !	SYM.Pun.Sent  Ich	PRO.Pers.Subst.1.Nom.Sg.* möchte	VFIN.Mod.1.Sg.Past.Subj an	APPR.An dieser	PRO.Dem.Attr.-.Dat.Sg.Fem Stelle	N.Reg.Dat.Sg.Fem noch	ADV einmal	ADV sagen	VINF.Full.- ,	SYM.Pun.Comma dass	CONJ.SubFin.- ich	PRO.Pers.Subst.1.Nom.Sg.* mich	PRO.Refl.Subst.1.Acc.Sg.* von	APPR.Dat der	ART.Def.Dat.Sg.Fem Aussage	N.Reg.Dat.Sg.Fem der	ART.Def.Gen.Sg.Fem Kollegin	N.Reg.Gen.Sg.Fem Rosa	N.Name.Nom.Sg.* Ecker	N.Reg.Acc.Sg.Fem aufs	APPRART.Acc.Sg.Neut Schärfste	N.Reg.Acc.Sg.Neut distanzieren	VINF.Full.- möchte	VFIN.Mod.1.Sg.Past.Subj ,	SYM.Pun.Comma dies	PRO.Dem.Subst.-.Nom.Sg.Neut auch	ADV im	APPRART.Dat.Sg.Masc Sinne	N.Reg.Dat.Sg.Masc meiner	PRO.Poss.Attr.-.Gen.Sg.Fem Fraktion	N.Reg.Gen.Sg.Fem .	SYM.Pun.Sent  ",True,Both,Standard,Standard,['a'],Alliteration,
