id,text,,speaker,file,tagged,res_allit,res_both,res_both_updated,res_both_last_version,letters,label,Comments
10508,"Herr Präsident! Meine sehr geehrten Damen und Herren auf der Regierungsbank! Hohes Haus! Also ich freue mich über die heutige Sondersitzung, Kollege Wöginger, vielleicht auch gerade deshalb, weil ich sehe, dass sie für manche eine Art Ärgernis darstellt, unter anderem für dich, weil das für manche eine Art unzumutbare Belästigung darstellt aber das schreibe ich Ihnen in Ihr koalitionäres Stammbuch hinein: An diese Form der parlamentarischen Belästigung",52290,Abgeordneter Herbert Kickl (FPÖ),NRSITZ_00030_PARSED,"Herr	N.Reg.Nom.Sg.Masc Präsident	N.Reg.Nom.Sg.Masc !	SYM.Pun.Sent  Meine	PRO.Poss.Attr.-.Nom.Pl.Masc sehr	ADV geehrten	ADJA.Pos.Nom.Pl.Fem Damen	N.Reg.Nom.Pl.Fem und	CONJ.Coord.- Herren	N.Reg.Nom.Pl.Masc auf	APPR.Auf der	ART.Def.Dat.Sg.Fem Regierungsbank	N.Reg.Dat.Sg.Fem !	SYM.Pun.Sent  Hohes	ADJA.Pos.Nom.Sg.Neut Haus	N.Reg.Nom.Sg.Neut !	SYM.Pun.Sent  Also	ADV ich	PRO.Pers.Subst.1.Nom.Sg.* freue	VFIN.Full.1.Sg.Pres.Ind mich	PRO.Refl.Subst.1.Acc.Sg.* über	APPR.Über die	ART.Def.Acc.Sg.Fem heutige	ADJA.Pos.Acc.Sg.Fem Sondersitzung	N.Reg.Acc.Sg.Fem ,	SYM.Pun.Comma Kollege	N.Reg.Nom.Sg.Masc Wöginger	N.Name.Nom.Sg.Masc ,	SYM.Pun.Comma vielleicht	ADV auch	ADV gerade	ADV deshalb	PROADV.Dem ,	SYM.Pun.Comma weil	CONJ.SubFin.- ich	PRO.Pers.Subst.1.Nom.Sg.* sehe	VFIN.Full.1.Sg.Pres.Ind ,	SYM.Pun.Comma dass	CONJ.SubFin.- sie	PRO.Pers.Subst.3.Nom.Pl.* für	APPR.Acc manche	PRO.Indef.Subst.-.Acc.Pl.* eine	ART.Indef.Nom.Sg.Fem Art	N.Reg.Nom.Sg.Fem Ärgernis	N.Reg.Nom.Sg.Neut darstellt	VFIN.Full.3.Sg.Pres.Ind ,	SYM.Pun.Comma unter	APPR.Unter anderem	PRO.Indef.Subst.-.Dat.Sg.Neut für	APPR.Acc dich	PRO.Pers.Subst.2.Acc.Sg.* ,	SYM.Pun.Comma weil	CONJ.SubFin.- das	ART.Def.Nom.Sg.Neut für	APPR.Acc manche	PRO.Indef.Attr.-.Acc.Sg.Fem eine	ART.Indef.Acc.Sg.Fem Art	N.Reg.Acc.Sg.Fem unzumutbare	ADJA.Pos.Nom.Sg.Fem Belästigung	N.Reg.Nom.Sg.Fem darstellt	VFIN.Full.3.Sg.Pres.Ind aber	ADV das	PRO.Dem.Subst.-.Acc.Sg.Neut schreibe	VFIN.Full.1.Sg.Pres.Ind ich	PRO.Pers.Subst.1.Nom.Sg.* Ihnen	PRO.Pers.Subst.3.Dat.Pl.* in	APPR.In Ihr	PRO.Poss.Attr.-.Acc.Sg.Neut koalitionäres	ADJA.Pos.Acc.Sg.Neut Stammbuch	N.Reg.Acc.Sg.Neut hinein	PART.Verb :	SYM.Pun.Colon An	APPR.An diese	PRO.Dem.Attr.-.Acc.Sg.Fem Form	N.Reg.Acc.Sg.Fem der	ART.Def.Gen.Sg.Fem parlamentarischen	ADJA.Pos.Gen.Sg.Fem Belästigung	N.Reg.Gen.Sg.Fem  ",True,Both,Standard,Standard,['i'],Alliteration,
10509,"Auch der Bundeskanzler hat gemeint, das Impfen sei der einzige Ausweg aus der Pandemie, es sei solidarisch, man müsse es zum Fremdschutz machen. Zahlen Sie dem Herrn Gesundheitsminister bitte einmal ein Coaching, damit er mehr als einen Satz ohne Vorlage herausbringt! Er sagt immer nur: impfen, impfen, impfen. Ich habe nichts gegen die Impfung, aber hören Sie damit auf, sie so darzustellen, als ob sie der einzige Weg wäre.",15902,Abgeordnete Dr. Susanne Fürst,NRSITZ_00133_PARSED,"Auch	ADV der	ART.Def.Nom.Sg.Masc Bundeskanzler	N.Reg.Nom.Sg.Masc hat	VFIN.Haben.3.Sg.Pres.Ind gemeint	VPP.Full.Psp ,	SYM.Pun.Comma das	ART.Def.Nom.Sg.Neut Impfen	N.Reg.Nom.Sg.Neut sei	VFIN.Sein.3.Sg.Pres.Subj der	ART.Def.Nom.Sg.Masc einzige	ADJA.Pos.Nom.Sg.Masc Ausweg	N.Reg.Nom.Sg.Masc aus	APPR.Dat der	ART.Def.Dat.Sg.Fem Pandemie	N.Reg.Dat.Sg.Fem ,	SYM.Pun.Comma es	PRO.Pers.Subst.3.Nom.Sg.Neut sei	VFIN.Sein.3.Sg.Pres.Subj solidarisch	ADJD.Pos ,	SYM.Pun.Comma man	PRO.Indef.Subst.-.Nom.Sg.* müsse	VFIN.Mod.3.Sg.Pres.Subj es	PRO.Pers.Subst.3.Acc.Sg.Neut zum	APPRART.Dat.Sg.Masc Fremdschutz	N.Reg.Dat.Sg.Masc machen	VINF.Full.- .	SYM.Pun.Sent  Zahlen	N.Reg.Nom.Pl.Fem Sie	PRO.Pers.Subst.3.Nom.Sg.Fem dem	ART.Def.Dat.Sg.Masc Herrn	N.Reg.Dat.Sg.Masc Gesundheitsminister	N.Reg.Nom.Sg.Masc bitte	ADV einmal	ADV ein	ART.Indef.Acc.Sg.Neut Coaching	N.Reg.Acc.Sg.Neut ,	SYM.Pun.Comma damit	CONJ.SubFin.- er	PRO.Pers.Subst.3.Nom.Sg.Masc mehr	PRO.Indef.Subst.-.*.*.* als	CONJ.Comp.- einen	ART.Indef.Acc.Sg.Masc Satz	N.Reg.Acc.Sg.Masc ohne	APPR.Acc Vorlage	N.Reg.Acc.Sg.Fem herausbringt	VFIN.Full.3.Sg.Pres.Ind !	SYM.Pun.Sent  Er	PRO.Pers.Subst.3.Nom.Sg.Masc sagt	VFIN.Full.3.Sg.Pres.Ind immer	ADV nur	ADV :	SYM.Pun.Colon impfen	VINF.Full.- ,	SYM.Pun.Comma impfen	VINF.Full.- ,	SYM.Pun.Comma impfen	VINF.Full.- .	SYM.Pun.Sent  Ich	PRO.Pers.Subst.1.Nom.Sg.* habe	VFIN.Haben.1.Sg.Pres.Ind nichts	PRO.Indef.Subst.-.*.*.Neut gegen	APPR.Acc die	ART.Def.Acc.Sg.Fem Impfung	N.Reg.Acc.Sg.Fem ,	SYM.Pun.Comma aber	ADV hören	VFIN.Full.3.Pl.Pres.Ind Sie	PRO.Pers.Subst.3.Nom.Pl.* damit	PROADV.Dem auf	PART.Verb ,	SYM.Pun.Comma sie	PRO.Pers.Subst.3.Acc.Pl.* so	ADV darzustellen	VINF.Full.zu ,	SYM.Pun.Comma als	CONJ.Comp.- ob	CONJ.SubFin.- sie	PRO.Pers.Subst.3.Nom.Pl.* der	ART.Def.Nom.Sg.Masc einzige	ADJA.Pos.Nom.Sg.Masc Weg	N.Reg.Nom.Sg.Masc wäre	VFIN.Sein.3.Sg.Past.Subj .	SYM.Pun.Sent  ",True,Both,Standard,Standard,['i'],No Alliteration,
10510,"So, und jetzt gehen wir ins Detail. Ich habe es ja schon vom Abgeordneten Krainer gehört: Ja, ja, ja, ja, aber Sidlo ist doch überhaupt nicht qualifiziert, das ist doch der Punkt, und das ist das Problem! Und der sozusagen untrügliche Beweis dafür ist ein „Gutachten“ unter Anführungszeichen eines Personalberatungsbüros, das zu einem wenig schmeichelhaften Ergebnis für Herrn Sidlo kommt.",44721,Abgeordneter Herbert Kickl,NRSITZ_00005_PARSED,"So	ADV ,	SYM.Pun.Comma und	CONJ.Coord.- jetzt	ADV gehen	VFIN.Full.1.Pl.Pres.Ind wir	PRO.Pers.Subst.1.Nom.Pl.* ins	APPRART.Acc.Sg.Neut Detail	N.Reg.Acc.Sg.Neut .	SYM.Pun.Sent  Ich	PRO.Pers.Subst.1.Nom.Sg.* habe	VFIN.Haben.1.Sg.Pres.Ind es	PRO.Pers.Subst.3.Acc.Sg.Neut ja	ADV schon	ADV vom	APPRART.Dat.Sg.Masc Abgeordneten	ADJA.Pos.Dat.Sg.Masc Krainer	N.Reg.Dat.Sg.Masc gehört	VFIN.Full.3.Sg.Pres.Ind :	SYM.Pun.Colon Ja	PART.Ans ,	SYM.Pun.Comma ja	ITJ ,	SYM.Pun.Comma ja	ITJ ,	SYM.Pun.Comma ja	ITJ ,	SYM.Pun.Comma aber	CONJ.Coord.Aber Sidlo	N.Name.Nom.Sg.Masc ist	VFIN.Sein.3.Sg.Pres.Ind doch	ADV überhaupt	ADV nicht	PART.Neg qualifiziert	VPP.Full.Psp ,	SYM.Pun.Comma das	PRO.Dem.Subst.-.Nom.Sg.Neut ist	VFIN.Sein.3.Sg.Pres.Ind doch	ADV der	ART.Def.Nom.Sg.Masc Punkt	N.Reg.Nom.Sg.Masc ,	SYM.Pun.Comma und	CONJ.Coord.- das	PRO.Dem.Subst.-.Nom.Sg.Neut ist	VFIN.Sein.3.Sg.Pres.Ind das	ART.Def.Nom.Sg.Neut Problem	N.Reg.Nom.Sg.Neut !	SYM.Pun.Sent  Und	CONJ.Coord.- der	ART.Def.Nom.Sg.Masc sozusagen	ADV untrügliche	ADJA.Pos.Nom.Sg.Masc Beweis	N.Reg.Nom.Sg.Masc dafür	PROADV.Dem ist	VFIN.Sein.3.Sg.Pres.Ind ein	ART.Indef.Nom.Sg.Neut „	ADJA.Pos.Nom.Sg.Neut Gutachten	N.Reg.Nom.Sg.Neut “	N.Reg.Acc.Sg.Neut unter	APPR.Unter Anführungszeichen	N.Reg.Dat.Sg.Neut eines	ART.Indef.Gen.Sg.Neut Personalberatungsbüros	N.Reg.Gen.Sg.Neut ,	SYM.Pun.Comma das	PRO.Rel.Subst.-.Nom.Sg.Neut zu	APPR.Dat einem	ART.Indef.Dat.Sg.Neut wenig	ADV schmeichelhaften	ADJA.Pos.Dat.Sg.Neut Ergebnis	N.Reg.Dat.Sg.Neut für	APPR.Acc Herrn	N.Reg.Acc.Sg.Masc Sidlo	N.Name.Nom.Sg.Masc kommt	VFIN.Full.3.Sg.Pres.Ind .	SYM.Pun.Sent  ",True,Both,Standard,Standard,['j'],No Alliteration,
10511,"Was ist also wichtig? Eine zielgerichtete Planung, eine koordinierte Vorgangsweise ist notwendig. Vorige Woche hatten wir im Zuge der Behandlung des Tierschutzvolksbegehrens ein Expertenhearing. Es ist notwendig, diese Meinungen der Experten entsprechend einzuarbeiten. Es wird Gespräche geben und letztendlich wird es auch Anträge und davon gehe ich aus eine Vorlage aus dem Gesundheitsministerium geben. Im Herbst werden wir diese Themen auf der Tagesordnung haben. Bis dahin können wir eine ausreichende Diskussion führen.",45856,Abgeordneter Franz Leonhard Eßl,NRSITZ_00113_PARSED,"Was	PRO.Inter.Subst.-.Nom.Sg.Neut ist	VFIN.Sein.3.Sg.Pres.Ind also	ADV wichtig	ADJD.Pos ?	SYM.Pun.Sent  Eine	ART.Indef.Nom.Sg.Fem zielgerichtete	ADJA.Pos.Nom.Sg.Fem Planung	N.Reg.Nom.Sg.Fem ,	SYM.Pun.Comma eine	ART.Indef.Nom.Sg.Fem koordinierte	ADJA.Pos.Nom.Sg.Fem Vorgangsweise	N.Reg.Nom.Sg.Fem ist	VFIN.Sein.3.Sg.Pres.Ind notwendig	ADJD.Pos .	SYM.Pun.Sent  Vorige	ADJA.Pos.Acc.Sg.Fem Woche	N.Reg.Acc.Sg.Fem hatten	VFIN.Haben.1.Pl.Past.Ind wir	PRO.Pers.Subst.1.Nom.Pl.* im	APPRART.Dat.Sg.Masc Zuge	N.Reg.Dat.Sg.Masc der	ART.Def.Gen.Sg.Fem Behandlung	N.Reg.Gen.Sg.Fem des	ART.Def.Gen.Sg.Neut Tierschutzvolksbegehrens	N.Reg.Gen.Sg.Neut ein	ART.Indef.Acc.Sg.Neut Expertenhearing	N.Reg.Acc.Sg.Neut .	SYM.Pun.Sent  Es	PRO.Pers.Subst.3.Nom.Sg.Neut ist	VFIN.Sein.3.Sg.Pres.Ind notwendig	ADJD.Pos ,	SYM.Pun.Comma diese	PRO.Dem.Attr.-.Acc.Pl.Fem Meinungen	N.Reg.Acc.Pl.Fem der	ART.Def.Gen.Pl.Masc Experten	N.Reg.Gen.Pl.Masc entsprechend	ADJD.Pos einzuarbeiten	VINF.Full.zu .	SYM.Pun.Sent  Es	PRO.Pers.Subst.3.Nom.Sg.Neut wird	VFIN.Aux.3.Sg.Pres.Ind Gespräche	N.Reg.Acc.Pl.Neut geben	VINF.Full.- und	CONJ.Coord.- letztendlich	ADV wird	VFIN.Aux.3.Sg.Pres.Ind es	PRO.Pers.Subst.3.Nom.Sg.Neut auch	ADV Anträge	N.Reg.Acc.Pl.Masc und	CONJ.Coord.- davon	PROADV.Dem gehe	VFIN.Full.1.Sg.Pres.Ind ich	PRO.Pers.Subst.1.Nom.Sg.* aus	ADV eine	ART.Indef.Acc.Sg.Fem Vorlage	N.Reg.Acc.Sg.Fem aus	APPR.Dat dem	ART.Def.Dat.Sg.Neut Gesundheitsministerium	N.Reg.Dat.Sg.Neut geben	VINF.Full.- .	SYM.Pun.Sent  Im	APPRART.Dat.Sg.Masc Herbst	N.Reg.Dat.Sg.Masc werden	VFIN.Aux.1.Pl.Pres.Ind wir	PRO.Pers.Subst.1.Nom.Pl.* diese	PRO.Dem.Attr.-.Acc.Pl.Neut Themen	N.Reg.Acc.Pl.Neut auf	APPR.Auf der	ART.Def.Dat.Sg.Fem Tagesordnung	N.Reg.Dat.Sg.Fem haben	VINF.Haben.- .	SYM.Pun.Sent  Bis	APPR.Bis dahin	PROADV.Dem können	VFIN.Mod.1.Pl.Pres.Ind wir	PRO.Pers.Subst.1.Nom.Pl.* eine	ART.Indef.Acc.Sg.Fem ausreichende	ADJA.Pos.Acc.Sg.Fem Diskussion	N.Reg.Acc.Sg.Fem führen	VINF.Full.- .	SYM.Pun.Sent  ",True,Both,Standard,Standard,['e'],No Alliteration,
10512,"Auch für unsere Unternehmerinnen und Unternehmer haben wir wichtige Punkte dabei. Wir erhöhen das Budget für die Kurzarbeit auf 1 Milliarde Euro, damit mehr Unternehmerinnen und Unternehmer, aber auch Arbeitnehmer von der Kurzarbeit profitieren. Wir verdoppeln die Mittel des Härtefallfonds auf 2 Milliarden Euro, damit auch Selbstständige und kleine Unternehmer ihre laufenden Rechnungen zahlen können. Und wir passen das Gesellschaftsrecht an, das heißt, Sie haben mehr Zeit für die Jahresabschlüsse, für die Abhaltung der Hauptversammlungen. Aufsichtsratssitzungen können später nachgeholt werden oder per Videokonferenz stattfinden. Das alles sind wichtige Maßnahmen.",39864,Abgeordnete Mag. Michaela Steinacker,NRSITZ_00022_PARSED,"Auch	ADV für	APPR.Acc unsere	PRO.Poss.Attr.-.Acc.Pl.Fem Unternehmerinnen	N.Reg.Acc.Pl.Fem und	CONJ.Coord.- Unternehmer	N.Reg.Acc.Pl.Masc haben	VFIN.Haben.1.Pl.Pres.Ind wir	PRO.Pers.Subst.1.Nom.Pl.* wichtige	ADJA.Pos.Acc.Pl.Masc Punkte	N.Reg.Acc.Pl.Masc dabei	PROADV.Dem .	SYM.Pun.Sent  Wir	PRO.Pers.Subst.1.Nom.Pl.* erhöhen	VFIN.Full.1.Pl.Pres.Ind das	ART.Def.Acc.Sg.Neut Budget	N.Reg.Acc.Sg.Neut für	APPR.Acc die	ART.Def.Acc.Sg.Fem Kurzarbeit	N.Reg.Acc.Sg.Fem auf	APPR.Auf 1	CARD Milliarde	N.Reg.Acc.Sg.Fem Euro	N.Reg.Nom.Sg.Masc ,	SYM.Pun.Comma damit	PROADV.Dem mehr	PRO.Indef.Attr.-.*.*.* Unternehmerinnen	N.Reg.Nom.Pl.Fem und	CONJ.Coord.- Unternehmer	N.Reg.Nom.Pl.Masc ,	SYM.Pun.Comma aber	CONJ.Coord.Aber auch	ADV Arbeitnehmer	N.Reg.Acc.Pl.Masc von	APPR.Dat der	ART.Def.Dat.Sg.Fem Kurzarbeit	N.Reg.Dat.Sg.Fem profitieren	VINF.Full.- .	SYM.Pun.Sent  Wir	PRO.Pers.Subst.1.Nom.Pl.* verdoppeln	VFIN.Full.1.Pl.Pres.Ind die	ART.Def.Acc.Pl.Neut Mittel	N.Reg.Acc.Pl.Neut des	ART.Def.Gen.Sg.Masc Härtefallfonds	N.Reg.Gen.Sg.Masc auf	APPR.Auf 2	CARD Milliarden	N.Reg.Acc.Pl.Fem Euro	N.Reg.Acc.Sg.Masc ,	SYM.Pun.Comma damit	CONJ.SubFin.- auch	ADV Selbstständige	ADJA.Pos.Nom.Pl.Masc und	CONJ.Coord.- kleine	ADJA.Pos.Nom.Pl.Masc Unternehmer	N.Reg.Nom.Pl.Masc ihre	PRO.Poss.Attr.-.Acc.Pl.Fem laufenden	ADJA.Pos.Acc.Pl.Fem Rechnungen	N.Reg.Acc.Pl.Fem zahlen	VINF.Full.- können	VFIN.Mod.3.Pl.Pres.Ind .	SYM.Pun.Sent  Und	CONJ.Coord.- wir	PRO.Pers.Subst.1.Nom.Pl.* passen	VFIN.Full.1.Pl.Pres.Ind das	ART.Def.Acc.Sg.Neut Gesellschaftsrecht	N.Reg.Acc.Sg.Neut an	PART.Verb ,	SYM.Pun.Comma das	PRO.Rel.Subst.-.Nom.Sg.Neut heißt	VFIN.Full.3.Sg.Pres.Ind ,	SYM.Pun.Comma Sie	PRO.Pers.Subst.3.Nom.Pl.* haben	VFIN.Haben.3.Pl.Pres.Ind mehr	PRO.Indef.Attr.-.*.*.* Zeit	N.Reg.Acc.Sg.Fem für	APPR.Acc die	ART.Def.Acc.Pl.Masc Jahresabschlüsse	N.Reg.Acc.Pl.Masc ,	SYM.Pun.Comma für	APPR.Acc die	ART.Def.Acc.Sg.Fem Abhaltung	N.Reg.Acc.Sg.Fem der	ART.Def.Gen.Pl.Fem Hauptversammlungen	N.Reg.Gen.Pl.Fem .	SYM.Pun.Sent  Aufsichtsratssitzungen	N.Reg.Nom.Pl.Fem können	VFIN.Mod.3.Pl.Pres.Ind später	ADJD.Comp nachgeholt	VPP.Full.Psp werden	VINF.Aux.- oder	CONJ.Coord.- per	APPR.Per Videokonferenz	N.Reg.Acc.Sg.Fem stattfinden	VINF.Full.- .	SYM.Pun.Sent  Das	ART.Def.Nom.Sg.Neut alles	PRO.Indef.Subst.-.Nom.Sg.Neut sind	VFIN.Sein.3.Pl.Pres.Ind wichtige	ADJA.Pos.Nom.Pl.Fem Maßnahmen	N.Reg.Nom.Pl.Fem .	SYM.Pun.Sent  ",True,Both,Standard,Standard,['u'],Alliteration,
10513,"Auch eine sehr wichtige Unterstützungsmaßnahme für die gesamte Tourismus-, Gastro nomie- und Freizeitbranche ist die Verlängerung der Umsatzsteuersenkung, des Haftungspaketes und vor allem auch der Regelungen hinsichtlich Steuerstundungen. Durch die Verlängerung der Umsatzsteuersenkung in der Höhe von 5 Prozent auf das gesamte Jahr 2021 werden sehr viele der Verluste abgedeckt. Die Senkung betrifft alle Speisen und Getränke, sowohl alkoholfreie als auch alkoholische Getränke. Davon umfasst sind aber auch Schutzhütten und Buschenschankbetriebe. Auch die gewerbliche Beherbergung, Pensionen, die Privatzimmervermietung und die Überlassung von Ferienwohnungen und Grundstücken für Campingzwecke sind von dieser Verlängerung umfasst.",6584,"Bundesministerin für Landwirtschaft, Regionen und Tourismus Elisabeth Köstinger",NRSITZ_00069_PARSED,"Auch	ADV eine	ART.Indef.Nom.Sg.Fem sehr	ADV wichtige	ADJA.Pos.Nom.Sg.Fem Unterstützungsmaßnahme	N.Reg.Nom.Sg.Fem für	APPR.Acc die	ART.Def.Acc.Sg.Fem gesamte	ADJA.Pos.Acc.Sg.Fem Tourismus-	TRUNC.Noun ,	SYM.Pun.Comma Gastro	N.Name.*.*.* nomie-	TRUNC.Verb und	CONJ.Coord.- Freizeitbranche	N.Reg.Nom.Sg.Fem ist	VFIN.Sein.3.Sg.Pres.Ind die	ART.Def.Nom.Sg.Fem Verlängerung	N.Reg.Nom.Sg.Fem der	ART.Def.Gen.Sg.Fem Umsatzsteuersenkung	N.Reg.Gen.Sg.Fem ,	SYM.Pun.Comma des	ART.Def.Gen.Sg.Masc Haftungspaketes	N.Reg.Gen.Sg.Masc und	CONJ.Coord.- vor	APPR.Vor allem	PRO.Indef.Subst.-.Dat.Sg.Neut auch	ADV der	ART.Def.Gen.Pl.Fem Regelungen	N.Reg.Gen.Pl.Fem hinsichtlich	APPR.Gen Steuerstundungen	N.Reg.Dat.Pl.Fem .	SYM.Pun.Sent  Durch	APPR.Acc die	ART.Def.Acc.Sg.Fem Verlängerung	N.Reg.Acc.Sg.Fem der	ART.Def.Gen.Sg.Fem Umsatzsteuersenkung	N.Reg.Gen.Sg.Fem in	APPR.In der	ART.Def.Dat.Sg.Fem Höhe	N.Reg.Dat.Sg.Fem von	APPR.Dat 5	CARD Prozent	N.Reg.*.*.Neut auf	APPR.Auf das	ART.Def.Acc.Sg.Neut gesamte	ADJA.Pos.Acc.Sg.Neut Jahr	N.Reg.Acc.Sg.Neut 2021	CARD werden	VFIN.Aux.3.Pl.Pres.Ind sehr	ADV viele	PRO.Indef.Subst.-.Nom.Pl.Masc der	ART.Def.Gen.Pl.Masc Verluste	N.Reg.Gen.Pl.Masc abgedeckt	VPP.Full.Psp .	SYM.Pun.Sent  Die	ART.Def.Nom.Sg.Fem Senkung	N.Reg.Nom.Sg.Fem betrifft	VFIN.Full.3.Sg.Pres.Ind alle	PRO.Indef.Attr.-.Acc.Pl.Fem Speisen	N.Reg.Acc.Pl.Fem und	CONJ.Coord.- Getränke	N.Reg.Acc.Pl.Neut ,	SYM.Pun.Comma sowohl	CONJ.Coord.- alkoholfreie	ADJA.Pos.Acc.Pl.Masc als	CONJ.Coord.Als auch	ADV alkoholische	ADJA.Pos.Acc.Pl.Neut Getränke	N.Reg.Acc.Pl.Neut .	SYM.Pun.Sent  Davon	PROADV.Dem umfasst	VPP.Full.Psp sind	VFIN.Sein.3.Pl.Pres.Ind aber	ADV auch	ADV Schutzhütten	N.Reg.Nom.Pl.Fem und	CONJ.Coord.- Buschenschankbetriebe	N.Reg.Nom.Pl.Masc .	SYM.Pun.Sent  Auch	ADV die	ART.Def.Nom.Sg.Fem gewerbliche	ADJA.Pos.Nom.Sg.Fem Beherbergung	N.Reg.Nom.Sg.Fem ,	SYM.Pun.Comma Pensionen	N.Reg.Nom.Pl.Fem ,	SYM.Pun.Comma die	ART.Def.Acc.Sg.Fem Privatzimmervermietung	N.Reg.Acc.Sg.Fem und	CONJ.Coord.- die	ART.Def.Acc.Sg.Fem Überlassung	N.Reg.Acc.Sg.Fem von	APPR.Dat Ferienwohnungen	N.Reg.Dat.Pl.Fem und	CONJ.Coord.- Grundstücken	N.Reg.Dat.Pl.Neut für	APPR.Acc Campingzwecke	N.Reg.Acc.Pl.Masc sind	VFIN.Sein.3.Pl.Pres.Ind von	APPR.Dat dieser	PRO.Dem.Attr.-.Dat.Sg.Fem Verlängerung	N.Reg.Dat.Sg.Fem umfasst	VPP.Full.Psp .	SYM.Pun.Sent  ",True,Both,Standard,Standard,['a'],Alliteration,
10514,"An dieser Stelle, glaube ich, muss man vor allem auch den Unternehmerinnen und Unternehmern und um diese nicht zu vergessen ganz besonders den Mitarbeiterinnen und Mitarbeitern danken. Wir brauchen sie alle, um die Klimaziele zu erreichen. Das erwarten sich die Jungen, die für die Zukunft protestieren, von uns.",46770,"Abgeordneter Hermann Weratschnig, MBA MSc (Grüne)",NRSITZ_00051_PARSED,"An	APPR.An dieser	PRO.Dem.Attr.-.Dat.Sg.Fem Stelle	N.Reg.Dat.Sg.Fem ,	SYM.Pun.Comma glaube	VFIN.Full.1.Sg.Pres.Ind ich	PRO.Pers.Subst.1.Nom.Sg.* ,	SYM.Pun.Comma muss	VFIN.Mod.1.Sg.Pres.Ind man	PRO.Indef.Subst.-.Nom.Sg.* vor	APPR.Vor allem	PRO.Indef.Subst.-.Dat.Sg.Neut auch	ADV den	ART.Def.Dat.Pl.* Unternehmerinnen	N.Reg.Dat.Pl.Fem und	CONJ.Coord.- Unternehmern	N.Reg.Dat.Pl.Masc und	CONJ.Coord.- um	APPR.Acc diese	PRO.Dem.Subst.-.Acc.Pl.Masc nicht	PART.Neg zu	PART.Zu vergessen	VINF.Full.- ganz	ADV besonders	ADV den	ART.Def.Dat.Pl.* Mitarbeiterinnen	N.Reg.Dat.Pl.Fem und	CONJ.Coord.- Mitarbeitern	N.Reg.Dat.Pl.Masc danken	VINF.Full.- .	SYM.Pun.Sent  Wir	PRO.Pers.Subst.1.Nom.Pl.* brauchen	VFIN.Full.1.Pl.Pres.Ind sie	PRO.Pers.Subst.3.Acc.Pl.* alle	PRO.Indef.Subst.-.Acc.Pl.* ,	SYM.Pun.Comma um	CONJ.SubInf.- die	ART.Def.Acc.Pl.Neut Klimaziele	N.Reg.Acc.Pl.Neut zu	PART.Zu erreichen	VINF.Full.- .	SYM.Pun.Sent  Das	PRO.Dem.Subst.-.Acc.Sg.Neut erwarten	VFIN.Full.3.Pl.Pres.Ind sich	PRO.Refl.Subst.3.Acc.Pl.* die	ART.Def.Nom.Pl.Masc Jungen	N.Reg.Nom.Pl.Masc ,	SYM.Pun.Comma die	PRO.Rel.Subst.-.Nom.Pl.Masc für	APPR.Acc die	ART.Def.Acc.Sg.Fem Zukunft	N.Reg.Acc.Sg.Fem protestieren	VFIN.Full.3.Pl.Pres.Ind ,	SYM.Pun.Comma von	APPR.Dat uns	PRO.Pers.Subst.1.Dat.Pl.* .	SYM.Pun.Sent  ",True,Both,Standard,Standard,"['u', 'u']",Alliteration,
10515,"Sowohl als Arbeitgeber als auch als Kollege muss ein gegenseitig unterstützendes, harmonisches Miteinander möglich sein. Jeder Mensch definiert sich über seine Arbeit. Menschen mit Behinderung bleibt es aber oftmals verwehrt, weil sie aufgrund ihrer Beeinträchtigung oft nicht einmal die Möglichkeit erhalten, sich bei einem Unternehmen vorzustellen.",61835,"Abgeordnete Fiona Fiedler, BEd",NRSITZ_00008_PARSED,"Sowohl	CONJ.Coord.- als	APPR.Als Arbeitgeber	N.Reg.Nom.Sg.Masc als	CONJ.Coord.Als auch	ADV als	APPR.Als Kollege	N.Reg.Nom.Sg.Masc muss	VFIN.Mod.3.Sg.Pres.Ind ein	ART.Indef.Acc.Sg.Neut gegenseitig	ADJD.Pos unterstützendes	ADJA.Pos.Acc.Sg.Neut ,	SYM.Pun.Comma harmonisches	ADJA.Pos.Acc.Sg.Neut Miteinander	N.Reg.Acc.Sg.Neut möglich	ADJD.Pos sein	VINF.Sein.- .	SYM.Pun.Sent  Jeder	PRO.Indef.Attr.-.Nom.Sg.Masc Mensch	N.Reg.Nom.Sg.Masc definiert	VFIN.Full.3.Sg.Pres.Ind sich	PRO.Refl.Subst.3.Acc.Sg.* über	APPR.Über seine	PRO.Poss.Attr.-.Acc.Sg.Fem Arbeit	N.Reg.Acc.Sg.Fem .	SYM.Pun.Sent  Menschen	N.Reg.Acc.Pl.Masc mit	APPR.Dat Behinderung	N.Reg.Dat.Sg.Fem bleibt	VFIN.Full.3.Sg.Pres.Ind es	PRO.Pers.Subst.3.Nom.Sg.Neut aber	ADV oftmals	ADV verwehrt	VPP.Full.Psp ,	SYM.Pun.Comma weil	CONJ.SubFin.- sie	PRO.Pers.Subst.3.Nom.Pl.* aufgrund	APPR.Gen ihrer	PRO.Poss.Attr.-.Gen.Sg.Fem Beeinträchtigung	N.Reg.Gen.Sg.Fem oft	ADV nicht	PART.Neg einmal	ADV die	ART.Def.Acc.Sg.Fem Möglichkeit	N.Reg.Acc.Sg.Fem erhalten	VINF.Full.- ,	SYM.Pun.Comma sich	PRO.Refl.Subst.3.Acc.Sg.* bei	APPR.Dat einem	ART.Indef.Dat.Sg.Neut Unternehmen	N.Reg.Dat.Sg.Neut vorzustellen	VINF.Full.zu .	SYM.Pun.Sent  ",True,Both,Standard,Standard,"['a', 'a']",Alliteration,
10516,"Die beste Prävention gegen Ghostwriting wäre aus unserer Sicht, dass die Verhältniszahl zwischen wissenschaftlichen Mitarbeiterinnen und Mitarbeitern und Studenten möglichst niedrig gehalten wird; dann fliegt Ghostwriting am ehesten auf. Wir unterstützen jedoch diesen Antrag, durch den sowohl Auftraggeber als auch Auftragnehmer in Zukunft strafrechtlich verfolgen werden sollen. Danke schön.",45008,Abgeordneter Rudolf Silvan,NRSITZ_00043_PARSED,"Die	ART.Def.Nom.Sg.Fem beste	ADJA.Sup.Nom.Sg.Fem Prävention	N.Reg.Nom.Sg.Fem gegen	APPR.Acc Ghostwriting	N.Reg.Acc.Sg.Neut wäre	VFIN.Sein.3.Sg.Past.Subj aus	APPR.Dat unserer	PRO.Poss.Attr.-.Dat.Sg.Fem Sicht	N.Reg.Dat.Sg.Fem ,	SYM.Pun.Comma dass	CONJ.SubFin.- die	ART.Def.Nom.Sg.Fem Verhältniszahl	N.Reg.Nom.Sg.Fem zwischen	APPR.Zwischen wissenschaftlichen	ADJA.Pos.Dat.Pl.Fem Mitarbeiterinnen	N.Reg.Dat.Pl.Fem und	CONJ.Coord.- Mitarbeitern	N.Reg.Dat.Pl.Masc und	CONJ.Coord.- Studenten	N.Reg.Dat.Pl.Masc möglichst	ADV niedrig	ADJD.Pos gehalten	VPP.Full.Psp wird	VFIN.Aux.3.Sg.Pres.Ind ;	SYM.Pun.Sent dann	ADV fliegt	VFIN.Full.3.Sg.Pres.Ind Ghostwriting	N.Name.Nom.Sg.* am	PART.Deg ehesten	ADJD.Sup auf	PART.Verb .	SYM.Pun.Sent  Wir	PRO.Pers.Subst.1.Nom.Pl.* unterstützen	VFIN.Full.1.Pl.Pres.Ind jedoch	ADV diesen	PRO.Dem.Attr.-.Acc.Sg.Masc Antrag	N.Reg.Acc.Sg.Masc ,	SYM.Pun.Comma durch	APPR.Acc den	ART.Def.Acc.Sg.Masc sowohl	CONJ.Coord.- Auftraggeber	N.Reg.Acc.Sg.Masc als	CONJ.Coord.Als auch	ADV Auftragnehmer	N.Reg.Acc.Pl.Masc in	APPR.In Zukunft	N.Reg.Acc.Sg.Fem strafrechtlich	ADJD.Pos verfolgen	VINF.Full.- werden	VINF.Aux.- sollen	VFIN.Mod.3.Pl.Pres.Ind .	SYM.Pun.Sent  Danke	PART.Ans schön	VIMP.Full.2.Sg .	SYM.Pun.Sent  ",True,Both,Standard,Standard,['a'],Alliteration,
10517,"Das wäre sogar sehr wichtig, und ich weiß nicht, woher Sie die Information haben mir liegt ein E-Mail der Ziviltechnikerkammer von heute vor, in dem neuerlich darauf verwiesen wird, dass es eben entscheidend, eben wichtig ist, die Urkundentätigkeit herauszunehmen, um jeden Anschein der Befangenheit zu vermeiden, denn mit den interdisziplinären Gesellschaften ist es ja möglich, dass sich jetzt auch Gewerbetreibende an Ziviltechnikergesellschaften beteiligen, und wenn dann mit Brief und Siegel Urkunden ausgestellt werden, könnte der Anschein der Befangenheit entstehen. Dieser wird dadurch vermieden, dass dieser Entwurf im Sinne der Abänderungsanträge des Kollegen Matznetter und des Kollegen Angerer angenommen wird.",61120,Abgeordneter Dr. Johannes Margreiter (NEOS),NRSITZ_00089_PARSED,"Das	PRO.Dem.Subst.-.Nom.Sg.Neut wäre	VFIN.Sein.3.Sg.Past.Subj sogar	ADV sehr	ADV wichtig	ADJD.Pos ,	SYM.Pun.Comma und	CONJ.Coord.- ich	PRO.Pers.Subst.1.Nom.Sg.* weiß	VFIN.Full.1.Sg.Pres.Ind nicht	PART.Neg ,	SYM.Pun.Comma woher	PROADV.Inter Sie	PRO.Pers.Subst.3.Nom.Pl.* die	ART.Def.Acc.Sg.Fem Information	N.Reg.Acc.Sg.Fem haben	VFIN.Haben.3.Pl.Pres.Ind mir	PRO.Pers.Subst.1.Dat.Sg.* liegt	VFIN.Full.3.Sg.Pres.Ind ein	ART.Indef.Nom.Sg.Masc E-Mail	N.Reg.Nom.Sg.Masc der	ART.Def.Gen.Sg.Fem Ziviltechnikerkammer	N.Reg.Gen.Sg.Fem von	APPR.Dat heute	ADV vor	PART.Verb ,	SYM.Pun.Comma in	APPR.In dem	PRO.Rel.Subst.-.Dat.Sg.Neut neuerlich	ADJD.Pos darauf	PROADV.Dem verwiesen	VPP.Full.Psp wird	VFIN.Aux.3.Sg.Pres.Ind ,	SYM.Pun.Comma dass	CONJ.SubFin.- es	PRO.Pers.Subst.3.Nom.Sg.Neut eben	ADV entscheidend	ADJD.Pos ,	SYM.Pun.Comma eben	ADV wichtig	ADJD.Pos ist	VFIN.Sein.3.Sg.Pres.Ind ,	SYM.Pun.Comma die	ART.Def.Acc.Sg.Fem Urkundentätigkeit	N.Reg.Acc.Sg.Fem herauszunehmen	VINF.Full.zu ,	SYM.Pun.Comma um	CONJ.SubInf.- jeden	PRO.Indef.Attr.-.Acc.Sg.Masc Anschein	N.Reg.Acc.Sg.Masc der	ART.Def.Gen.Sg.Fem Befangenheit	N.Reg.Gen.Sg.Fem zu	PART.Zu vermeiden	VINF.Full.- ,	SYM.Pun.Comma denn	CONJ.Coord.Denn mit	APPR.Dat den	ART.Def.Dat.Pl.Fem interdisziplinären	ADJA.Pos.Dat.Pl.Fem Gesellschaften	N.Reg.Dat.Pl.Fem ist	VFIN.Sein.3.Sg.Pres.Ind es	PRO.Pers.Subst.3.Nom.Sg.Neut ja	ADV möglich	ADJD.Pos ,	SYM.Pun.Comma dass	CONJ.SubFin.- sich	PRO.Refl.Subst.3.Acc.Sg.* jetzt	ADV auch	ADV Gewerbetreibende	N.Reg.Acc.Sg.Fem an	APPR.An Ziviltechnikergesellschaften	N.Reg.Dat.Pl.Fem beteiligen	VINF.Full.- ,	SYM.Pun.Comma und	CONJ.Coord.- wenn	CONJ.SubFin.- dann	ADV mit	APPR.Dat Brief	N.Reg.Dat.Sg.Masc und	CONJ.Coord.- Siegel	N.Reg.Dat.Sg.Neut Urkunden	N.Reg.Nom.Pl.Fem ausgestellt	VPP.Full.Psp werden	VFIN.Aux.3.Pl.Pres.Ind ,	SYM.Pun.Comma könnte	VFIN.Mod.3.Sg.Past.Subj der	ART.Def.Nom.Sg.Masc Anschein	N.Reg.Nom.Sg.Masc der	ART.Def.Gen.Sg.Fem Befangenheit	N.Reg.Gen.Sg.Fem entstehen	VINF.Full.- .	SYM.Pun.Sent  Dieser	PRO.Dem.Subst.-.Nom.Sg.Masc wird	VFIN.Aux.3.Sg.Pres.Ind dadurch	PROADV.Dem vermieden	VPP.Full.Psp ,	SYM.Pun.Comma dass	CONJ.SubFin.- dieser	PRO.Dem.Attr.-.Nom.Sg.Masc Entwurf	N.Reg.Nom.Sg.Masc im	APPRART.Dat.Sg.Masc Sinne	N.Reg.Dat.Sg.Masc der	ART.Def.Gen.Pl.Masc Abänderungsanträge	N.Reg.Gen.Pl.Masc des	ART.Def.Gen.Sg.Masc Kollegen	N.Reg.Gen.Sg.Masc Matznetter	N.Name.Nom.Sg.Masc und	CONJ.Coord.- des	ART.Def.Gen.Sg.Masc Kollegen	N.Reg.Gen.Sg.Masc Angerer	N.Reg.Nom.Sg.Masc angenommen	VPP.Full.Psp wird	VFIN.Aux.3.Sg.Pres.Ind .	SYM.Pun.Sent  ",True,Both,Standard,Standard,['e'],Alliteration,
10518,"ich bezahlen? Kann ich meine Aufträge ausführen, abhandeln, abarbeiten, habe ich genügend Mitarbeiter?",25683,Abgeordneter Josef Schellhorn (NEOS),NRSITZ_00012_PARSED,"ich	PRO.Pers.Subst.1.Nom.Sg.* bezahlen	VFIN.Full.1.Pl.Pres.Ind ?	SYM.Pun.Sent  Kann	VFIN.Mod.3.Sg.Pres.Ind ich	PRO.Pers.Subst.1.Nom.Sg.* meine	PRO.Poss.Attr.-.Acc.Pl.Masc Aufträge	N.Reg.Acc.Pl.Masc ausführen	VINF.Full.- ,	SYM.Pun.Comma abhandeln	VINF.Full.- ,	SYM.Pun.Comma abarbeiten	VINF.Full.- ,	SYM.Pun.Comma habe	VFIN.Haben.1.Sg.Pres.Ind ich	PRO.Pers.Subst.1.Nom.Sg.* genügend	PRO.Indef.Attr.-.*.*.* Mitarbeiter	N.Reg.Acc.Pl.Masc ?	SYM.Pun.Sent  ",True,Both,Standard,Standard,['a'],Alliteration,
