id,text,,speaker,file,tagged,ADJA.Comp_ADJD.Comp_or,ADJA.Sup_ADJD.Sup_or,ADJA_ADJD_or,adja_to_ignore,adjd_to_ignore,adja_comp_to_ignore,adjd_comp_to_ignore,adja_sup_to_ignore,adjd_sup_to_ignore,contains_positive_with_set,contains_positive_with_deklination_set,contains_comparative,contains_comparative_with_set,contains_comparative_with_deklination_set,contains_comparative_new_no_set,contains_comparative_new_with_set,contains_comparative_new_with_declension_set,contains_comparative_new_with_declension_set_and_approach,comparative_set_only,contains_superlative,has_no_real_superlative,has_superlative_word,label,Comments
10161,"Das dritte Problem aber ist das, wovor ich am meisten Angst habe. Es ist das, was man in den letzten Jahren von Ihnen in der neuen ÖVP so mitbekommen hat: dass Sie, falls uns die Europäische Kommission sagt, dass das mit dem dritten gesenkten Mehrwertsteuersatz und überhaupt mit dem dritten Mehrwertsteuersatz nicht geht, das machen, was Sie in den letzten Jahren so gern machen wieder in Ihr gebetsmühlenartiges EU-Bashing einzusteigen. Das kennen wir von der neuen türkisen ÖVP so ähnlich wie sonst nur von der FPÖ.",30708,"Abgeordneter Dr. Nikolaus Scherak, MA",NRSITZ_00040_PARSED,"Das	ART.Def.Nom.Sg.Neut dritte	ADJA.Pos.Nom.Sg.Neut Problem	N.Reg.Nom.Sg.Neut aber	ADV ist	VFIN.Sein.3.Sg.Pres.Ind das	PRO.Dem.Subst.-.Nom.Sg.Neut ,	SYM.Pun.Comma wovor	PROADV.Inter ich	PRO.Pers.Subst.1.Nom.Sg.* am	PART.Deg meisten	PRO.Indef.Attr.-.*.*.* Angst	N.Reg.Acc.Sg.Fem habe	VFIN.Haben.1.Sg.Pres.Ind .	SYM.Pun.Sent  Es	PRO.Pers.Subst.3.Nom.Sg.Neut ist	VFIN.Sein.3.Sg.Pres.Ind das	PRO.Dem.Subst.-.Nom.Sg.Neut ,	SYM.Pun.Comma was	PRO.Rel.Subst.-.Acc.Sg.Neut man	PRO.Indef.Subst.-.Nom.Sg.* in	APPR.In den	ART.Def.Dat.Pl.Neut letzten	ADJA.Pos.Dat.Pl.Neut Jahren	N.Reg.Dat.Pl.Neut von	APPR.Dat Ihnen	PRO.Pers.Subst.3.Dat.Pl.* in	APPR.In der	ART.Def.Dat.Sg.Fem neuen	ADJA.Pos.Dat.Sg.Fem ÖVP	N.Name.Dat.Sg.Fem so	ADV mitbekommen	VPP.Full.Psp hat	VFIN.Haben.3.Sg.Pres.Ind :	SYM.Pun.Colon dass	CONJ.SubFin.- Sie	PRO.Pers.Subst.3.Nom.Pl.* ,	SYM.Pun.Comma falls	CONJ.SubFin.- uns	PRO.Pers.Subst.1.Dat.Pl.* die	ART.Def.Nom.Sg.Fem Europäische	ADJA.Pos.Nom.Sg.Fem Kommission	N.Reg.Nom.Sg.Fem sagt	VFIN.Full.3.Sg.Pres.Ind ,	SYM.Pun.Comma dass	CONJ.SubFin.- das	PRO.Dem.Subst.-.Nom.Sg.Neut mit	APPR.Dat dem	ART.Def.Dat.Sg.Masc dritten	ADJA.Pos.Dat.Sg.Masc gesenkten	ADJA.Pos.Dat.Sg.Masc Mehrwertsteuersatz	N.Reg.Dat.Sg.Masc und	CONJ.Coord.- überhaupt	ADV mit	APPR.Dat dem	ART.Def.Dat.Sg.Masc dritten	ADJA.Pos.Dat.Sg.Masc Mehrwertsteuersatz	N.Reg.Dat.Sg.Masc nicht	PART.Neg geht	VFIN.Full.3.Sg.Pres.Ind ,	SYM.Pun.Comma das	PRO.Dem.Subst.-.Acc.Sg.Neut machen	VINF.Full.- ,	SYM.Pun.Comma was	PRO.Inter.Subst.-.Acc.Sg.Neut Sie	PRO.Pers.Subst.3.Nom.Pl.* in	APPR.In den	ART.Def.Dat.Pl.Neut letzten	ADJA.Pos.Dat.Pl.Neut Jahren	N.Reg.Dat.Pl.Neut so	ADV gern	ADV machen	VFIN.Full.3.Pl.Pres.Ind wieder	ADV in	APPR.In Ihr	PRO.Poss.Attr.-.Acc.Sg.Neut gebetsmühlenartiges	ADJA.Pos.Acc.Sg.Neut EU-Bashing	N.Reg.Acc.Sg.Neut einzusteigen	VINF.Full.zu .	SYM.Pun.Sent  Das	PRO.Dem.Subst.-.Acc.Sg.Neut kennen	VFIN.Full.1.Pl.Pres.Ind wir	PRO.Pers.Subst.1.Nom.Pl.* von	APPR.Dat der	ART.Def.Dat.Sg.Fem neuen	ADJA.Pos.Dat.Sg.Fem türkisen	ADJA.Pos.Dat.Sg.Fem ÖVP	N.Name.Dat.Sg.Fem so	ADV ähnlich	ADJD.Pos wie	CONJ.Comp.- sonst	ADV nur	ADV von	APPR.Dat der	ART.Def.Dat.Sg.Fem FPÖ	N.Name.Dat.Sg.Fem .	SYM.Pun.Sent  ",False,False,True,False,False,True,True,True,True,True,True,True,True,True,True,True,True,True,False,True,True,True,Opinionated,
10162,"Grundsätzlich teilen wir das Anliegen des SPÖ-Antrages, das hier besprochen wird, sowie auch die anderen Anträge der SPÖ des Kollegen Keck. Selbstverständlich wäre es uns am liebsten, wenn wir morgen keine Vollspaltenböden mehr in der österreichischen Landwirtschaft fänden. Allerdings haben wir auch beim Expertenhearing gehört, dass die Materie komplex ist und wir wenig erreichen werden, wenn wir einfach nur ein Verbot aufsetzen und uns zurücklehnen. Es ist fraglich, ob 2025 für die relativ kleinen österrei chischen Betriebe nicht zu früh ist, um Umbauten durchzuführen und diese zu finanzieren.",45895,"Abgeordnete Fiona Fiedler, BEd (NEOS)",NRSITZ_00113_PARSED,"Grundsätzlich	ADJD.Pos teilen	VFIN.Full.1.Pl.Pres.Ind wir	PRO.Pers.Subst.1.Nom.Pl.* das	ART.Def.Acc.Sg.Neut Anliegen	N.Reg.Acc.Sg.Neut des	ART.Def.Gen.Sg.Masc SPÖ-Antrages	N.Reg.Gen.Sg.Masc ,	SYM.Pun.Comma das	PRO.Rel.Subst.-.Nom.Sg.Neut hier	ADV besprochen	VPP.Full.Psp wird	VFIN.Aux.3.Sg.Pres.Ind ,	SYM.Pun.Comma sowie	CONJ.Coord.- auch	ADV die	ART.Def.Nom.Pl.Masc anderen	ADJA.Pos.Nom.Pl.Masc Anträge	N.Reg.Nom.Pl.Masc der	ART.Def.Gen.Sg.Fem SPÖ	N.Name.Gen.Sg.Fem des	ART.Def.Gen.Sg.Masc Kollegen	N.Reg.Gen.Sg.Masc Keck	ADJD.Pos .	SYM.Pun.Sent  Selbstverständlich	ADV wäre	VFIN.Sein.3.Sg.Past.Subj es	PRO.Pers.Subst.3.Nom.Sg.Neut uns	PRO.Pers.Subst.1.Dat.Pl.* am	PART.Deg liebsten	ADJD.Sup ,	SYM.Pun.Comma wenn	CONJ.SubFin.- wir	PRO.Pers.Subst.1.Nom.Pl.* morgen	ADV keine	PRO.Indef.Attr.-.Acc.Pl.Fem Vollspaltenböden	N.Reg.Acc.Pl.Fem mehr	ADV in	APPR.In der	ART.Def.Dat.Sg.Fem österreichischen	ADJA.Pos.Dat.Sg.Fem Landwirtschaft	N.Reg.Dat.Sg.Fem fänden	VFIN.Full.3.Pl.Past.Subj .	SYM.Pun.Sent  Allerdings	ADV haben	VFIN.Haben.1.Pl.Pres.Ind wir	PRO.Pers.Subst.1.Nom.Pl.* auch	ADV beim	APPRART.Dat.Sg.Neut Expertenhearing	N.Reg.Dat.Sg.Neut gehört	VPP.Full.Psp ,	SYM.Pun.Comma dass	CONJ.SubFin.- die	ART.Def.Nom.Sg.Fem Materie	N.Reg.Nom.Sg.Fem komplex	ADJD.Pos ist	VFIN.Sein.3.Sg.Pres.Ind und	CONJ.Coord.- wir	PRO.Pers.Subst.1.Nom.Pl.* wenig	PRO.Indef.Subst.-.*.*.* erreichen	VINF.Full.- werden	VFIN.Aux.1.Pl.Pres.Ind ,	SYM.Pun.Comma wenn	CONJ.SubFin.- wir	PRO.Pers.Subst.1.Nom.Pl.* einfach	ADV nur	ADV ein	ART.Indef.Acc.Sg.Neut Verbot	N.Reg.Acc.Sg.Neut aufsetzen	VINF.Full.- und	CONJ.Coord.- uns	PRO.Pers.Subst.1.Acc.Pl.* zurücklehnen	VINF.Full.- .	SYM.Pun.Sent  Es	PRO.Pers.Subst.3.Nom.Sg.Neut ist	VFIN.Sein.3.Sg.Pres.Ind fraglich	ADJD.Pos ,	SYM.Pun.Comma ob	CONJ.SubFin.- 2025	CARD für	APPR.Acc die	ART.Def.Acc.Pl.Masc relativ	ADJD.Pos kleinen	ADJA.Pos.Acc.Pl.Masc österrei	CARD chischen	ADJA.Pos.Acc.Pl.Masc Betriebe	N.Reg.Acc.Pl.Masc nicht	PART.Neg zu	PART.Deg früh	ADJD.Pos ist	VFIN.Sein.3.Sg.Pres.Ind ,	SYM.Pun.Comma um	CONJ.SubInf.- Umbauten	N.Reg.Acc.Pl.Masc durchzuführen	VINF.Full.zu und	CONJ.Coord.- diese	PRO.Dem.Subst.-.Nom.Pl.Masc zu	PART.Zu finanzieren	VINF.Full.- .	SYM.Pun.Sent  ",False,True,True,True,True,True,True,True,False,True,True,False,False,False,False,False,False,True,True,True,False,True,Opinionated,
10163,"Ich bin normalerweise jemand, der durchaus auch die Regierungsmitglieder kritisiert. Man muss ehrlich sagen, dass in den Stellungnahmen einiges drinnen gewesen ist, dass im ersten Entwurf ich glaube, Sie, Frau Bundesministerin, wissen das am besten einige Dinge noch nicht perfekt waren, aber es wurde wirklich viel an Energie investiert, um diese Dinge zu verbessern. Ich glaube, dass der jetzt vorliegende Entwurf ein durchaus akzeptabler und in weiten Teilen sogar sehr guter Entwurf ist. Ich kann Ihnen da durchaus auch gratulieren auch einmal vonseiten der Opposition.",49541,Abgeordneter Douglas Hoyos-Trauttmansdorff (NEOS),NRSITZ_00125_PARSED,"Ich	PRO.Pers.Subst.1.Nom.Sg.* bin	VFIN.Sein.1.Sg.Pres.Ind normalerweise	ADV jemand	PRO.Indef.Subst.-.Nom.Sg.Masc ,	SYM.Pun.Comma der	PRO.Rel.Subst.-.Nom.Sg.Masc durchaus	ADV auch	ADV die	ART.Def.Acc.Pl.Neut Regierungsmitglieder	N.Reg.Acc.Pl.Neut kritisiert	VFIN.Full.3.Sg.Pres.Ind .	SYM.Pun.Sent  Man	PRO.Indef.Subst.-.Nom.Sg.* muss	VFIN.Mod.3.Sg.Pres.Ind ehrlich	ADJD.Pos sagen	VINF.Full.- ,	SYM.Pun.Comma dass	CONJ.SubFin.- in	APPR.In den	ART.Def.Dat.Pl.Fem Stellungnahmen	N.Reg.Dat.Pl.Fem einiges	PRO.Indef.Subst.-.Nom.Sg.Neut drinnen	ADV gewesen	VPP.Sein.Psp ist	VFIN.Sein.3.Sg.Pres.Ind ,	SYM.Pun.Comma dass	CONJ.SubFin.- im	APPRART.Dat.Sg.Masc ersten	ADJA.Pos.Dat.Sg.Masc Entwurf	N.Reg.Dat.Sg.Masc ich	PRO.Pers.Subst.1.Nom.Sg.* glaube	VFIN.Full.1.Sg.Pres.Ind ,	SYM.Pun.Comma Sie	PRO.Pers.Subst.3.Nom.Sg.Fem ,	SYM.Pun.Comma Frau	N.Reg.Nom.Sg.Fem Bundesministerin	N.Reg.Nom.Sg.Fem ,	SYM.Pun.Comma wissen	VFIN.Full.3.Pl.Pres.Ind das	ART.Def.Acc.Sg.Neut am	PART.Deg besten	ADJD.Sup einige	PRO.Indef.Attr.-.Nom.Pl.Neut Dinge	N.Reg.Nom.Pl.Neut noch	ADV nicht	PART.Neg perfekt	ADJD.Pos waren	VFIN.Sein.3.Pl.Past.Ind ,	SYM.Pun.Comma aber	CONJ.Coord.Aber es	PRO.Pers.Subst.3.Nom.Sg.Neut wurde	VFIN.Aux.3.Sg.Past.Ind wirklich	ADJD.Pos viel	ADV an	APPR.An Energie	N.Reg.Dat.Sg.Fem investiert	VPP.Full.Psp ,	SYM.Pun.Comma um	CONJ.SubInf.- diese	PRO.Dem.Attr.-.Acc.Pl.Neut Dinge	N.Reg.Acc.Pl.Neut zu	PART.Zu verbessern	VINF.Full.- .	SYM.Pun.Sent  Ich	PRO.Pers.Subst.1.Nom.Sg.* glaube	VFIN.Full.1.Sg.Pres.Ind ,	SYM.Pun.Comma dass	CONJ.SubFin.- der	ART.Def.Nom.Sg.Masc jetzt	ADV vorliegende	ADJA.Pos.Nom.Sg.Masc Entwurf	N.Reg.Nom.Sg.Masc ein	ART.Indef.Nom.Sg.Masc durchaus	ADV akzeptabler	ADJA.Pos.Nom.Sg.Masc und	CONJ.Coord.- in	APPR.In weiten	ADJA.Pos.Dat.Pl.Masc Teilen	N.Reg.Dat.Pl.Masc sogar	ADV sehr	ADV guter	ADJA.Pos.Nom.Sg.Masc Entwurf	N.Reg.Nom.Sg.Masc ist	VFIN.Sein.3.Sg.Pres.Ind .	SYM.Pun.Sent  Ich	PRO.Pers.Subst.1.Nom.Sg.* kann	VFIN.Mod.1.Sg.Pres.Ind Ihnen	PRO.Pers.Subst.3.Dat.Pl.* da	ADV durchaus	ADV auch	ADV gratulieren	VINF.Full.- auch	ADV einmal	ADV vonseiten	APPR.Gen der	ART.Def.Gen.Sg.Fem Opposition	N.Reg.Gen.Sg.Fem .	SYM.Pun.Sent  ",False,True,True,True,True,True,True,True,False,True,True,False,False,False,False,False,False,True,True,True,False,True,Opinionated,
10164,"Mein alter Freund und Klubobmann der Tiroler Volkspartei Mag. Jakob Wolf ist Bürgermeister der Gemeinde Umhausen, eine der am stärksten betroffenen Gemeinden. Sein Leitsatz ist immer, Teil der Lösung und nicht Teils des Problems zu sein das sollten sich auch einige hier bitte hinter die Ohren schreiben , aber gerade Umhausen zeigt den Widerspruch am besten auf: Diese Tourismusgemeinde profitiert einerseits vom Gesundheitshotel Vivea, dort werden Kuren angeboten, auf der anderen Seite sind natürlich auch die Gebäude in dieser Gemeinde massivst belastet, wodurch Kosten entstehen.",19822,Abgeordneter Franz Hörl (ÖVP),NRSITZ_00034_PARSED,"Mein	PRO.Poss.Attr.-.Nom.Sg.Masc alter	ADJA.Pos.Nom.Sg.Masc Freund	N.Reg.Nom.Sg.Masc und	CONJ.Coord.- Klubobmann	N.Reg.Nom.Sg.Masc der	ART.Def.Gen.Sg.Fem Tiroler	ADJA.Pos.*.*.* Volkspartei	N.Reg.Gen.Sg.Fem Mag	VFIN.Mod.3.Sg.Pres.Ind .	SYM.Pun.Sent  Jakob	N.Name.Nom.Sg.Masc Wolf	N.Name.Nom.Sg.Masc ist	VFIN.Sein.3.Sg.Pres.Ind Bürgermeister	N.Reg.Nom.Sg.Masc der	ART.Def.Gen.Sg.Fem Gemeinde	N.Reg.Gen.Sg.Fem Umhausen	VINF.Full.- ,	SYM.Pun.Comma eine	PRO.Indef.Subst.-.Nom.Sg.Fem der	ART.Def.Gen.Pl.Fem am	PART.Deg stärksten	ADJD.Sup betroffenen	ADJA.Pos.Gen.Pl.Fem Gemeinden	N.Reg.Gen.Pl.Fem .	SYM.Pun.Sent  Sein	PRO.Poss.Attr.-.Nom.Sg.Masc Leitsatz	N.Reg.Nom.Sg.Masc ist	VFIN.Sein.3.Sg.Pres.Ind immer	ADV ,	SYM.Pun.Comma Teil	N.Reg.Nom.Sg.Masc der	ART.Def.Gen.Sg.Fem Lösung	N.Reg.Gen.Sg.Fem und	CONJ.Coord.- nicht	PART.Neg Teils	ADV des	ART.Def.Gen.Sg.Neut Problems	N.Reg.Gen.Sg.Neut zu	PART.Zu sein	VINF.Sein.- das	PRO.Dem.Subst.-.Acc.Sg.Neut sollten	VFIN.Mod.3.Pl.Past.Ind sich	PRO.Refl.Subst.3.Acc.Pl.* auch	ADV einige	PRO.Indef.Subst.-.Nom.Pl.* hier	ADV bitte	ADV hinter	APPR.Hinter die	ART.Def.Acc.Pl.Neut Ohren	N.Reg.Acc.Pl.Neut schreiben	VINF.Full.- ,	SYM.Pun.Comma aber	CONJ.Coord.Aber gerade	ADV Umhausen	N.Reg.Nom.Sg.Neut zeigt	VFIN.Full.3.Sg.Pres.Ind den	ART.Def.Acc.Sg.Masc Widerspruch	N.Reg.Acc.Sg.Masc am	PART.Deg besten	ADJD.Sup auf	PART.Verb :	SYM.Pun.Colon Diese	PRO.Dem.Attr.-.Nom.Sg.Fem Tourismusgemeinde	N.Reg.Nom.Sg.Fem profitiert	VFIN.Full.3.Sg.Pres.Ind einerseits	ADV vom	APPRART.Dat.Sg.Neut Gesundheitshotel	N.Reg.Dat.Sg.Neut Vivea	N.Name.Nom.Sg.Neut ,	SYM.Pun.Comma dort	ADV werden	VFIN.Aux.3.Pl.Pres.Ind Kuren	N.Reg.Nom.Pl.Fem angeboten	VPP.Full.Psp ,	SYM.Pun.Comma auf	APPR.Auf der	ART.Def.Dat.Sg.Fem anderen	ADJA.Pos.Dat.Sg.Fem Seite	N.Reg.Dat.Sg.Fem sind	VFIN.Sein.3.Pl.Pres.Ind natürlich	ADV auch	ADV die	ART.Def.Nom.Pl.Neut Gebäude	N.Reg.Nom.Pl.Neut in	APPR.In dieser	PRO.Dem.Attr.-.Dat.Sg.Fem Gemeinde	N.Reg.Dat.Sg.Fem massivst	ADJD.Pos belastet	VPP.Full.Psp ,	SYM.Pun.Comma wodurch	PROADV.Inter Kosten	N.Reg.Nom.Pl.* entstehen	VFIN.Full.3.Pl.Pres.Ind .	SYM.Pun.Sent  ",False,True,True,True,True,True,True,True,False,True,True,False,False,False,False,False,False,False,False,True,False,True,Opinionated,
10165,"Fällig wäre allerdings eine Aktualisierung der Kinderkostenstudie; die ist zuletzt 1964 gemacht worden. Auch die Sozialminister Hundstorfer und Stöger haben die Kinderkostenstudie nicht aktualisiert, was sie hätten machen können. Ja, sie haben es nicht gemacht. Aus dieser aktualisierten Studie könnte man evidenzbasiert ableiten, welche konkreten Maßnahmen zu setzen sind, um Kinderarmut genau dort treffsicher zu bekämpfen, wo sie am schlimmsten ist. Ja, Kollege Leichtfried, der Schmäh hat schon einen relativ langen Bart, ich muss schauen, dass ich beim Zurückgehen nicht drüberstolpere.",53191,Abgeordneter Mag. Gerald Loacker (NEOS),NRSITZ_00003_PARSED,"Fällig	ADJD.Pos wäre	VFIN.Sein.3.Sg.Past.Subj allerdings	ADV eine	ART.Indef.Nom.Sg.Fem Aktualisierung	N.Reg.Nom.Sg.Fem der	ART.Def.Gen.Sg.Fem Kinderkostenstudie	N.Reg.Gen.Sg.Fem ;	SYM.Pun.Sent die	PRO.Rel.Subst.-.Nom.Sg.Fem ist	VFIN.Sein.3.Sg.Pres.Ind zuletzt	ADV 1964	CARD gemacht	VPP.Full.Psp worden	VPP.Aux.Psp .	SYM.Pun.Sent  Auch	ADV die	ART.Def.Nom.Pl.Masc Sozialminister	N.Reg.Nom.Pl.Masc Hundstorfer	N.Name.Nom.Sg.Masc und	CONJ.Coord.- Stöger	N.Name.Nom.Sg.Masc haben	VFIN.Haben.3.Pl.Pres.Ind die	ART.Def.Acc.Sg.Fem Kinderkostenstudie	N.Reg.Acc.Sg.Fem nicht	PART.Neg aktualisiert	VPP.Full.Psp ,	SYM.Pun.Comma was	PRO.Inter.Subst.-.Acc.Sg.Neut sie	PRO.Pers.Subst.3.Nom.Pl.* hätten	VFIN.Haben.3.Pl.Past.Subj machen	VINF.Full.- können	VINF.Mod.- .	SYM.Pun.Sent  Ja	PART.Ans ,	SYM.Pun.Comma sie	PRO.Pers.Subst.3.Nom.Pl.* haben	VFIN.Haben.3.Pl.Pres.Ind es	PRO.Pers.Subst.3.Acc.Sg.Neut nicht	PART.Neg gemacht	VPP.Full.Psp .	SYM.Pun.Sent  Aus	APPR.Dat dieser	PRO.Dem.Attr.-.Dat.Sg.Fem aktualisierten	ADJA.Pos.Dat.Sg.Fem Studie	N.Reg.Dat.Sg.Fem könnte	VFIN.Mod.3.Sg.Past.Subj man	PRO.Indef.Subst.-.Nom.Sg.* evidenzbasiert	ADJD.Pos ableiten	VINF.Full.- ,	SYM.Pun.Comma welche	PRO.Inter.Attr.-.Nom.Pl.Fem konkreten	ADJA.Pos.Nom.Pl.Fem Maßnahmen	N.Reg.Nom.Pl.Fem zu	PART.Zu setzen	VINF.Full.- sind	VFIN.Sein.3.Pl.Pres.Ind ,	SYM.Pun.Comma um	CONJ.SubInf.- Kinderarmut	N.Reg.Acc.Sg.Fem genau	ADJD.Pos dort	ADV treffsicher	ADJD.Pos zu	PART.Zu bekämpfen	VINF.Full.- ,	SYM.Pun.Comma wo	PROADV.Inter sie	PRO.Pers.Subst.3.Nom.Sg.Fem am	PART.Deg schlimmsten	ADJD.Sup ist	VFIN.Sein.3.Sg.Pres.Ind .	SYM.Pun.Sent  Ja	PART.Ans ,	SYM.Pun.Comma Kollege	N.Reg.Nom.Sg.Masc Leichtfried	N.Name.Nom.Sg.Masc ,	SYM.Pun.Comma der	ART.Def.Nom.Sg.Masc Schmäh	VIMP.Full.2.Sg hat	VFIN.Haben.3.Sg.Pres.Ind schon	ADV einen	ART.Indef.Acc.Sg.Masc relativ	ADJD.Pos langen	ADJA.Pos.Acc.Sg.Masc Bart	N.Reg.Acc.Sg.Masc ,	SYM.Pun.Comma ich	PRO.Pers.Subst.1.Nom.Sg.* muss	VFIN.Mod.1.Sg.Pres.Ind schauen	VINF.Full.- ,	SYM.Pun.Comma dass	CONJ.SubFin.- ich	PRO.Pers.Subst.1.Nom.Sg.* beim	APPRART.Dat.Sg.Neut Zurückgehen	N.Reg.Dat.Sg.Neut nicht	PART.Neg drüberstolpere	VFIN.Full.1.Sg.Pres.Ind .	SYM.Pun.Sent  ",False,True,True,True,True,True,True,True,False,True,True,False,False,False,False,False,False,False,False,True,False,True,Opinionated,
10166,"es in den nächsten Tagen, Wochen und Monaten genau darum gehen: zu eruieren, wie wir auf einen gemeinsamen Zielpfad, der ja vielleicht noch am ehesten unbestritten ist, kommen. Wir haben einen ambitionierteren als jenen, den die Europäische Union vorgibt, wie Sie wissen, und ich glaube, wir sind auch die Einzigen damit.",62661,Abgeordneter Mag. Werner Kogler,NRSITZ_00003_PARSED,"es	PRO.Pers.Subst.3.Nom.Sg.Neut in	APPR.In den	ART.Def.Dat.Pl.Masc nächsten	ADJA.Sup.Dat.Pl.Masc Tagen	N.Reg.Dat.Pl.Masc ,	SYM.Pun.Comma Wochen	N.Reg.Dat.Pl.Fem und	CONJ.Coord.- Monaten	N.Reg.Dat.Pl.Masc genau	ADJD.Pos darum	PROADV.Dem gehen	VINF.Full.- :	SYM.Pun.Colon zu	PART.Zu eruieren	VINF.Full.- ,	SYM.Pun.Comma wie	PROADV.Inter wir	PRO.Pers.Subst.1.Nom.Pl.* auf	APPR.Auf einen	ART.Indef.Acc.Sg.Masc gemeinsamen	ADJA.Pos.Acc.Sg.Masc Zielpfad	N.Reg.Acc.Sg.Masc ,	SYM.Pun.Comma der	PRO.Rel.Subst.-.Nom.Sg.Masc ja	ADV vielleicht	ADV noch	ADV am	PART.Deg ehesten	ADJD.Sup unbestritten	ADJD.Pos ist	VFIN.Sein.3.Sg.Pres.Ind ,	SYM.Pun.Comma kommen	VFIN.Full.3.Pl.Pres.Ind .	SYM.Pun.Sent  Wir	PRO.Pers.Subst.1.Nom.Pl.* haben	VFIN.Haben.1.Pl.Pres.Ind einen	ART.Indef.Acc.Sg.Masc ambitionierteren	ADJA.Comp.Acc.Sg.Masc als	APPR.Als jenen	PRO.Dem.Subst.-.Acc.Sg.Masc ,	SYM.Pun.Comma den	PRO.Rel.Subst.-.Acc.Sg.Masc die	ART.Def.Nom.Sg.Fem Europäische	ADJA.Pos.Nom.Sg.Fem Union	N.Reg.Nom.Sg.Fem vorgibt	VFIN.Full.3.Sg.Pres.Ind ,	SYM.Pun.Comma wie	PROADV.Inter Sie	PRO.Pers.Subst.3.Nom.Pl.* wissen	VFIN.Full.3.Pl.Pres.Ind ,	SYM.Pun.Comma und	CONJ.Coord.- ich	PRO.Pers.Subst.1.Nom.Sg.* glaube	VFIN.Full.1.Sg.Pres.Ind ,	SYM.Pun.Comma wir	PRO.Pers.Subst.1.Nom.Pl.* sind	VFIN.Sein.1.Pl.Pres.Ind auch	ADV die	ART.Def.Nom.Pl.* Einzigen	N.Reg.Nom.Pl.* damit	PROADV.Dem .	SYM.Pun.Sent  ",True,True,True,True,True,False,True,True,False,True,True,False,False,False,False,False,False,True,False,True,False,False,Opinionated,
10167,"Es muss doch darum gehen das müssen jetzt einmal alle verstanden haben , dass wir unterbinden, dass die Trägerinnen und Träger das Virus weiterverbreiten, und das sind natürlich gerade die Kinder, die das durch ihr Sozialverhalten weitertragen, und zwar genau dorthin, wo es am wenigsten hingehört, nämlich zu den Älteren und gesundheitlich Vorbelasteten et cetera.",63112,"Bundesminister für Kunst, Kultur, öffentlichen Dienst und Sport Vizekanzler",NRSITZ_00016_PARSED,"Es	PRO.Pers.Subst.3.Nom.Sg.Neut muss	VFIN.Mod.3.Sg.Pres.Ind doch	ADV darum	PROADV.Dem gehen	VINF.Full.- das	PRO.Dem.Subst.-.Acc.Sg.Neut müssen	VFIN.Mod.3.Pl.Pres.Ind jetzt	ADV einmal	ADV alle	PRO.Indef.Subst.-.Nom.Pl.* verstanden	VPP.Full.Psp haben	VINF.Haben.- ,	SYM.Pun.Comma dass	CONJ.SubFin.- wir	PRO.Pers.Subst.1.Nom.Pl.* unterbinden	VFIN.Full.1.Pl.Pres.Ind ,	SYM.Pun.Comma dass	CONJ.SubFin.- die	ART.Def.Nom.Pl.Fem Trägerinnen	N.Reg.Nom.Pl.Fem und	CONJ.Coord.- Träger	N.Reg.Nom.Pl.Masc das	ART.Def.Acc.Sg.Neut Virus	N.Reg.Acc.Sg.Neut weiterverbreiten	VFIN.Full.3.Pl.Pres.Ind ,	SYM.Pun.Comma und	CONJ.Coord.- das	PRO.Dem.Subst.-.Nom.Sg.Neut sind	VFIN.Sein.3.Pl.Pres.Ind natürlich	ADV gerade	ADV die	ART.Def.Nom.Pl.Neut Kinder	N.Reg.Nom.Pl.Neut ,	SYM.Pun.Comma die	PRO.Rel.Subst.-.Nom.Pl.Neut das	PRO.Dem.Subst.-.Acc.Sg.Neut durch	APPR.Acc ihr	PRO.Poss.Attr.-.Acc.Sg.Neut Sozialverhalten	N.Reg.Acc.Sg.Neut weitertragen	VFIN.Full.3.Pl.Pres.Ind ,	SYM.Pun.Comma und	CONJ.Coord.- zwar	ADV genau	ADJD.Pos dorthin	ADV ,	SYM.Pun.Comma wo	PROADV.Inter es	PRO.Pers.Subst.3.Nom.Sg.Neut am	PART.Deg wenigsten	ADJD.Sup hingehört	VFIN.Full.3.Sg.Pres.Ind ,	SYM.Pun.Comma nämlich	ADV zu	APPR.Dat den	ART.Def.Dat.Pl.* Älteren	N.Reg.Dat.Pl.* und	CONJ.Coord.- gesundheitlich	ADJD.Pos Vorbelasteten	ADJA.Pos.Dat.Pl.Masc et	FM cetera	ADJD.Pos .	SYM.Pun.Sent  ",False,True,True,True,True,True,True,True,False,True,True,False,False,False,False,False,False,False,False,True,False,True,Opinionated,
10168,"Da können Sie sich egal, ob es Klubobmann Wöginger ist, ob Sie es sind, Herr Gödl noch hundertmal hierherstellen, irgendwelche Geschichten erzählen, die Sie sich aus den Fingern saugen. Das erinnert an die Reden des Herrn Bundeskanzlers, der sagt, wir haben es am besten gemeistert. Er erzählt irgendetwas! Sie stellen sich alle hierher, erzählen irgendetwas, in der Hoffnung, dass das dann bleibt.",28494,Abgeordnete Dr. Dagmar Belakowitsch (FPÖ),NRSITZ_00027_PARSED,"Da	ADV können	VFIN.Mod.3.Pl.Pres.Ind Sie	PRO.Pers.Subst.3.Nom.Pl.* sich	PRO.Refl.Subst.3.Acc.Pl.* egal	ADV ,	SYM.Pun.Comma ob	CONJ.SubFin.- es	PRO.Pers.Subst.3.Nom.Sg.Neut Klubobmann	N.Reg.Nom.Sg.Masc Wöginger	N.Name.Nom.Sg.Masc ist	VFIN.Sein.3.Sg.Pres.Ind ,	SYM.Pun.Comma ob	CONJ.SubFin.- Sie	PRO.Pers.Subst.3.Nom.Pl.* es	PRO.Pers.Subst.3.Acc.Sg.Neut sind	VFIN.Sein.3.Pl.Pres.Ind ,	SYM.Pun.Comma Herr	N.Reg.Nom.Sg.Masc Gödl	N.Name.Nom.Sg.Masc noch	ADV hundertmal	ADV hierherstellen	VINF.Full.zu ,	SYM.Pun.Comma irgendwelche	PRO.Indef.Attr.-.Acc.Pl.Fem Geschichten	N.Reg.Acc.Pl.Fem erzählen	VINF.Full.- ,	SYM.Pun.Comma die	PRO.Rel.Subst.-.Acc.Pl.Fem Sie	PRO.Pers.Subst.3.Nom.Pl.* sich	PRO.Refl.Subst.3.Acc.Pl.* aus	APPR.Dat den	ART.Def.Dat.Pl.Masc Fingern	N.Reg.Dat.Pl.Masc saugen	VFIN.Full.3.Pl.Pres.Ind .	SYM.Pun.Sent  Das	PRO.Dem.Subst.-.Nom.Sg.Neut erinnert	VFIN.Full.3.Sg.Pres.Ind an	APPR.An die	ART.Def.Acc.Pl.Fem Reden	N.Reg.Acc.Pl.Fem des	ART.Def.Gen.Sg.Masc Herrn	N.Reg.Gen.Sg.Masc Bundeskanzlers	N.Reg.Gen.Sg.Masc ,	SYM.Pun.Comma der	PRO.Rel.Subst.-.Nom.Sg.Masc sagt	VFIN.Full.3.Sg.Pres.Ind ,	SYM.Pun.Comma wir	PRO.Pers.Subst.1.Nom.Pl.* haben	VFIN.Haben.1.Pl.Pres.Ind es	PRO.Pers.Subst.3.Acc.Sg.Neut am	PART.Deg besten	ADJD.Sup gemeistert	VPP.Full.Psp .	SYM.Pun.Sent  Er	PRO.Pers.Subst.3.Nom.Sg.Masc erzählt	VFIN.Full.3.Sg.Pres.Ind irgendetwas	PRO.Indef.Subst.-.*.*.Neut !	SYM.Pun.Sent  Sie	PRO.Pers.Subst.3.Nom.Pl.* stellen	VFIN.Full.3.Pl.Pres.Ind sich	PRO.Refl.Subst.3.Dat.Pl.* alle	PRO.Indef.Subst.-.Nom.Pl.* hierher	PROADV.Dem ,	SYM.Pun.Comma erzählen	VFIN.Full.3.Pl.Pres.Ind irgendetwas	PRO.Indef.Subst.-.*.*.Neut ,	SYM.Pun.Comma in	APPR.In der	ART.Def.Dat.Sg.Fem Hoffnung	N.Reg.Dat.Sg.Fem ,	SYM.Pun.Comma dass	CONJ.SubFin.- das	PRO.Dem.Subst.-.Nom.Sg.Neut dann	ADV bleibt	VFIN.Full.3.Sg.Pres.Ind .	SYM.Pun.Sent  ",False,True,True,True,True,True,True,True,False,True,True,False,False,False,False,False,False,False,False,True,False,True,Opinionated,
10169,"Klar ist: Wenn wir an diesen Fragen scheitern, dann ist das kein reines Umweltproblem. In Australien stehen die Menschen nicht vor Umweltproblemen, sondern vor dem Qualm und vor den Trümmern ihrer Existenz. Und wenn in Österreich die Äcker kaputtgehen, die Wälder durch Stürme zerstört werden, dann sind das soziale und wirtschaftliche Probleme. Die Klimakrise verschärft alle sozialen und wirtschaftlichen Probleme, die wir haben und es trifft am schlimmsten immer die, die am wenigsten dazu beigetragen haben; weltweit, aber auch in Österreich.",61544,Abgeordneter Lukas Hammer (Grüne),NRSITZ_00008_PARSED,"Klar	ADJD.Pos ist	VFIN.Sein.3.Sg.Pres.Ind :	SYM.Pun.Colon Wenn	CONJ.SubFin.- wir	PRO.Pers.Subst.1.Nom.Pl.* an	APPR.An diesen	PRO.Dem.Attr.-.Dat.Pl.Fem Fragen	N.Reg.Dat.Pl.Fem scheitern	VINF.Full.- ,	SYM.Pun.Comma dann	ADV ist	VFIN.Sein.3.Sg.Pres.Ind das	PRO.Dem.Subst.-.Nom.Sg.Neut kein	PRO.Indef.Attr.-.Nom.Sg.Neut reines	ADJA.Pos.Nom.Sg.Neut Umweltproblem	N.Reg.Nom.Sg.Neut .	SYM.Pun.Sent  In	APPR.In Australien	N.Name.Dat.Sg.Neut stehen	VFIN.Full.3.Pl.Pres.Ind die	ART.Def.Nom.Pl.Masc Menschen	N.Reg.Nom.Pl.Masc nicht	PART.Neg vor	APPR.Vor Umweltproblemen	N.Reg.Dat.Pl.Neut ,	SYM.Pun.Comma sondern	CONJ.Coord.- vor	APPR.Vor dem	ART.Def.Dat.Sg.Masc Qualm	N.Reg.Dat.Sg.Masc und	CONJ.Coord.- vor	APPR.Vor den	ART.Def.Dat.Pl.* Trümmern	N.Reg.Dat.Pl.* ihrer	PRO.Poss.Attr.-.Gen.Sg.Fem Existenz	N.Reg.Gen.Sg.Fem .	SYM.Pun.Sent  Und	CONJ.Coord.- wenn	CONJ.SubFin.- in	APPR.In Österreich	N.Name.Dat.Sg.Neut die	ART.Def.Acc.Pl.Masc Äcker	N.Reg.Acc.Pl.Masc kaputtgehen	VINF.Full.- ,	SYM.Pun.Comma die	PRO.Rel.Subst.-.Nom.Pl.Masc Wälder	N.Reg.Nom.Pl.Masc durch	APPR.Acc Stürme	N.Reg.Acc.Pl.Masc zerstört	VPP.Full.Psp werden	VFIN.Aux.3.Pl.Pres.Ind ,	SYM.Pun.Comma dann	ADV sind	VFIN.Sein.3.Pl.Pres.Ind das	PRO.Dem.Subst.-.Nom.Sg.Neut soziale	ADJA.Pos.Acc.Pl.Neut und	CONJ.Coord.- wirtschaftliche	ADJA.Pos.Acc.Pl.Neut Probleme	N.Reg.Acc.Pl.Neut .	SYM.Pun.Sent  Die	ART.Def.Nom.Sg.Fem Klimakrise	N.Reg.Nom.Sg.Fem verschärft	VFIN.Full.3.Sg.Pres.Ind alle	PRO.Indef.Attr.-.Acc.Pl.Neut sozialen	ADJA.Pos.Acc.Pl.Neut und	CONJ.Coord.- wirtschaftlichen	ADJA.Pos.Acc.Pl.Neut Probleme	N.Reg.Acc.Pl.Neut ,	SYM.Pun.Comma die	PRO.Rel.Subst.-.Acc.Pl.Neut wir	PRO.Pers.Subst.1.Nom.Pl.* haben	VFIN.Haben.1.Pl.Pres.Ind und	CONJ.Coord.- es	PRO.Pers.Subst.3.Nom.Sg.Neut trifft	VFIN.Full.3.Sg.Pres.Ind am	PART.Deg schlimmsten	ADJD.Sup immer	ADV die	PRO.Dem.Subst.-.Acc.Pl.* ,	SYM.Pun.Comma die	PRO.Rel.Subst.-.Nom.Pl.Fem am	PART.Deg wenigsten	ADJD.Sup dazu	PROADV.Dem beigetragen	VPP.Full.Psp haben	VFIN.Haben.3.Pl.Pres.Ind ;	SYM.Pun.Sent weltweit	ADJD.Pos ,	SYM.Pun.Comma aber	CONJ.Coord.Aber auch	ADV in	APPR.In Österreich	N.Name.Dat.Sg.Neut .	SYM.Pun.Sent  ",False,True,True,True,True,True,True,True,False,True,True,False,False,False,False,False,False,False,False,True,False,True,Opinionated,
