id,text,,speaker,file,tagged,ADJA.Comp_ADJD.Comp_or,ADJA.Sup_ADJD.Sup_or,ADJA_ADJD_or,adja_to_ignore,adjd_to_ignore,adja_comp_to_ignore,adjd_comp_to_ignore,adja_sup_to_ignore,adjd_sup_to_ignore,contains_positive_with_set,contains_positive_with_deklination_set,contains_comparative,contains_comparative_with_set,contains_comparative_with_deklination_set,contains_comparative_new_no_set,contains_comparative_new_with_set,contains_comparative_new_with_declension_set,contains_comparative_new_with_declension_set_and_approach,comparative_set_only,contains_superlative,has_no_real_superlative,has_superlative_word,label,Comments
10108,"Die Coronakrise sowie die aktuellen Teuerungsraten erfordern rasches Handeln. Daher wollen wir als Bundesregierung Menschen unterstützen, die sich die höheren Rechnungen gerade in der aktuellen Krisensituation am wenigsten leisten können. Es wird daher ein umfassendes Paket geben, das die Teuerung für mehrere Personengruppen mit",23787,"Bundesminister für Soziales, Gesundheit, Pflege und Konsumentenschutz Dr. Wolfgang Mückstein",NRSITZ_00135_PARSED,"Die	ART.Def.Nom.Sg.Fem Coronakrise	N.Reg.Nom.Sg.Fem sowie	CONJ.Coord.- die	ART.Def.Nom.Pl.Fem aktuellen	ADJA.Pos.Nom.Pl.Fem Teuerungsraten	N.Reg.Nom.Pl.Fem erfordern	VFIN.Full.3.Pl.Pres.Ind rasches	ADJA.Pos.Acc.Sg.Neut Handeln	N.Reg.Acc.Sg.Neut .	SYM.Pun.Sent  Daher	PROADV.Dem wollen	VFIN.Mod.1.Pl.Pres.Ind wir	PRO.Pers.Subst.1.Nom.Pl.* als	APPR.Als Bundesregierung	N.Reg.Nom.Sg.Fem Menschen	N.Reg.Acc.Pl.Masc unterstützen	VINF.Full.- ,	SYM.Pun.Comma die	PRO.Rel.Subst.-.Acc.Pl.Masc sich	PRO.Refl.Subst.3.Dat.Pl.* die	ART.Def.Nom.Pl.Fem höheren	ADJA.Comp.Nom.Pl.Fem Rechnungen	N.Reg.Nom.Pl.Fem gerade	ADV in	APPR.In der	ART.Def.Dat.Sg.Fem aktuellen	ADJA.Pos.Dat.Sg.Fem Krisensituation	N.Reg.Dat.Sg.Fem am	PART.Deg wenigsten	ADJD.Sup leisten	VINF.Full.- können	VINF.Mod.- .	SYM.Pun.Sent  Es	PRO.Pers.Subst.3.Nom.Sg.Neut wird	VFIN.Aux.3.Sg.Pres.Ind daher	PROADV.Dem ein	ART.Indef.Acc.Sg.Neut umfassendes	ADJA.Pos.Acc.Sg.Neut Paket	N.Reg.Acc.Sg.Neut geben	VINF.Full.- ,	SYM.Pun.Comma das	PRO.Rel.Subst.-.Nom.Sg.Neut die	ART.Def.Acc.Sg.Fem Teuerung	N.Reg.Acc.Sg.Fem für	APPR.Acc mehrere	PRO.Indef.Attr.-.Acc.Pl.Fem Personengruppen	N.Reg.Acc.Pl.Fem mit	PART.Verb  ",True,True,True,True,True,False,True,True,False,True,True,False,False,False,False,False,False,True,False,True,False,True,Non Opinionated,
10109,"Erstens geht es also um Unterstützung der sozial schwächsten Haushalte, die trifft es nämlich am meisten: Die zahlen Miete, die zahlen Strom, die zahlen Gas und die gehen einkaufen, und dann bleibt vom Einkommen auch gar nicht mehr viel übrig. Das heißt, überall dort, wo jetzt diese Preisexplosionen stattfinden, fährt das bei diesen Menschen voll hinein.",60285,"Abgeordnete Mag. Beate Meinl-Reisinger, MES (NEOS)",NRSITZ_00153_PARSED,"Erstens	ADV geht	VFIN.Full.3.Sg.Pres.Ind es	PRO.Pers.Subst.3.Nom.Sg.Neut also	ADV um	APPR.Acc Unterstützung	N.Reg.Acc.Sg.Fem der	ART.Def.Gen.Pl.Masc sozial	ADJD.Pos schwächsten	ADJA.Sup.Gen.Pl.Masc Haushalte	N.Reg.Gen.Pl.Masc ,	SYM.Pun.Comma die	PRO.Dem.Subst.-.Acc.Pl.* trifft	VFIN.Full.3.Sg.Pres.Ind es	PRO.Pers.Subst.3.Nom.Sg.Neut nämlich	ADV am	PART.Deg meisten	PRO.Indef.Subst.-.*.*.* :	SYM.Pun.Colon Die	PRO.Dem.Subst.-.Nom.Pl.* zahlen	VFIN.Full.3.Pl.Pres.Ind Miete	N.Reg.Acc.Sg.Fem ,	SYM.Pun.Comma die	PRO.Dem.Subst.-.Nom.Pl.* zahlen	VFIN.Full.3.Pl.Pres.Ind Strom	N.Reg.Acc.Sg.Masc ,	SYM.Pun.Comma die	PRO.Rel.Subst.-.Nom.Pl.Masc zahlen	VFIN.Full.3.Pl.Pres.Ind Gas	N.Reg.Acc.Sg.Neut und	CONJ.Coord.- die	ART.Def.Acc.Sg.Fem gehen	VINF.Full.- einkaufen	VINF.Full.- ,	SYM.Pun.Comma und	CONJ.Coord.- dann	ADV bleibt	VFIN.Full.3.Sg.Pres.Ind vom	APPRART.Dat.Sg.Neut Einkommen	N.Reg.Dat.Sg.Neut auch	ADV gar	ADV nicht	PART.Neg mehr	ADV viel	ADV übrig	PART.Verb .	SYM.Pun.Sent  Das	PRO.Dem.Subst.-.Nom.Sg.Neut heißt	VFIN.Full.3.Sg.Pres.Ind ,	SYM.Pun.Comma überall	ADV dort	ADV ,	SYM.Pun.Comma wo	PROADV.Inter jetzt	ADV diese	PRO.Dem.Attr.-.Nom.Pl.Fem Preisexplosionen	N.Reg.Nom.Pl.Fem stattfinden	VFIN.Full.3.Pl.Pres.Ind ,	SYM.Pun.Comma fährt	VFIN.Full.3.Sg.Pres.Ind das	PRO.Dem.Subst.-.Acc.Sg.Neut bei	APPR.Dat diesen	PRO.Dem.Attr.-.Dat.Pl.Masc Menschen	N.Reg.Dat.Pl.Masc voll	ADJD.Pos hinein	PART.Verb .	SYM.Pun.Sent  ",False,True,True,True,True,True,True,False,True,True,True,False,False,False,False,False,False,True,True,True,False,True,Non Opinionated,
10110,"Der Wirtschaftsbund ist die stärkste, die am breitesten aufgestellte Wirtschaftsvertretungsorganisation für Groß und Klein in Österreich. Julius Raab hat nach dem Krieg das Land aus Schutt und Asche wieder aufgebaut, er hat damals den Wirtschaftsbund aufgebaut, damals auch, im Geiste dieser Zuversicht, unser Land wieder mitaufgebaut die Wirtschaftskammer gegründet, und ich glaube, dass wir uns genau in diesem Geiste von Julius Raab und im Namen dieser Zuversicht weiterbewegen sollten.",7734,"Abgeordnete Mag. Carmen Jeitler-Cincelli, BA",NRSITZ_00064_PARSED,"Der	ART.Def.Nom.Sg.Masc Wirtschaftsbund	N.Reg.Nom.Sg.Masc ist	VFIN.Sein.3.Sg.Pres.Ind die	ART.Def.Nom.Sg.Fem stärkste	ADJA.Sup.Nom.Sg.Fem ,	SYM.Pun.Comma die	PRO.Rel.Subst.-.Nom.Sg.Fem am	APPRART.Dat.Sg.Masc breitesten	ADJA.Sup.Dat.Sg.Masc aufgestellte	ADJA.Pos.Acc.Sg.Fem Wirtschaftsvertretungsorganisation	N.Reg.Acc.Sg.Fem für	APPR.Acc Groß	N.Name.*.*.* und	CONJ.Coord.- Klein	N.Name.Dat.Sg.* in	APPR.In Österreich	N.Name.Dat.Sg.Neut .	SYM.Pun.Sent  Julius	N.Name.Nom.Sg.Masc Raab	N.Name.Nom.Sg.* hat	VFIN.Haben.3.Sg.Pres.Ind nach	APPR.Dat dem	ART.Def.Dat.Sg.Masc Krieg	N.Reg.Dat.Sg.Masc das	ART.Def.Acc.Sg.Neut Land	N.Reg.Acc.Sg.Neut aus	APPR.Dat Schutt	N.Reg.Dat.Sg.Masc und	CONJ.Coord.- Asche	N.Reg.Dat.Sg.Fem wieder	ADV aufgebaut	VPP.Full.Psp ,	SYM.Pun.Comma er	PRO.Pers.Subst.3.Nom.Sg.Masc hat	VFIN.Haben.3.Sg.Pres.Ind damals	ADV den	ART.Def.Acc.Sg.Masc Wirtschaftsbund	N.Reg.Acc.Sg.Masc aufgebaut	VPP.Full.Psp ,	SYM.Pun.Comma damals	ADV auch	ADV ,	SYM.Pun.Comma im	APPRART.Dat.Sg.Masc Geiste	N.Reg.Dat.Sg.Masc dieser	PRO.Dem.Attr.-.Gen.Sg.Fem Zuversicht	N.Reg.Gen.Sg.Fem ,	SYM.Pun.Comma unser	PRO.Poss.Attr.-.Nom.Sg.Neut Land	N.Reg.Nom.Sg.Neut wieder	ADV mitaufgebaut	ADJD.Pos die	ART.Def.Acc.Sg.Fem Wirtschaftskammer	N.Reg.Acc.Sg.Fem gegründet	VPP.Full.Psp ,	SYM.Pun.Comma und	CONJ.Coord.- ich	PRO.Pers.Subst.1.Nom.Sg.* glaube	VFIN.Full.1.Sg.Pres.Ind ,	SYM.Pun.Comma dass	CONJ.SubFin.- wir	PRO.Pers.Subst.1.Nom.Pl.* uns	PRO.Pers.Subst.1.Dat.Pl.* genau	ADJD.Pos in	APPR.In diesem	PRO.Dem.Attr.-.Dat.Sg.Masc Geiste	N.Reg.Dat.Sg.Masc von	APPR.Dat Julius	N.Name.Nom.Sg.Masc Raab	N.Name.Dat.Sg.* und	CONJ.Coord.- im	APPRART.Dat.Sg.Masc Namen	N.Reg.Dat.Sg.Masc dieser	PRO.Dem.Attr.-.Gen.Sg.Fem Zuversicht	N.Reg.Gen.Sg.Fem weiterbewegen	VINF.Full.- sollten	VFIN.Mod.3.Pl.Past.Ind .	SYM.Pun.Sent  ",False,True,True,True,True,True,True,False,True,True,True,False,False,False,False,False,False,False,False,True,False,True,Opinionated,
10111,"Ich darf Ihnen dazu auch eine aktuelle Grafik von Europa zeigen. Diese zeigt ganz genau, wie stark in Hunderttausenden-Bereichen die Auswirkungen dieser Krise schon sind und wo Österreich steht. Österreich steht hier ganz unten. Wir sind eines der Länder mit den wenigsten Fällen von Infizierten und im Moment hat Österreich von ganz Europa die wenigsten Infizierten überhaupt. Dass das so positiv ist, hat uns auch ermöglicht, dass wir in eine andere Richtung gehen können, nämlich dass wir zu den Ländern in Europa gehören die die Ausgangsbeschränkungen weitestgehend aufheben konnten, und wir daher zu diesem Teil von Staaten gehören wo sich die Menschen am freiesten bewegen können.",52561,Abgeordneter Mag. Wolfgang Gerstl (ÖVP),NRSITZ_00030_PARSED,"Ich	PRO.Pers.Subst.1.Nom.Sg.* darf	VFIN.Mod.1.Sg.Pres.Ind Ihnen	PRO.Pers.Subst.3.Dat.Pl.* dazu	PROADV.Dem auch	ADV eine	ART.Indef.Acc.Sg.Fem aktuelle	ADJA.Pos.Acc.Sg.Fem Grafik	N.Reg.Acc.Sg.Fem von	APPR.Dat Europa	N.Name.Dat.Sg.Neut zeigen	VINF.Full.- .	SYM.Pun.Sent  Diese	PRO.Dem.Subst.-.Nom.Sg.Fem zeigt	VFIN.Full.3.Sg.Pres.Ind ganz	ADV genau	ADJD.Pos ,	SYM.Pun.Comma wie	PROADV.Inter stark	ADJD.Pos in	APPR.In Hunderttausenden-Bereichen	N.Reg.Dat.Pl.Masc die	ART.Def.Acc.Pl.Fem Auswirkungen	N.Reg.Acc.Pl.Fem dieser	PRO.Dem.Attr.-.Gen.Sg.Fem Krise	N.Reg.Gen.Sg.Fem schon	ADV sind	VFIN.Sein.3.Pl.Pres.Ind und	CONJ.Coord.- wo	PROADV.Inter Österreich	N.Name.Nom.Sg.Neut steht	VFIN.Full.3.Sg.Pres.Ind .	SYM.Pun.Sent  Österreich	N.Name.Nom.Sg.Neut steht	VFIN.Full.3.Sg.Pres.Ind hier	ADV ganz	ADV unten	ADV .	SYM.Pun.Sent  Wir	PRO.Pers.Subst.1.Nom.Pl.* sind	VFIN.Sein.1.Pl.Pres.Ind eines	PRO.Indef.Subst.-.Acc.Sg.Neut der	ART.Def.Gen.Pl.Neut Länder	N.Reg.Gen.Pl.Neut mit	APPR.Dat den	ART.Def.Dat.Pl.Masc wenigsten	PRO.Indef.Attr.-.Dat.Pl.Masc Fällen	N.Reg.Dat.Pl.Masc von	APPR.Dat Infizierten	N.Reg.Dat.Pl.* und	CONJ.Coord.- im	APPRART.Dat.Sg.Neut Moment	N.Reg.Dat.Sg.Neut hat	VFIN.Haben.3.Sg.Pres.Ind Österreich	N.Name.Nom.Sg.Neut von	APPR.Dat ganz	ADV Europa	N.Name.Dat.Sg.Neut die	ART.Def.Nom.Pl.Fem wenigsten	PRO.Indef.Subst.-.Nom.Pl.Fem Infizierten	VFIN.Full.3.Pl.Past.Ind überhaupt	ADV .	SYM.Pun.Sent  Dass	CONJ.SubFin.- das	PRO.Dem.Subst.-.Nom.Sg.Neut so	ADV positiv	ADJD.Pos ist	VFIN.Sein.3.Sg.Pres.Ind ,	SYM.Pun.Comma hat	VFIN.Haben.3.Sg.Pres.Ind uns	PRO.Pers.Subst.1.Dat.Pl.* auch	ADV ermöglicht	VPP.Full.Psp ,	SYM.Pun.Comma dass	CONJ.SubFin.- wir	PRO.Pers.Subst.1.Nom.Pl.* in	APPR.In eine	ART.Indef.Acc.Sg.Fem andere	ADJA.Pos.Acc.Sg.Fem Richtung	N.Reg.Acc.Sg.Fem gehen	VINF.Full.- können	VINF.Mod.- ,	SYM.Pun.Comma nämlich	ADV dass	CONJ.SubFin.- wir	PRO.Pers.Subst.1.Nom.Pl.* zu	APPR.Dat den	ART.Def.Dat.Pl.Neut Ländern	N.Reg.Dat.Pl.Neut in	APPR.In Europa	N.Name.Dat.Sg.Neut gehören	VFIN.Full.3.Pl.Pres.Ind die	ART.Def.Nom.Pl.Masc die	ART.Def.Nom.Pl.Fem Ausgangsbeschränkungen	N.Reg.Nom.Pl.Fem weitestgehend	ADJD.Pos aufheben	VINF.Full.- konnten	VFIN.Mod.3.Pl.Past.Ind ,	SYM.Pun.Comma und	CONJ.Coord.- wir	PRO.Pers.Subst.1.Nom.Pl.* daher	PROADV.Dem zu	APPR.Dat diesem	PRO.Dem.Attr.-.Dat.Sg.Masc Teil	N.Reg.Dat.Sg.Masc von	APPR.Dat Staaten	N.Reg.Dat.Pl.Masc gehören	VFIN.Full.3.Pl.Pres.Ind wo	PROADV.Inter sich	PRO.Refl.Subst.3.Acc.Pl.* die	ART.Def.Nom.Pl.Masc Menschen	N.Reg.Nom.Pl.Masc am	APPRART.Dat.Sg.Masc freiesten	ADJA.Sup.Dat.Sg.Masc bewegen	VINF.Full.- können	VFIN.Mod.3.Pl.Pres.Ind .	SYM.Pun.Sent  ",False,True,True,True,True,True,True,False,True,True,True,False,False,False,False,False,False,False,False,True,False,True,Opinionated,
10112,"Sich angesichts dieser Zahlen hierherzustellen und zu sagen, die Maßnahmen, die wir setzen, sind nicht zielführend und sind ein Anschlag, eine Bombe und ich weiß nicht was alles ist absolut ignorant gegenüber jener Bevölkerung, die Sie ständig behaupten, am besten vertreten zu wollen.",13783,"Abgeordnete Sigrid Maurer, BA",NRSITZ_00075_PARSED,"Sich	PRO.Refl.Subst.3.Acc.Sg.* angesichts	APPR.Gen dieser	PRO.Dem.Attr.-.Gen.Pl.Fem Zahlen	N.Reg.Gen.Pl.Fem hierherzustellen	VINF.Full.- und	CONJ.Coord.- zu	PART.Zu sagen	VINF.Full.- ,	SYM.Pun.Comma die	ART.Def.Nom.Pl.Fem Maßnahmen	N.Reg.Nom.Pl.Fem ,	SYM.Pun.Comma die	PRO.Rel.Subst.-.Acc.Pl.Fem wir	PRO.Pers.Subst.1.Nom.Pl.* setzen	VFIN.Full.1.Pl.Pres.Ind ,	SYM.Pun.Comma sind	VFIN.Sein.3.Pl.Pres.Ind nicht	PART.Neg zielführend	ADJD.Pos und	CONJ.Coord.- sind	VFIN.Sein.3.Pl.Pres.Ind ein	ART.Indef.Nom.Sg.Masc Anschlag	N.Reg.Nom.Sg.Masc ,	SYM.Pun.Comma eine	ART.Indef.Nom.Sg.Fem Bombe	N.Reg.Nom.Sg.Fem und	CONJ.Coord.- ich	PRO.Pers.Subst.1.Nom.Sg.* weiß	VFIN.Full.1.Sg.Pres.Ind nicht	PART.Neg was	PRO.Indef.Subst.-.Nom.Sg.Neut alles	PRO.Indef.Subst.-.Nom.Sg.Neut ist	VFIN.Sein.3.Sg.Pres.Ind absolut	ADJD.Pos ignorant	ADJD.Pos gegenüber	APPR.Dat jener	PRO.Dem.Attr.-.Dat.Sg.Fem Bevölkerung	N.Reg.Dat.Sg.Fem ,	SYM.Pun.Comma die	PRO.Rel.Subst.-.Acc.Sg.Fem Sie	PRO.Pers.Subst.3.Nom.Pl.* ständig	ADJD.Pos behaupten	VFIN.Full.3.Pl.Pres.Ind ,	SYM.Pun.Comma am	PART.Deg besten	ADJD.Sup vertreten	VINF.Full.- zu	PART.Zu wollen	VINF.Mod.- .	SYM.Pun.Sent  ",False,True,True,True,True,True,True,True,False,True,True,False,False,False,False,False,False,False,False,True,False,True,Opinionated,
10113,"Dass es noch viel Überzeugungskraft, Einbindung, Abklärungen braucht, um auch die anderen Bundesländer zu überzeugen, wo die Tickets wahrscheinlich am stärksten wirken werden, was die PendlerInnen, die NutzerInnen betrifft, ist uns, glaube ich, allen klar.",39388,"Abgeordneter Hermann Weratschnig, MBA MSc",NRSITZ_00091_PARSED,"Dass	CONJ.SubFin.- es	PRO.Pers.Subst.3.Nom.Sg.Neut noch	ADV viel	PRO.Indef.Attr.-.*.*.* Überzeugungskraft	N.Reg.Acc.Sg.Fem ,	SYM.Pun.Comma Einbindung	N.Reg.Acc.Sg.Fem ,	SYM.Pun.Comma Abklärungen	N.Reg.Acc.Pl.Fem braucht	VFIN.Full.3.Sg.Pres.Ind ,	SYM.Pun.Comma um	CONJ.SubInf.- auch	ADV die	ART.Def.Acc.Pl.Neut anderen	ADJA.Pos.Acc.Pl.Neut Bundesländer	N.Reg.Acc.Pl.Neut zu	PART.Zu überzeugen	VINF.Full.- ,	SYM.Pun.Comma wo	PROADV.Inter die	ART.Def.Nom.Pl.Neut Tickets	N.Reg.Nom.Pl.Neut wahrscheinlich	ADJD.Pos am	PART.Deg stärksten	ADJD.Sup wirken	VINF.Full.- werden	VFIN.Aux.3.Pl.Pres.Ind ,	SYM.Pun.Comma was	PRO.Inter.Subst.-.Nom.Sg.Neut die	ART.Def.Acc.Pl.Fem PendlerInnen	N.Reg.Acc.Pl.Fem ,	SYM.Pun.Comma die	PRO.Rel.Subst.-.Nom.Pl.* NutzerInnen	N.Reg.Dat.Pl.* betrifft	VFIN.Full.3.Sg.Pres.Ind ,	SYM.Pun.Comma ist	VFIN.Sein.3.Sg.Pres.Ind uns	PRO.Pers.Subst.1.Dat.Pl.* ,	SYM.Pun.Comma glaube	VFIN.Full.1.Sg.Pres.Ind ich	PRO.Pers.Subst.1.Nom.Sg.* ,	SYM.Pun.Comma allen	PRO.Indef.Subst.-.Dat.Pl.* klar	ADJD.Pos .	SYM.Pun.Sent  ",False,True,True,True,True,True,True,True,False,True,True,False,False,False,False,False,False,False,False,True,False,True,Opinionated,
10114,"Wir haben es bei der Testplattform gesehen. Diese wurde vom Bundeskanzler in einer Pressekonferenz großartig angekündigt, und was war dann? Chaos im Ministerium, weil es schnell hat gehen müssen der Bundeskanzler wollte ja mit seiner Ankündigung schnell wieder vorne mit dabei sein , und dann wurden noch dazu die Daten gehackt. Gleich am ersten Tag gab es ein Datenleck, woraufhin da auch wieder einige Daten, nämlich Gesundheitsdaten, die besonders wertvoll sind, rausgespielt wurden.",9556,Abgeordneter Douglas Hoyos-Trauttmansdorff (NEOS),NRSITZ_00101_PARSED,"Wir	PRO.Pers.Subst.1.Nom.Pl.* haben	VFIN.Haben.1.Pl.Pres.Ind es	PRO.Pers.Subst.3.Acc.Sg.Neut bei	APPR.Dat der	ART.Def.Dat.Sg.Fem Testplattform	N.Reg.Dat.Sg.Fem gesehen	VPP.Full.Psp .	SYM.Pun.Sent  Diese	PRO.Dem.Subst.-.Nom.Sg.Fem wurde	VFIN.Aux.3.Sg.Past.Ind vom	APPRART.Dat.Sg.Masc Bundeskanzler	N.Reg.Dat.Sg.Masc in	APPR.In einer	ART.Indef.Dat.Sg.Fem Pressekonferenz	N.Reg.Dat.Sg.Fem großartig	ADJD.Pos angekündigt	VPP.Full.Psp ,	SYM.Pun.Comma und	CONJ.Coord.- was	PRO.Inter.Subst.-.Nom.Sg.Neut war	VFIN.Sein.3.Sg.Past.Ind dann	ADV ?	SYM.Pun.Sent  Chaos	N.Reg.Nom.Sg.Neut im	APPRART.Dat.Sg.Neut Ministerium	N.Reg.Dat.Sg.Neut ,	SYM.Pun.Comma weil	CONJ.SubFin.- es	PRO.Pers.Subst.3.Nom.Sg.Neut schnell	ADJD.Pos hat	VFIN.Haben.3.Sg.Pres.Ind gehen	VINF.Full.- müssen	VINF.Mod.- der	ART.Def.Nom.Sg.Masc Bundeskanzler	N.Reg.Nom.Sg.Masc wollte	VFIN.Mod.3.Sg.Past.Ind ja	ADV mit	APPR.Dat seiner	PRO.Poss.Attr.-.Dat.Sg.Fem Ankündigung	N.Reg.Dat.Sg.Fem schnell	ADJD.Pos wieder	ADV vorne	ADV mit	APPR.Dat dabei	PROADV.Dem sein	VINF.Sein.- ,	SYM.Pun.Comma und	CONJ.Coord.- dann	ADV wurden	VFIN.Aux.3.Pl.Past.Ind noch	CONJ.Coord.Noch dazu	PROADV.Dem die	ART.Def.Acc.Pl.Neut Daten	N.Reg.Acc.Pl.Neut gehackt	VPP.Full.Psp .	SYM.Pun.Sent  Gleich	ADV am	APPRART.Dat.Sg.Masc ersten	ADJA.Pos.Dat.Sg.Masc Tag	N.Reg.Dat.Sg.Masc gab	VFIN.Full.3.Sg.Past.Ind es	PRO.Pers.Subst.3.Nom.Sg.Neut ein	ART.Indef.Acc.Sg.Neut Datenleck	N.Reg.Acc.Sg.Neut ,	SYM.Pun.Comma woraufhin	PROADV.Inter da	ADV auch	ADV wieder	ADV einige	PRO.Indef.Attr.-.Acc.Pl.Neut Daten	N.Reg.Acc.Pl.Neut ,	SYM.Pun.Comma nämlich	ADV Gesundheitsdaten	N.Reg.Nom.Pl.Neut ,	SYM.Pun.Comma die	PRO.Rel.Subst.-.Nom.Pl.Neut besonders	ADV wertvoll	ADJD.Pos sind	VFIN.Sein.3.Pl.Pres.Ind ,	SYM.Pun.Comma rausgespielt	VPP.Full.Psp wurden	VFIN.Aux.3.Pl.Past.Ind .	SYM.Pun.Sent  ",False,False,True,False,False,True,True,True,True,True,True,False,False,False,False,False,False,False,False,True,True,False,Non Opinionated,
10115,"Wir fordern den vollen Entschädigungsanspruch nach dem Epidemiegesetz das Epidemiegesetz außer Kraft zu setzen, war ein schwerer Fehler , die Abwicklung sämtlicher Maßnahmen über das Finanzamt und nicht über die Wirtschaftskammer, Stundungen von Energiekosten und Versicherungsprämien, Preisgarantien für Güter des täglichen Bedarfs. Wir fordern weiters ein Kommunalinvestitions- und Regionalwirtschaftspaket, ähnlich wie es die Sozialdemokraten gefordert haben. Die Gemeinden sind diejenigen, die am schnellsten Aufträge in die regionale Wirtschaft hinausbringen, die die regionale Wirtschaft stützen können, und das wird es unbedingt brauchen, wenn wir die Wirtschaft wieder hochfahren möchten. Ein wesentlicher volkswirtschaftlicher Beitrag ist natürlich auch die Bildung, und deshalb müssen wir heute dafür sorgen, dass unsere Kinder entsprechende Geräte haben, sie in Form von Leihgeräten zur Verfügung stellen, ebenso dafür, dass man Blockunterricht in den Schulen zulässt, Herr Minister, dass man Schüler unter 14 Jahren in Kleingruppen in die Schule lässt, sodass sie der Lehrer unterrichten kann. Wir brauchen die Durchführung der Matura in der alten Form vor der Zentralmatura und die Vermittlung von Lehramtsstudenten durch Bildungsdirektionen an Familien zur Unterstützung und Bewältigung der Krise.",9299,Abgeordneter Erwin Angerer,NRSITZ_00022_PARSED,"Wir	PRO.Pers.Subst.1.Nom.Pl.* fordern	VFIN.Full.1.Pl.Pres.Ind den	ART.Def.Acc.Sg.Masc vollen	ADJA.Pos.Acc.Sg.Masc Entschädigungsanspruch	N.Reg.Acc.Sg.Masc nach	APPR.Dat dem	ART.Def.Dat.Sg.Neut Epidemiegesetz	N.Reg.Dat.Sg.Neut das	ART.Def.Acc.Sg.Neut Epidemiegesetz	N.Reg.Acc.Sg.Neut außer	APPR.Außer Kraft	N.Reg.Acc.Sg.Fem zu	PART.Zu setzen	VINF.Full.- ,	SYM.Pun.Comma war	VFIN.Sein.3.Sg.Past.Ind ein	ART.Indef.Nom.Sg.Masc schwerer	ADJA.Pos.Nom.Sg.Masc Fehler	N.Reg.Nom.Sg.Masc ,	SYM.Pun.Comma die	ART.Def.Acc.Sg.Fem Abwicklung	N.Reg.Acc.Sg.Fem sämtlicher	ADJA.Pos.Gen.Pl.Fem Maßnahmen	N.Reg.Gen.Pl.Fem über	APPR.Über das	ART.Def.Acc.Sg.Neut Finanzamt	N.Reg.Acc.Sg.Neut und	CONJ.Coord.- nicht	PART.Neg über	APPR.Über die	ART.Def.Acc.Sg.Fem Wirtschaftskammer	N.Reg.Acc.Sg.Fem ,	SYM.Pun.Comma Stundungen	N.Reg.Acc.Pl.Fem von	APPR.Dat Energiekosten	N.Reg.Dat.Pl.* und	CONJ.Coord.- Versicherungsprämien	N.Reg.Dat.Pl.Fem ,	SYM.Pun.Comma Preisgarantien	N.Reg.Dat.Pl.Fem für	APPR.Acc Güter	N.Reg.Acc.Pl.Neut des	ART.Def.Gen.Sg.Masc täglichen	ADJA.Pos.Gen.Sg.Masc Bedarfs	N.Reg.Gen.Sg.Masc .	SYM.Pun.Sent  Wir	PRO.Pers.Subst.1.Nom.Pl.* fordern	VFIN.Full.1.Pl.Pres.Ind weiters	ADJD.Pos ein	ART.Indef.Acc.Sg.Neut Kommunalinvestitions-	TRUNC.Noun und	CONJ.Coord.- Regionalwirtschaftspaket	N.Reg.Acc.Sg.Neut ,	SYM.Pun.Comma ähnlich	ADJD.Pos wie	CONJ.Comp.- es	PRO.Pers.Subst.3.Acc.Sg.Neut die	ART.Def.Nom.Pl.Masc Sozialdemokraten	N.Reg.Nom.Pl.Masc gefordert	VPP.Full.Psp haben	VFIN.Haben.3.Pl.Pres.Ind .	SYM.Pun.Sent  Die	ART.Def.Nom.Pl.Fem Gemeinden	N.Reg.Nom.Pl.Fem sind	VFIN.Sein.3.Pl.Pres.Ind diejenigen	PRO.Dem.Subst.-.Nom.Pl.* ,	SYM.Pun.Comma die	PRO.Rel.Subst.-.Nom.Pl.Fem am	PART.Deg schnellsten	ADJD.Sup Aufträge	N.Reg.Acc.Pl.Masc in	APPR.In die	ART.Def.Acc.Sg.Fem regionale	ADJA.Pos.Acc.Sg.Fem Wirtschaft	N.Reg.Acc.Sg.Fem hinausbringen	VINF.Full.- ,	SYM.Pun.Comma die	PRO.Rel.Subst.-.Nom.Sg.Fem die	ART.Def.Acc.Sg.Fem regionale	ADJA.Pos.Acc.Sg.Fem Wirtschaft	N.Reg.Acc.Sg.Fem stützen	VINF.Full.- können	VINF.Mod.- ,	SYM.Pun.Comma und	CONJ.Coord.- das	PRO.Dem.Subst.-.Nom.Sg.Neut wird	VFIN.Aux.3.Sg.Pres.Ind es	PRO.Pers.Subst.3.Acc.Sg.Neut unbedingt	ADV brauchen	VINF.Full.- ,	SYM.Pun.Comma wenn	CONJ.SubFin.- wir	PRO.Pers.Subst.1.Nom.Pl.* die	ART.Def.Acc.Sg.Fem Wirtschaft	N.Reg.Acc.Sg.Fem wieder	ADV hochfahren	VINF.Full.- möchten	VFIN.Mod.1.Pl.Past.Subj .	SYM.Pun.Sent  Ein	ART.Indef.Nom.Sg.Masc wesentlicher	ADJA.Pos.Nom.Sg.Masc volkswirtschaftlicher	ADJA.Pos.Nom.Sg.Masc Beitrag	N.Reg.Nom.Sg.Masc ist	VFIN.Sein.3.Sg.Pres.Ind natürlich	ADV auch	ADV die	ART.Def.Nom.Sg.Fem Bildung	N.Reg.Nom.Sg.Fem ,	SYM.Pun.Comma und	CONJ.Coord.- deshalb	PROADV.Dem müssen	VFIN.Mod.1.Pl.Pres.Ind wir	PRO.Pers.Subst.1.Nom.Pl.* heute	ADV dafür	PROADV.Dem sorgen	VINF.Full.- ,	SYM.Pun.Comma dass	CONJ.SubFin.- unsere	PRO.Poss.Attr.-.Nom.Pl.Neut Kinder	N.Reg.Nom.Pl.Neut entsprechende	ADJA.Pos.Acc.Pl.Neut Geräte	N.Reg.Acc.Pl.Neut haben	VFIN.Haben.3.Pl.Pres.Ind ,	SYM.Pun.Comma sie	PRO.Pers.Subst.3.Acc.Pl.* in	APPR.In Form	N.Reg.Dat.Sg.Fem von	APPR.Dat Leihgeräten	N.Reg.Dat.Pl.Fem zur	APPRART.Dat.Sg.Fem Verfügung	N.Reg.Dat.Sg.Fem stellen	VINF.Full.- ,	SYM.Pun.Comma ebenso	ADV dafür	PROADV.Dem ,	SYM.Pun.Comma dass	CONJ.SubFin.- man	PRO.Indef.Subst.-.Nom.Sg.* Blockunterricht	N.Reg.Acc.Sg.Masc in	APPR.In den	ART.Def.Dat.Pl.Fem Schulen	N.Reg.Dat.Pl.Fem zulässt	VFIN.Full.3.Sg.Pres.Ind ,	SYM.Pun.Comma Herr	N.Reg.Nom.Sg.Masc Minister	N.Reg.Nom.Sg.Masc ,	SYM.Pun.Comma dass	CONJ.SubFin.- man	PRO.Indef.Subst.-.Nom.Sg.* Schüler	N.Reg.Acc.Pl.Masc unter	APPR.Unter 14	CARD Jahren	N.Reg.Dat.Pl.Neut in	APPR.In Kleingruppen	N.Reg.Dat.Pl.Fem in	APPR.In die	ART.Def.Acc.Sg.Fem Schule	N.Reg.Acc.Sg.Fem lässt	VFIN.Full.3.Sg.Pres.Ind ,	SYM.Pun.Comma sodass	CONJ.SubFin.- sie	PRO.Pers.Subst.3.Acc.Pl.* der	ART.Def.Nom.Sg.Masc Lehrer	N.Reg.Nom.Sg.Masc unterrichten	VINF.Full.- kann	VFIN.Mod.3.Sg.Pres.Ind .	SYM.Pun.Sent  Wir	PRO.Pers.Subst.1.Nom.Pl.* brauchen	VFIN.Full.1.Pl.Pres.Ind die	ART.Def.Acc.Sg.Fem Durchführung	N.Reg.Acc.Sg.Fem der	ART.Def.Gen.Sg.Fem Matura	N.Reg.Gen.Sg.Fem in	APPR.In der	ART.Def.Dat.Sg.Fem alten	ADJA.Pos.Dat.Sg.Fem Form	N.Reg.Dat.Sg.Fem vor	APPR.Vor der	ART.Def.Dat.Sg.Fem Zentralmatura	N.Name.Dat.Sg.Fem und	CONJ.Coord.- die	ART.Def.Acc.Sg.Fem Vermittlung	N.Reg.Acc.Sg.Fem von	APPR.Dat Lehramtsstudenten	N.Reg.Dat.Pl.Masc durch	APPR.Acc Bildungsdirektionen	N.Reg.Acc.Pl.Fem an	APPR.An Familien	N.Reg.Dat.Pl.Fem zur	APPRART.Dat.Sg.Fem Unterstützung	N.Reg.Dat.Sg.Fem und	CONJ.Coord.- Bewältigung	N.Reg.Dat.Sg.Fem der	ART.Def.Gen.Sg.Fem Krise	N.Reg.Gen.Sg.Fem .	SYM.Pun.Sent  ",False,True,True,True,True,True,True,True,False,True,True,False,False,False,False,False,False,True,True,True,False,True,Opinionated,
10116,"Aber zurück zur Geschichte: Ich denke, unter diesem Bild müssen wir eine Steuerreform beurteilen. Wem bringt sie am meisten? Wem bringt dieses Volumen etwas? Denen, die eh schon schwer über die Runden kommen, oder jenen, die jetzt schon zu viel haben? An meinem Ton werden Sie es vielleicht erkennen: Es ist leider schon wieder Zweiteres passiert.",27527,Abgeordnete Julia Elisabeth Herr,NRSITZ_00139_PARSED,"Aber	CONJ.Coord.Aber zurück	ADV zur	APPRART.Dat.Sg.Fem Geschichte	N.Reg.Dat.Sg.Fem :	SYM.Pun.Colon Ich	PRO.Pers.Subst.1.Nom.Sg.* denke	VFIN.Full.1.Sg.Pres.Ind ,	SYM.Pun.Comma unter	APPR.Unter diesem	PRO.Dem.Attr.-.Dat.Sg.Neut Bild	N.Reg.Dat.Sg.Neut müssen	VFIN.Mod.1.Pl.Pres.Ind wir	PRO.Pers.Subst.1.Nom.Pl.* eine	ART.Indef.Acc.Sg.Fem Steuerreform	N.Reg.Acc.Sg.Fem beurteilen	VINF.Full.- .	SYM.Pun.Sent  Wem	PRO.Inter.Subst.-.Dat.Sg.* bringt	VFIN.Full.3.Sg.Pres.Ind sie	PRO.Pers.Subst.3.Nom.Sg.Fem am	PART.Deg meisten	ADJD.Pos ?	SYM.Pun.Sent  Wem	PRO.Inter.Subst.-.Dat.Sg.Masc bringt	VFIN.Full.3.Sg.Pres.Ind dieses	PRO.Dem.Attr.-.Nom.Sg.Neut Volumen	N.Reg.Nom.Sg.Neut etwas	ADV ?	SYM.Pun.Sent  Denen	PRO.Dem.Subst.-.Dat.Pl.* ,	SYM.Pun.Comma die	PRO.Rel.Subst.-.Nom.Pl.Fem eh	ADV schon	ADV schwer	ADJD.Pos über	APPR.Über die	ART.Def.Acc.Pl.Fem Runden	N.Reg.Acc.Pl.Fem kommen	VINF.Full.- ,	SYM.Pun.Comma oder	CONJ.Coord.- jenen	PRO.Dem.Subst.-.Dat.Pl.* ,	SYM.Pun.Comma die	PRO.Rel.Subst.-.Nom.Pl.Fem jetzt	ADV schon	ADV zu	PART.Deg viel	PRO.Indef.Subst.-.*.*.* haben	VINF.Haben.- ?	SYM.Pun.Sent  An	APPR.An meinem	PRO.Poss.Attr.-.Dat.Sg.Masc Ton	N.Reg.Dat.Sg.Masc werden	VFIN.Aux.3.Pl.Pres.Ind Sie	PRO.Pers.Subst.3.Nom.Pl.* es	PRO.Pers.Subst.3.Acc.Sg.Neut vielleicht	ADV erkennen	VINF.Full.- :	SYM.Pun.Colon Es	PRO.Pers.Subst.3.Nom.Sg.Neut ist	VFIN.Sein.3.Sg.Pres.Ind leider	ADV schon	ADV wieder	ADV Zweiteres	PRO.Indef.Subst.-.Acc.Sg.Neut passiert	VFIN.Full.3.Sg.Pres.Ind .	SYM.Pun.Sent  ",False,False,True,True,False,True,True,True,True,True,True,False,False,False,False,False,False,True,True,True,True,True,Opinionated,
