Unnamed: 0,english,german_google_translate,label,imageability,unexpectedness_avg_glove,unexpectedness_min_glove,unexpectedness_avg_word2vec,unexpectedness_min_word2vec,polarity_senti_ws,polarity_text_blob,subjectivity_huggingface,vader_positive,vader_neutral,vader_negative,vader_compound
0,He gave a self-deprecating shrug.,Er gab einen selbstironischen Achselzucken.,0,1.8066,0.5898090170803387,0.5742872774790383,0.2711376386626442,0.22638437923375365,0.0,0.0,0.9302656054496765,0.0,1.0,0.0,0.0
1,He is so much more than a comedian.,Er ist so viel mehr als ein Komiker.,0,2.686125,0.5725090425381617,0.4283200996530792,0.27537711942229065,0.13040888694613112,0.0,0.0,0.9283452033996582,0.0,1.0,0.0,0.0
2,We were pelted with rotten tomatoes.,Wir waren mit faulen Tomaten ausgestoßen.,0,1.577,0.19972775604449827,0.06177076654516774,0.25126161968499594,0.029268169122436582,-0.005833333333333334,0.0,0.8420082926750183,0.0,0.667,0.333,-0.3612
3,Mind you don't tread in that puddle.,"Denken Sie daran, Sie treten nicht in dieser Pfütze.",0,1.297,0.5163385988111161,0.28738087880960256,0.28718099821423654,0.09367442733520463,0.0,0.0,0.9042271971702576,0.0,1.0,0.0,0.0
4,We've branded our cattle.,Wir haben unser Vieh gebrandmarkt.,0,2.1957999999999998,0.378156010003156,0.2232841312805577,0.31247753511367127,0.18745110173468213,0.0,0.0,0.31319350004196167,0.0,1.0,0.0,0.0
5,She has an earthy sense of humour.,Sie hat einen erdigen Sinn für Humor.,0,1.4937142857142856,0.33338119535753113,-0.04074342890030126,0.2816657672946222,0.1260711271630374,0.0,0.0,0.9405912160873413,0.533,0.467,0.0,0.6908
6,She just goes to pieces in exams.,Sie geht nur in Prüfungen in Stücke.,0,1.7367142857142857,0.4642986137322605,0.17151019992870123,0.31547451324252174,0.15291812160205218,0.0,0.0,0.027318894863128662,0.0,1.0,0.0,0.0
7,She bit the thread in two.,Sie biss den Faden in zwei Teile.,0,2.823,0.32202270593665855,0.10243462642493671,0.2449966054877497,0.15447679648726056,-0.0006857142857142857,0.0,0.12950289249420166,0.0,0.732,0.268,-0.296
8,My new hat was squished under his hips.,Mein neuer Hut wurde unter seine Hüften gequetscht.,0,2.382,0.2825574117739626,-0.03575783555340769,0.19536355503696437,0.004764031487404562,0.0005,0.0,0.9069036245346069,0.293,0.707,0.0,0.4404
9,He is punctual to a proverb.,Er ist pünktlich zu einem Sprichwort.,0,1.5401666666666667,0.38641178703119494,0.08196217755062397,0.18221557317567985,0.1043611651880949,0.0,1.0,0.8498653769493103,0.367,0.633,0.0,0.4404
10,She's merely a child.,Sie ist nur ein Kind.,0,1.6957999999999998,0.5965597873118169,0.4959936154537269,0.24233710962143898,0.10491169671897879,0.0,0.0,0.03239387273788452,0.0,1.0,0.0,0.0
11,Sophie is a glutton for books.,Sophie ist eine Vielfraß für Bücher.,0,2.562666666666667,0.2407197141136376,-0.041322630711910946,0.19627260938831917,0.12690518344175283,0.0,0.0,0.9416908025741577,0.0,1.0,0.0,0.0
12,How can you watch that drivel on TV?,Wie können Sie diesen Trottel im Fernsehen sehen?,0,2.5004999999999997,0.3769012733568501,0.019226406406075418,0.24038721598540555,0.06228912574675715,0.0,0.0,0.9379362463951111,0.0,1.0,0.0,0.0
13,History is one of his blind spots.,Die Geschichte ist einer seiner blinden Flecken.,0,1.278857142857143,0.4498166991061389,0.13891886014321475,0.23810943989518507,0.09364616549922587,-0.02825714285714286,-1.0,0.933638334274292,0.0,0.706,0.294,-0.3612
14,I ain't got my yellow card on me.,Ich habe meine gelbe Karte nicht auf mich.,0,2.824625,0.35926437579139037,0.1444793542975078,0.22917235775132735,0.05013469467736966,0.0,0.0,0.8887085318565369,0.0,1.0,0.0,0.0
15,Think twice before you do it.,"Überlegen Sie zweimal, bevor Sie es tun.",0,0.9748571428571429,0.5261834616364153,0.22417041203592344,0.49136122365556556,0.32735796269581563,0.0,0.7,0.689173698425293,0.221,0.779,0.0,0.1779
16,The row went on and on.,Die Reihe ging weiter und weiter.,0,2.2115,0.5247717534938542,0.4124227785596965,0.2956825327044514,0.12232421672455224,0.0,0.0,0.03425711393356323,0.0,1.0,0.0,0.0
17,I confess to a little bait and switch.,Ich gestehe einen kleinen Köder und Schalter.,0,1.4567142857142856,0.20016801849316024,-0.12434848112074623,0.22980937319717207,-0.024467831425697244,-0.03878571428571429,0.0,0.9292534589767456,0.0,0.811,0.189,-0.1027
18,Don't distract me while I'm driving!,"Lenu mich nicht ab, während ich fahre!",0,0.7034285714285715,0.2384050185186702,-0.27852011612040417,0.4849741338922189,0.2977825953267613,0.0,0.0,0.9079904556274414,0.0,1.0,0.0,0.0
19,Stop laying a guilt trip on me .,"Hör auf, eine Schuldreise auf mich zu legen.",0,1.6516250000000001,0.3373116518185656,0.16008685029589378,0.10945858064214374,0.02591845642105241,0.0,0.0,0.919486939907074,0.0,1.0,0.0,0.0
20,Let's drink to the bride and groom.,Lassen Sie uns in Braut und Bräutigam trinken.,0,2.790625,0.36287436369770926,0.18315433876616252,0.24499698562322006,0.06991196785894802,0.0,0.0,0.5983861684799194,0.0,1.0,0.0,0.0
21,Who's going to carve the turkey?,Wer wird den Truthahn schnitzen?,0,2.2504,0.23450503117397256,-0.008692387190855806,0.2568730207526305,0.10976200619599837,0.0,0.0,0.6515816450119019,0.0,1.0,0.0,0.0
22,That's a load of baloney.,Das ist eine Ladung Baloney.,0,2.8899999999999997,0.39911977270003596,0.20917086028490348,0.19537291558712322,0.08412441213621455,0.0,0.0,0.9365007281303406,0.0,1.0,0.0,0.0
23,I assume bail is moot?,"Ich nehme an, Kaution ist streitend?",0,0.7301666666666667,0.1948775228108567,0.0572949756042159,0.30631008149612865,0.018933767249451783,0.0,0.0,0.8214269280433655,0.0,1.0,0.0,0.0
24,He's not asleep - he's just pretending.,"Er schläft nicht - er tut nur so, als würde er so tun.",0,1.9768461538461537,0.5146908911602892,0.1319065728716885,0.3832129141880602,0.2000080887344796,0.0,0.0,0.9118186831474304,0.0,1.0,0.0,0.0
25,You can't foist your ideas on me.,Sie können Ihre Ideen auf mich nicht aufschieben.,0,0.9615,0.47316946550759276,0.26006807393600584,0.25007671318495045,0.06060908659230052,0.0,0.0,0.909824550151825,0.0,1.0,0.0,0.0
26,You have your sweater on inside out.,Sie haben Ihren Pullover auf innen nach außen.,0,3.2205,0.36429875841475445,0.04294134298724673,0.25915999269244755,0.1298833700511627,0.0,0.0,0.03180837631225586,0.0,1.0,0.0,0.0
27,Foxhunting is an abomination.,Foxhunting ist ein Gräuel.,0,1.2535,0.6253389822931081,0.6253389822931081,0.3930647426818985,0.3930647426818985,0.0,0.0,0.9344311356544495,0.0,1.0,0.0,0.0
28,There was Greek blood in his veins.,Da war griechisches Blut in seinen Adern.,0,2.029857142857143,0.30956015897100747,0.054365243084744934,0.16376371443205293,-0.017905112619468103,0.0,0.0,0.10097181797027588,0.0,1.0,0.0,0.0
29,Where else am I gonna go?,Wohin werde ich sonst gehen?,0,0.805,0.47390364506515864,0.3185671282147315,0.42586872351238236,0.3654496959343292,0.0,0.0,0.6973869204521179,0.0,1.0,0.0,0.0
30,They've eaten a whole pot of jam!,Sie haben einen ganzen Topf Marmelade gegessen!,0,3.177571428571429,0.2917671791328671,0.05939547818157835,0.2967977173846752,0.1260711271630374,0.0,0.0,0.907692015171051,0.0,1.0,0.0,0.0
31,Make a retro film with your images!,Machen Sie einen Retro -Film mit Ihren Bildern!,0,1.6721249999999999,0.4020898953179634,0.06325136565240687,0.25478363996787934,0.1260711271630374,0.0,0.0,0.8612844347953796,0.0,1.0,0.0,0.0
32,You will banish these ghastly thoughts.,Sie werden diese schrecklichen Gedanken verbannen.,0,0.5315,0.42606511909769895,0.1421115048340914,0.3568516507020952,0.16980745500342376,-0.004033333333333333,-1.0,0.9333885312080383,0.0,0.4,0.6,-0.7184
33,Does your dog bite?,Bittet dein Hund?,0,0.0,0.34142313533192287,0.34142313533192287,0.529979368397403,0.529979368397403,0.0,1.0,0.3409270644187927,0.0,1.0,0.0,0.0
34,Don't fritter away your precious time.,Verrissen Sie Ihre kostbare Zeit nicht.,0,2.3008333333333333,0.257223571627942,-0.007529647622454897,0.3459416166464844,0.14344894058877639,0.012950000000000001,1.0,0.9227885007858276,0.351,0.649,0.0,0.4019
35,It was his back playing him up.,"Es war sein Rücken, ihn aufzuspielen.",0,1.1663333333333334,0.608864001031286,0.4943798830051486,0.28777203679669333,0.17682092493962037,0.0,0.0,0.8767046332359314,0.0,1.0,0.0,0.0
36,Is this another of your daft ideas?,Ist dies ein weiterer Ihrer dummen Ideen?,0,1.131857142857143,0.3827223012224063,-0.005905437438251138,0.27154465395096944,-0.05614591282735501,-0.0843,-1.0,0.938461184501648,0.0,0.645,0.355,-0.5106
37,Your cousins are akin to you.,Ihre Cousins ​​sind Ihnen vergleichbar.,0,0.0,0.36707670433851847,0.20163139599666494,0.3779129713632748,0.3137296405173464,0.0,0.0,0.5142832398414612,0.0,1.0,0.0,0.0
38,Don't be so heartless!,Sei nicht so herzlos!,0,1.0055,0.6998738610694748,0.6551117143814412,0.4477685378036308,0.42461491247823274,0.0,-1.0,0.9262037873268127,0.545,0.455,0.0,0.5571
39,Pretty mouldy pay increase this year.,Ziemlich schimmelige Gehaltserhöhung in diesem Jahr.,0,2.0413333333333337,0.1954060303173319,-0.06984291101523012,0.20802691321922756,0.1365330991184916,-0.050666666666666665,0.0,0.9352271556854248,0.0,0.675,0.325,-0.3415
40,Let's rediscover life in the slow lane.,Lassen Sie uns das Leben in der langsamen Spur wieder entdecken.,0,2.8311818181818187,0.39556983095598997,0.030942095007678905,0.23022213181526213,0.037683855159049345,-0.001518181818181818,-0.7,0.8695719838142395,0.0,0.82,0.18,-0.296
41,He was faithful to me in weal and woe.,Er war mir in Weal und Weh treu.,0,2.33475,0.24191263922390002,-0.1637723948492491,0.30125207740111043,-0.05588636849007977,0.0,1.0,0.9256044626235962,0.34,0.66,0.0,0.5574
42,He won't dare to break his promise.,"Er wird es nicht wagen, sein Versprechen zu brechen.",0,1.7206666666666668,0.5291523787202238,0.2498505487457023,0.27829715202940325,0.13648548601643953,0.0,0.325,0.8573991656303406,0.0,0.513,0.487,-0.5722
43,She was a consummate performer.,Sie war eine vollendete Performerin.,0,1.3940000000000001,0.41795582918583124,0.23232577185031492,0.2672722417711346,0.19856879849202722,0.0,0.0,0.9298169612884521,0.0,1.0,0.0,0.0
44,He was hot for revenge.,Er war heiß für Rache.,0,1.7863999999999998,0.38989510271877026,0.1627705507451226,0.384620624543909,0.384620624543909,0.0,0.7,0.902881383895874,0.305,0.316,0.379,-0.1779
45,It felt like he was cracking a knuckle.,"Es fühlte sich an, als würde er einen Knöchel knacken.",0,2.2967999999999997,0.4034397457237317,0.014563605819393715,0.2460399494635278,0.1669669241077532,0.0,0.0,0.8537047505378723,0.0,1.0,0.0,0.0
46,Let my kite fly high.,Lass meinen Drachen hoch fliegen.,0,3.7638,0.26849201329477435,0.16303917801616993,0.4219336219305948,0.2907675559619135,0.0,0.7,0.9002602696418762,0.365,0.635,0.0,0.3182
47,She's still hale and hearty at 74.,Sie ist immer noch mit 74 Jahren hale und herzlich.,0,1.8611999999999997,0.47407726763783037,0.0743805476833473,0.26634337849188794,0.12885976035708363,0.0,1.0,0.9283308386802673,0.291,0.709,0.0,0.5719
48,Did you have a flu jab this year?,Hattest du dieses Jahr eine Grippeimpfung?,0,1.4033333333333333,0.3030121580084799,-0.05470023100518972,0.21329560196127328,0.0030491094199796,0.0,0.0,0.05375516414642334,0.0,1.0,0.0,0.0
49,That picture is askew.,Das Bild ist schief.,0,2.7119999999999997,0.4395712232248444,0.3626130287886911,0.1573263309598563,0.09321487900386213,0.0,0.0,0.92965167760849,0.0,1.0,0.0,0.0
50,They gave him the boot for coming late.,"Sie gaben ihm den Stiefel, weil er spät gekommen war.",0,1.6319,0.49392992070493386,0.2586423342196026,0.33141849074153124,0.20660771186756757,0.00747,0.0,0.0257146954536438,0.291,0.709,0.0,0.5719
51,She slathered her toast with butter.,Sie schob ihren Toast mit Butter.,0,1.9898333333333333,0.2489801972924613,0.015349407821450115,0.34443776526335224,0.21267495634636072,0.0,0.0,0.026969611644744873,0.0,1.0,0.0,0.0
52,She was a prissy little girl.,Sie war ein Prissy -kleines Mädchen.,0,0.8356666666666667,0.19682322251810433,-0.2293015757555405,0.22189811650598748,0.10491169671897879,0.0,0.0,0.9120951294898987,0.0,0.781,0.219,-0.1027
53,My uncle tipples brandy.,Mein Onkel Tipples Brandy.,0,1.5595,0.4464226969633314,0.4464226969633314,0.43582004221433096,0.43582004221433096,0.0,0.0,0.9351618885993958,0.0,1.0,0.0,0.0
54,The host bowed us in.,Der Gastgeber verneigte uns ein.,0,1.8405999999999998,0.07157143161555765,-0.17356389865596536,0.1878964620717282,0.043390922397291753,0.0,0.0,0.8743542432785034,0.0,1.0,0.0,0.0
55,Heavenly music swelled from nowhere.,Die himmlische Musik schwoll aus dem Nichts an.,0,2.259875,0.2546816148606637,-0.06734141212540834,0.25917417878407994,0.055241649894316035,0.0261,1.0,0.9105373024940491,0.386,0.614,0.0,0.6597
56,He was sent to prison on a bum rap.,Er wurde mit einem Penner Rap ins Gefängnis geschickt.,0,3.073111111111111,0.30356421766505487,-0.08754170428446449,0.24670848477339172,0.06728697123186735,0.0,1.0,0.05261242389678955,0.219,0.547,0.234,-0.0516
57,That's a comical hat you're wearing.,"Das ist ein komischer Hut, den du trägst.",0,1.626875,0.3296068500848063,-0.037123972426732786,0.20316730758836024,0.029982797917457532,0.0,1.0,0.9394077658653259,0.0,1.0,0.0,0.0
58,Just because I am not a misanthrope?,Nur weil ich kein Misanthrop bin?,0,1.23,0.32990691524042914,-0.07598728531271036,0.3538034619715117,0.1984931522958881,0.0,0.0,0.9233369827270508,0.0,1.0,0.0,0.0
59,You're a dirty liar!,Du bist ein schmutziger Lügner!,0,1.0028000000000001,0.22371883209166096,-0.032991313053334595,0.29641883913468176,0.08995650368494061,-0.05968,0.0,0.9422415494918823,0.0,0.326,0.674,-0.7345
60,Who designed the new school?,Wer hat die neue Schule entworfen?,0,2.487,0.45990428514225934,0.28747551322752996,0.258393761649343,0.1835901757591161,0.0006666666666666666,0.0,0.22354865074157715,0.367,0.633,0.0,0.4404
61,I will cherish every good to me.,Ich werde jedes Gut für mich schätzen.,0,1.1504285714285716,0.424802996878691,0.26409946218204444,0.3359912049978302,0.13338553519623367,0.0,1.0,0.9156736135482788,0.51,0.49,0.0,0.6369
62,I must be dashing off now.,Ich muss jetzt wegrutschen.,0,1.81975,0.5300269070597903,0.4646658009931249,0.31177584137361297,0.2764466750914801,0.0,0.0,0.8924475312232971,0.0,1.0,0.0,0.0
63,This man is a phoney.,Dieser Mann ist ein Phoney.,0,2.4905999999999997,0.5553280322262506,0.47390583529236446,0.30380752758466706,0.2610573025160976,0.0,0.0,0.9360789656639099,0.0,1.0,0.0,0.0
64,Doesn't Kate look gorgeous?,Sieht Kate nicht wunderschön aus?,0,2.846,0.21699652965018082,0.055132691077547945,0.3318942027134278,0.24570134552127543,0.0,-0.5,0.9174894690513611,0.0,0.554,0.446,-0.4973
65,He just scraped into college.,Er kratzte gerade das College.,0,2.6422,0.22963879834244727,-0.0531676800983488,0.3368230452030426,0.17041712468357464,0.0,0.0,0.06364351511001587,0.0,1.0,0.0,0.0
66,Shall I zip you up ?,Soll ich dich aufrollen?,0,0.74275,0.5432687177054533,0.37615007154054303,0.43044166322408073,0.23143434283365708,0.0,0.0,0.847832202911377,0.0,1.0,0.0,0.0
67,Are these real diamonds or paste?,Sind diese echten Diamanten oder Paste?,0,1.5360000000000003,0.39176504881523455,0.2192677158377506,0.31872965196515834,0.2299394561334084,0.0,1.0,0.8527460694313049,0.0,1.0,0.0,0.0
68,Do I look absurd in this hat?,Sehe ich in diesem Hut absurd aus?,0,2.0372857142857144,0.2712810321352944,0.07814583385284797,0.3276886482790376,-0.09972178380525018,0.0,-1.0,0.9308675527572632,0.0,0.769,0.231,-0.2023
69,Gods determine what you're going to be.,"Götter bestimmen, was Sie sein werden.",0,0.584,0.4563292058059305,0.258959208710889,0.28624362109940105,0.2497072875489719,0.0,0.0,0.38442176580429077,0.0,1.0,0.0,0.0
70,I wrote this sappy love song.,Ich habe dieses saftige Liebeslied geschrieben.,0,2.4253333333333336,0.2272557599635175,-0.02551835448030866,0.37703443300097184,0.11036898065259045,0.0,0.0,0.9275060892105103,0.0,1.0,0.0,0.0
71,He then descends to chop suey.,"Dann steigt er ab, um Suey zu hacken.",0,1.817625,0.3081775626724395,-0.11318655705940404,0.32247300279344093,0.19723595880365333,0.0005,0.0,0.11487877368927002,0.222,0.778,0.0,0.25
72,It was a jest rather than a reproach.,Es war eher ein Scherz als ein Vorwurf.,0,2.988625,0.47104257630788254,0.17529086456434534,0.3019056336666944,0.17992810124778308,0.0,0.0,0.9069132804870605,0.0,0.753,0.247,-0.3182
73,He just couldn't shake it off.,Er konnte es einfach nicht abschütteln.,0,2.1293333333333333,0.5723758304568507,0.3798682238394485,0.3286251380389424,0.19153151047537612,0.0,0.7,0.8701609969139099,0.315,0.685,0.0,0.3182
74,I pine for the countryside.,Ich kiefere für die Landschaft.,0,1.6448,0.40518877192875963,0.30293363574590887,0.03407011808478961,0.03407011808478961,0.0,0.0,0.9308827519416809,0.0,1.0,0.0,0.0
75,He had to bone up on his French.,Er musste auf seinem Französisch steigen.,0,2.2708333333333335,0.45359170882468375,0.26274748250998753,0.2739775476153579,0.136078678279803,0.0,0.0,0.6456880569458008,0.286,0.714,0.0,0.25
76,I have a feeling he'll come.,"Ich habe das Gefühl, dass er kommen wird.",0,2.288875,0.5080674148641532,0.38298498726640157,0.24681105875175866,0.07163797460514758,0.0,0.0,0.9076250195503235,0.0,1.0,0.0,0.0
77,He's my senior by three years.,Er ist drei Jahre lang mein Senior.,0,2.2027142857142854,0.48174039175762146,0.31045915371964555,0.21443211569921264,-0.0006105940167765171,0.0,0.0,0.06945180892944336,0.0,1.0,0.0,0.0
78,Bung your coat anywhere.,Stecke deinen Mantel überall.,0,1.81625,0.10667186757109468,-0.00970426473532688,0.5022408252284097,0.4428845560295651,0.0,0.0,0.544140636920929,0.0,1.0,0.0,0.0
79,Lay off bullying Jack.,Legen Sie Mobbing Jack ab.,0,2.8386000000000005,0.1927805502944713,0.024761812341101152,0.2917417912789161,0.17649240375376618,0.0,0.0,0.8995847702026367,0.0,1.0,0.0,0.0
80,There's no pat answer to that.,Darauf gibt es keine Pat -Antwort.,0,1.6776666666666669,0.47197226855594226,0.13762808030628088,0.2689260427408147,0.1257436589294541,0.0,0.0,0.03444993495941162,0.0,1.0,0.0,0.0
81,She gave a chuckle of delight.,Sie kicherte Freude.,0,0.0,0.0,0.0,0.0,0.0,0.0,0.0,0.9050129055976868,0.649,0.351,0.0,0.5719
82,That man gave her a dose of opium.,Dieser Mann gab ihr eine Dosis Opium.,0,2.241857142857143,0.42277635678132136,0.08447080943550658,0.24136665134958174,0.06351547514305937,0.0,0.0,0.028638362884521484,0.0,1.0,0.0,0.0
83,The party was a real booze - up.,Die Party war ein echter Alkohol - hoch.,0,2.6583750000000004,0.2779967360641895,-0.014220708982428288,0.16253985451329078,0.0001032541638405611,0.0,0.85,0.9397623538970947,0.277,0.723,0.0,0.3182
84,How impudent u are to say such a thing.,"Wie frech du bist, so etwas zu sagen.",0,1.6721249999999999,0.37710228237062154,0.08726384564407938,0.27570465453256926,-0.007028436367954545,0.0,-1.0,0.9359707832336426,0.0,0.778,0.222,-0.25
85,I was just phoning up for a chat.,Ich habe mich nur für einen Chat angerufen.,0,2.669625,0.3863389403494778,0.10125678804960404,0.27503862014114305,0.08041332449643548,0.0,0.0,0.025722384452819824,0.0,1.0,0.0,0.0
86,Does that old car still earn its keep?,Verdient dieses alte Auto immer noch seinen Aufbewahrung?,0,3.1403750000000006,0.433272148269384,0.1158010320904449,0.23855190493175732,0.02123635935407335,0.0117625,0.0,0.8879153728485107,0.243,0.583,0.175,0.1779
87,I'm after a tie to go with this shirt.,Ich bin nach einer Krawatte nach diesem Hemd.,0,2.6362500000000004,0.37804723064873097,0.03900555685976873,0.23795630376390117,-0.027029144185665727,0.0,0.0,0.02691066265106201,0.0,1.0,0.0,0.0
88,I've got no will power.,Ich habe keine Willenskraft.,0,1.12725,0.5565496950451168,0.4672787650477262,0.34298502624851246,0.22651540855040303,0.0,0.0,0.9011973142623901,0.0,1.0,0.0,0.0
89,Thanks for washing my pj's honey.,"Danke, dass du den Honig meines PJ gewaschen hast.",0,2.3253333333333335,0.15482880194106569,-0.031157241408695052,0.26798561890573713,0.029982797917457532,0.0,0.0,0.9157695174217224,0.266,0.734,0.0,0.4404
90,I want it with lettuce instead of peas.,Ich möchte es mit Salat anstelle von Erbsen.,0,2.916125,0.30801697903292174,0.049757539960458334,0.1909709077940551,-0.07413395290005485,0.043125,1.0,0.0703093409538269,0.278,0.722,0.0,0.4019
91,He had to prove himself all over again.,Er musste sich noch einmal beweisen.,0,2.189666666666667,0.6240857575731151,0.5293445978151378,0.3459639390674331,0.21321911771181642,0.0,1.0,0.45289433002471924,0.0,1.0,0.0,0.0
92,A big clap for our last contestant!,Ein großer Klatschen für unseren letzten Kandidaten!,0,2.1244285714285716,0.23521063994659416,-0.029976964842191308,0.3086681446857016,0.12697280719472814,0.05277142857142857,0.7,0.9396966099739075,0.285,0.715,0.0,0.3382
93,She tried to do away with herself.,Sie versuchte mit sich selbst zu beseitigen.,0,1.1757142857142857,0.5591075452457274,0.3651612329431751,0.2969835697169285,0.15469711461826535,0.0,0.0,0.05221480131149292,0.178,0.822,0.0,0.0772
94,She's one snappy dresser.,Sie ist eine bissige Kommode.,0,1.4772,0.33099754188152475,0.003022864251866183,0.3088567660552127,0.2769228158485632,0.0,-1.0,0.9330056309700012,0.231,0.769,0.0,0.0516
95,My roommate just got a Mac.,Mein Mitbewohner hat gerade einen Mac.,0,2.3935,0.3290026028022005,0.11352036207346984,0.3050722507213811,0.1282707774120277,0.0,0.0,0.031096339225769043,0.0,1.0,0.0,0.0
96,Don't give me that jazz!,Gib mir diesen Jazz nicht!,0,1.9240000000000002,0.25779892108101776,0.06166296440072206,0.26921617373299916,0.07490318032807422,0.0,0.0,0.9202684760093689,0.0,1.0,0.0,0.0
97,She certainly lives life to the full.,Sie lebt auf jeden Fall das Leben in vollen Zügen.,0,2.1273999999999997,0.3990513701587745,0.15867273937643145,0.2072950736981429,0.016640644985744607,0.0,0.0,0.919978141784668,0.0,1.0,0.0,0.0
98,They trampled his flowers out of spite.,Sie trampelten seine Blumen aus Trotz.,0,1.7181666666666668,0.20434546305986073,-0.21111235327513764,0.2020811795427806,0.09727702264103191,0.0,0.0,0.878601610660553,0.0,1.0,0.0,0.0
99,A tale of a woman fighting back?,"Eine Geschichte einer Frau, die sich wehrt?",0,1.8795714285714287,0.5996501661489153,0.4856811261345862,0.26569725327508065,0.0884870026509374,0.0,0.0,0.5742841958999634,0.0,1.0,0.0,0.0
100,Who's been fooling with the radio dial?,Wer hat mit dem Radio -Zifferblatt täuscht?,0,2.1355714285714287,0.39957575933549366,0.2515380807324889,0.19500768487701903,0.022135037752091344,0.0,0.0,0.9226163029670715,0.0,0.667,0.333,-0.4588
101,You have to grub up the roots.,Sie müssen die Wurzeln aufbauen.,0,2.317,0.45578886959692744,0.32606868973669406,0.37825355664141314,0.3187395115363447,0.0,0.0,0.43370890617370605,0.0,1.0,0.0,0.0
102,He got the boot.,Er bekam den Stiefel.,0,2.0564999999999998,0.5515484731337943,0.4626383868081524,0.3433949746486997,0.2146309315794892,0.0,0.0,0.027341008186340332,0.0,1.0,0.0,0.0
103,They don't have a prayer of winning.,Sie haben kein Gewinngebet.,0,1.12,0.5295575337500402,0.41604175084788747,0.1479175643367961,0.012375500700151634,0.0,0.0,0.5150145292282104,0.0,1.0,0.0,0.0
104,It annoys me when you fidget!,"Es nervt mich, wenn du zappst!",0,0.5823333333333334,0.29414565277861293,0.03452721662868827,0.3235176218979476,0.13875906329278598,-0.0229,0.0,0.9337223172187805,0.0,0.634,0.366,-0.4389
105,My brother is a little terror.,Mein Bruder ist ein kleiner Terror.,0,1.8813333333333333,0.4202028402424657,0.28637427653659636,0.254898023494834,-0.008810883051641996,-0.045250000000000005,0.0,0.9400701522827148,0.0,0.408,0.592,-0.7003
106,I parted with him for his dishonesty.,Ich trennte mich für seine Unehrlichkeit.,0,1.7080000000000002,0.3557707133286038,0.163359766059112,0.29974532156079425,0.1350532213177879,-0.08388333333333332,0.0,0.9215320944786072,0.0,0.471,0.529,-0.5423
107,You need to barber that beard of yours.,Sie müssen Ihren Bart von Ihnen brüllen.,0,2.061142857142857,0.44034928936839846,0.17554220630850093,0.28217736665068144,0.14865028093304916,0.0,-1.0,0.9214906096458435,0.0,1.0,0.0,0.0
108,Who's filched my pencils?,Wer hat meine Bleistifte gefilmt?,0,0.8130000000000001,0.2406981433014874,-0.00439064923439765,0.37238532839946503,0.2507309214936979,0.0,0.0,0.6117839217185974,0.0,1.0,0.0,0.0
109,You wanna tap out?,Willst du aussteigen?,0,0.0,0.5406628627579666,0.5406628627579666,0.4541812110495454,0.4541812110495454,0.0,0.0,0.107216477394104,0.0,1.0,0.0,0.0
110,I'll bet they have yummy ice cream.,"Ich wette, sie haben leckeres Eis.",0,0.7466666666666667,0.21798033040046672,-0.11161647251484334,0.3189758763799001,0.17449556971612135,0.0,0.0,0.925530731678009,0.0,1.0,0.0,0.0
111,Stop being such a snob.,"Hör auf, so ein Snob zu sein.",0,2.682,0.23046358554129656,-0.05109289889287618,0.25950951988063414,0.08491790209249431,0.0,0.0,0.9249608516693115,0.0,1.0,0.0,0.0
112,I think my watch is bust.,"Ich denke, meine Uhr ist Büste.",0,1.5778333333333334,0.3492268144054927,0.20036713115720778,0.19616709132322552,0.018933767249451783,0.0,0.0,0.9237160086631775,0.0,1.0,0.0,0.0
113,"Keep flax from fire,youth from gaming.","Halten Sie Flachs vom Feuer ab, Jugendliche vom Spielen.",0,3.347777777777778,0.30029179920596455,-0.044349244956232665,0.23161601348524855,0.02191942757563874,0.0,0.0,0.8995868563652039,0.0,0.792,0.208,-0.2732
114,"And, quite frankly, I just let rip.",Und ehrlich gesagt lasse ich einfach RIP.,0,2.4875714285714285,0.36018481516801715,0.15774578264862654,0.3573893550480294,-0.024467831425697244,0.0,0.85,0.9322923421859741,0.533,0.467,0.0,0.6908
115,It's time we dug up those potatoes.,"Es ist Zeit, dass wir diese Kartoffeln ausgegraben haben.",0,0.9495555555555555,0.38740080219437323,0.05845601571511022,0.2577279355589445,0.07389591062884389,0.0,0.0,0.9258303642272949,0.0,1.0,0.0,0.0
116,The frost has blighted my crops.,Der Frost hat meine Ernte geschmückt.,0,3.2631666666666668,0.27741650814313845,0.14282567951743266,0.249384653150667,0.1179959262117322,0.0,0.0,0.8880323767662048,0.342,0.658,0.0,0.3818
